name	year	overview	certificate	runtime	genre	imdb_rate	metascore	director	stars	nvote	gross
Tình Yêu Và Quái Vật	2020	Seven years after he survived the monster apocalypse, lovably hapless Joel leaves his cozy underground bunker behind on a quest to reunite with his ex.	PG-13	109.0	Action, Adventure, Comedy	6.9	63.0	Michael Matthews	Dylan O'Brien, Jessica Henwick, Michael Rooker, Dan Ewing	128572.0	1.07
Nhóc Trùm	2017	A suit-wearing, briefcase-carrying baby pairs up with his 7-year old brother to stop the dastardly plot of the CEO of Puppy Co.	PG	97.0	Animation, Adventure, Comedy	6.3		Tom McGrath	Alec Baldwin, Steve Buscemi, Jimmy Kimmel, Lisa Kudrow	128425.0	175.0
Nổi Loạn Tuổi 17	2016	High-school life gets even more unbearable for Nadine when her best friend, Krista, starts dating her older brother.	R	104.0	Comedy, Drama	7.3	77.0	Kelly Fremon Craig	Hailee Steinfeld, Haley Lu Richardson, Blake Jenner, Kyra Sedgwick	128064.0	14.43
Khẩu Chiến	2011	Two pairs of parents hold a cordial meeting after their sons are involved in a fight, though as their time together progresses, increasingly childish behavior throws the discussion into chaos.	R	80.0	Comedy, Drama	7.1	61.0	Roman Polanski	Jodie Foster, Kate Winslet, Christoph Waltz, John C. Reilly	127859.0	2.55
Cỗ Máy Tử Thần	2018	In a post-apocalyptic world where cities ride on wheels and consume each other to survive, two people meet in London and try to stop a conspiracy.	C16	128.0	Action, Adventure, Fantasy	6.1		Christian Rivers	Hera Hilmar, Robert Sheehan, Hugo Weaving, Jihae	127681.0	15.95
Gương Đen: Bandersnatch	2018	A young programmer starts to question reality when he adapts a mad writer's fantasy novel into a video game.	C18	90.0	Drama, Fantasy, Mystery	7.1		David Slade	Fionn Whitehead, Craig Parkinson, Alice Lowe, Asim Chaudhry	127572.0	
Tay Đấm Huyền Thoại 2	2018	Under the tutelage of Rocky Balboa, newly crowned heavyweight champion Adonis Creed faces off against Viktor Drago, the son of Ivan Drago.	PG-13	130.0	Drama, Sport	7.1	66.0	Steven Caple Jr.	Michael B. Jordan, Sylvester Stallone, Tessa Thompson, Phylicia Rashad	126948.0	115.72
Những Bà Mẹ 'Ngoan'	2016	When three overworked and under-appreciated moms are pushed beyond their limits, they ditch their conventional responsibilities for a jolt of long overdue freedom, fun and comedic self-indulgence.	R	100.0	Comedy	6.2		Jon Lucas, Scott Moore	Mila Kunis, Kathryn Hahn, Kristen Bell, Christina Applegate	126855.0	113.26
Vé Độc Thân	2011	Rick and Fred, two husbands who are having difficulty in their marriages, are given a Hall Pass by their wives: for one week, they can do whatever they want.	R	105.0	Comedy, Romance	5.9		Bobby Farrelly, Peter Farrelly	Owen Wilson, Jason Sudeikis, Christina Applegate, Jenna Fischer	126780.0	45.06
I Origins	2014	A molecular biologist and his laboratory partner uncover evidence that may fundamentally change society as we know it.	R	106.0	Drama, Mystery, Romance	7.3		Mike Cahill	Michael Pitt, Steven Yeun, Astrid Bergès-Frisbey, Brit Marling	126593.0	0.33
Safety Not Guaranteed	2012	Three magazine employees head out on an assignment to interview a guy who placed a classified advertisement seeking a companion for time travel.	R	86.0	Adventure, Comedy, Drama	6.9	72.0	Colin Trevorrow	Aubrey Plaza, Mark Duplass, Jake Johnson, Karan Soni	126522.0	4.01
Green Room	2015	A punk rock band is forced to fight for survival after witnessing a murder at a neo-Nazi skinhead bar.	R	95.0	Crime, Drama, Horror	7.0	79.0	Jeremy Saulnier	Anton Yelchin, Imogen Poots, Alia Shawkat, Patrick Stewart	126218.0	3.22
Bãhubali: The Beginning	2015	In ancient India, an adventurous and daring man becomes involved in a decades-old feud between two warring peoples.		159.0	Action, Drama	8.0		S.S. Rajamouli	Prabhas, Rana Daggubati, Anushka Shetty, Tamannaah Bhatia	126052.0	6.74
Tổng Đài Truy Vết	2021	A demoted police officer assigned to a call dispatch desk is conflicted when he receives an emergency phone call from a kidnapped woman.	C16	90.0	Crime, Drama, Thriller	6.3	63.0	Antoine Fuqua	Jake Gyllenhaal, Riley Keough, Peter Sarsgaard, Christina Vidal	125452.0	
Good Time	2017	After a botched bank robbery lands his younger brother in prison, Connie Nikas embarks on a twisted odyssey through New York City's underworld to get his brother Nick out of jail.	R	102.0	Crime, Drama, Thriller	7.3	80.0	Benny Safdie, Josh Safdie	Robert Pattinson, Benny Safdie, Jennifer Jason Leigh, Buddy Duress	125438.0	2.03
Lối Sống Đồi Trụy 2	2017	After 20 years abroad, Mark Renton returns to Scotland and reunites with his old friends Sick Boy, Spud, and Begbie.	R	117.0	Comedy, Drama	7.2	67.0	Danny Boyle	Ewan McGregor, Ewen Bremner, Jonny Lee Miller, Robert Carlyle	125315.0	2.4
Người Đàn Bà Cuồng Dâm: Phần 1	2013	A self-diagnosed nymphomaniac recounts her erotic experiences to the man who saved her after a beating.		117.0	Drama	6.9	64.0	Lars von Trier	Charlotte Gainsbourg, Stellan Skarsgård, Stacy Martin, Shia LaBeouf	125302.0	0.79
Tay Chơi Không Tuổi	2016	Right before his wedding, an uptight guy is tricked into driving his grandfather, a lecherous former Army Lieutenant Colonel, to Florida for Spring Break.	R	102.0	Comedy	5.9		Dan Mazer	Robert De Niro, Zac Efron, Zoey Deutch, Aubrey Plaza	125212.0	35.59
Hai Vị Giáo Hoàng	2019	Behind Vatican walls, the conservative Pope Benedict XVI and the liberal future Pope Francis must find common ground to forge a new path for the Catholic Church.	C16	125.0	Biography, Comedy, Drama	7.6	75.0	Fernando Meirelles	Jonathan Pryce, Anthony Hopkins, Juan Minujín, Luis Gnecco	124575.0	
Chuyện Gì Xảy Ra Với Thứ Hai	2017	In a world where families are limited to one child due to overpopulation, a set of identical septuplets must avoid being put to a long sleep by the government and dangerous infighting while investigating the disappearance of one of their own.	C18	123.0	Action, Crime, Fantasy	6.8		Tommy Wirkola	Noomi Rapace, Glenn Close, Willem Dafoe, Marwan Kenzari	124385.0	
Neighbors 2: Sorority Rising	2016	When their new next-door neighbors turn out to be a sorority even more debaucherous than the fraternity that lived there before, Mac and Kelly team with their former enemy, Teddy, to bring the girls down.	R	92.0	Comedy	5.7		Nicholas Stoller	Seth Rogen, Rose Byrne, Zac Efron, Chloë Grace Moretz	124201.0	55.46
Đột kích 2: Kẻ sát nhân	2014	Only a short time after the first raid, Rama goes undercover with the thugs of Jakarta and plans to bring down the syndicate and uncover the corruption within his police force.	R	150.0	Action, Crime, Thriller	7.9	71.0	Gareth Evans	Iko Uwais, Yayan Ruhian, Arifin Putra, Oka Antara	124182.0	2.63
Nếu Em Ở Lại	2014	Life changes in an instant for young Mia Hall after a car accident puts her in a coma. During an out-of-body experience, she must decide whether to wake up and live a life far different than she had imagined. The choice is hers if she can go on.	PG-13	107.0	Drama, Fantasy, Music	6.7		R.J. Cutler	Chloë Grace Moretz, Mireille Enos, Jamie Blackley, Joshua Leonard	124073.0	50.47
Đêm Ở Viện Bảo Tàng 3: Bí Mật Hầm Mộ	2014	Larry spans the globe, uniting favorite and new characters while embarking on an epic quest to save the magic before it is gone forever.	PG	98.0	Adventure, Comedy, Family	6.2		Shawn Levy	Ben Stiller, Robin Williams, Owen Wilson, Dick Van Dyke	124040.0	113.75
Căn Phòng Tử Thần	2019	Six strangers find themselves in a maze of deadly mystery rooms and must use their wits to survive.	C16	99.0	Action, Adventure, Horror	6.4		Adam Robitel	Taylor Russell, Logan Miller, Jay Ellis, Tyler Labine	124026.0	57.01
Parker	2013	A thief with a unique code of professional ethics is double-crossed by his crew and left for dead. Assuming a new disguise and forming an unlikely alliance with a woman on the inside, he looks to hijack the score of the crew's latest heist.	R	118.0	Action, Crime, Thriller	6.2		Taylor Hackford	Jason Statham, Jennifer Lopez, Michael Chiklis, Nick Nolte	123867.0	17.62
Dị Biệt: Những Kẻ Trung Kiên	2016	After the earth-shattering revelations of Insurgent, Tris must escape with Four beyond the wall that encircles Chicago, to finally discover the shocking truth of the world around them.	PG-13	120.0	Action, Adventure, Mystery	5.7		Robert Schwentke	Shailene Woodley, Theo James, Jeff Daniels, Naomi Watts	123738.0	66.18
The Call	2013	When a veteran 911 operator takes a life-altering call from a teenage girl who has just been abducted, she realizes that she must confront a killer from her past in order to save the girl's life.	R	96.0	Drama, Thriller	6.7		Brad Anderson	Halle Berry, Evie Thompson, Abigail Breslin, Morris Chestnut	123695.0	51.87
Tòa Tháp Chọc Trời	2018	A security expert must infiltrate a burning skyscraper, 225 stories above ground, when his family is trapped inside by criminals.	C16	102.0	Action, Adventure, Thriller	5.8		Rawson Marshall Thurber	Dwayne Johnson, Neve Campbell, Chin Han, Roland Møller	123625.0	68.42
Phi Vụ Ngầm	2012	To protect his brother-in-law from a drug lord, a former smuggler heads to Panama to score millions of dollars in counterfeit bills.	R	109.0	Action, Crime, Drama	6.4		Baltasar Kormákur	Mark Wahlberg, Giovanni Ribisi, Kate Beckinsale, Robert Wahlberg	123505.0	66.53
Xác Chết Biết Nói	2016	A hopeless man stranded on a deserted island befriends a dead body, and together they go on a surreal journey to get home.	R	97.0	Comedy, Drama, Fantasy	6.9	64.0	Dan Kwan, Daniel Scheinert	Paul Dano, Daniel Radcliffe, Mary Elizabeth Winstead, Antonia Ribero	123076.0	4.21
Cô Bạn Bí Ẩn	2010	A bullied young boy befriends a young female vampire who lives in secrecy with her guardian.	R	116.0	Drama, Fantasy, Horror	7.1	79.0	Matt Reeves	Kodi Smit-McPhee, Chloë Grace Moretz, Richard Jenkins, Cara Buono	122850.0	12.13
Siêu Lợn Okja	2017	A young girl risks everything to prevent a powerful, multinational company from kidnapping her best friend - a fascinating beast named Okja.		120.0	Action, Adventure, Drama	7.3	75.0	Bong Joon Ho	Tilda Swinton, Paul Dano, Seo-hyun Ahn, Jake Gyllenhaal	122673.0	
Lối Đi Giữa Rừng Bia Mộ	2014	Private investigator Matthew Scudder is hired by a drug kingpin to find out who kidnapped and murdered his wife.	R	114.0	Action, Crime, Drama	6.5		Scott Frank	Liam Neeson, Dan Stevens, David Harbour, Boyd Holbrook	122580.0	26.31
Bệnh Điên	2010	After a strange and insecure plane crash, an unusual toxic virus enters a quaint farming town. A young couple are quarantined, but they fight for survival along with help from a couple of people.	R	101.0	Adventure, Horror	6.5		Breck Eisner	Radha Mitchell, Timothy Olyphant, Danielle Panabaker, Joe Anderson	122417.0	39.12
Tờ Báo Công Văn Pháp	2020	"A love letter to journalists set in an outpost of an American newspaper in a fictional twentieth century French city that brings to life a collection of stories published in ""The French Dispatch Magazine""."	R	107.0	Comedy, Drama, Romance	7.1	74.0	Wes Anderson	Benicio Del Toro, Adrien Brody, Tilda Swinton, Léa Seydoux	122136.0	
Cuộc Chiến Kargil	2021	Shershaah is the story of PVC awardee Indian soldier Capt. Vikram Batra, whose bravery and unflinching courage in chasing the Pakistani soldiers out of Indian territory contributed immensely in India finally winning the Kargil War in 1999.		135.0	Action, Biography, Drama	8.4		Vishnuvardhan	Sidharth Malhotra, Kiara Advani, Shiv Panditt, Pranay Pachauri	121759.0	
Bước Đường Cùng	2013	A former DEA agent moves his family to a quiet town, where he soon tangles with a local meth druglord.	R	100.0	Action, Crime, Thriller	6.5		Gary Fleder	Jason Statham, James Franco, Winona Ryder, Kate Bosworth	121667.0	20.16
Bố Ngoan, Bố Hư	2015	Brad Whitaker is a radio host trying to get his stepchildren to love him and call him Dad. But his plans turn upside down when their biological father, Dusty Mayron, returns.	PG-13	96.0	Comedy, Family	6.1		Sean Anders	Will Ferrell, Mark Wahlberg, Linda Cardellini, Thomas Haden Church	121314.0	150.36
Già	2021	A vacationing family discovers that the secluded beach where they're relaxing for a few hours is somehow causing them to age rapidly, reducing their entire lives into a single day.	PG-13	108.0	Drama, Horror, Mystery	5.8		M. Night Shyamalan	Gael García Bernal, Vicky Krieps, Rufus Sewell, Alex Wolff	120922.0	
Giáo Sĩ	2011	A priest disobeys church law to track down the vampires who kidnapped his niece.	PG-13	87.0	Action, Fantasy, Horror	5.7		Scott Stewart	Paul Bettany, Cam Gigandet, Maggie Q, Karl Urban	120745.0	29.14
Ẩn Số Tình Yêu	2010	Intertwining couples and singles in Los Angeles break-up and make-up based on the pressures and expectations of Valentine's Day.	PG-13	125.0	Comedy, Romance	5.7		Garry Marshall	Julia Roberts, Jamie Foxx, Anne Hathaway, Jessica Alba	120659.0	110.49
Ma Tốc Độ: Linh Hồn Báo Thù	2011	Johnny Blaze, tortured by the Ghost Rider's curse, gets a chance of redemption through protecting the Devil's son, whose father is pursuing him.	C16	96.0	Action, Fantasy, Thriller	4.3		Mark Neveldine, Brian Taylor	Nicolas Cage, Ciarán Hinds, Idris Elba, Violante Placido	120610.0	51.77
Bùng Cháy	2015	Adam Jones is a chef who destroyed his career with drugs and diva behavior. He cleans up and returns to London, determined to redeem himself by spearheading a top restaurant that can gain three Michelin stars.	R	101.0	Comedy, Drama	6.6		John Wells	Bradley Cooper, Sienna Miller, Daniel Brühl, Riccardo Scamarcio	120484.0	13.65
Người Truyền Ký Ức	2014	"In a seemingly perfect community without war, pain, suffering, differences, or choices, a young boy is chosen to learn from an elderly man about the true pain and pleasure of the ""real"" world."	C13	97.0	Drama, Romance, Sci-Fi	6.4		Phillip Noyce	Brenton Thwaites, Jeff Bridges, Meryl Streep, Taylor Swift	120427.0	45.09
You Were Never Really Here	2017	A traumatized veteran unafraid of violence tracks down missing girls for a living. When a job spins out of control, Joe's nightmares overtake him as a conspiracy is uncovered leading to what could be his death trip or his awakening.	R	89.0	Crime, Drama	6.7	84.0	Lynne Ramsay	Joaquin Phoenix, Judith Roberts, Ekaterina Samsonov, John Doman	120392.0	2.52
Đêm Trước Lễ Tốt Nghiệp	2019	On the eve of their high-school graduation, two academic superstars and best friends realize they should have worked less and played more. Determined not to fall short of their peers, the girls try to cram four years of fun into one night.	R	102.0	Comedy	7.1	84.0	Olivia Wilde	Kaitlyn Dever, Beanie Feldstein, Jessica Williams, Jason Sudeikis	120368.0	22.68
The Autopsy of Jane Doe	2016	A father and son, both coroners, are pulled into a complex mystery while attempting to identify the body of a young woman, who was apparently harboring dark secrets.	R	86.0	Horror, Mystery, Thriller	6.8	65.0	André Øvredal	Brian Cox, Emile Hirsch, Ophelia Lovibond, Michael McElhatton	120361.0	0.01
Kẻ Lập Dị	2013	A lonely art expert working for a mysterious and reclusive heiress finds not only her art worth examining.	R	131.0	Crime, Drama, Mystery	7.8		Giuseppe Tornatore	Geoffrey Rush, Jim Sturgess, Sylvia Hoeks, Donald Sutherland	120350.0	0.09
Percy Jackson: Biển Quái Vật	2013	In order to restore their dying safe haven, the son of Poseidon and his friends embark on a quest to the Sea of Monsters, to find the mythical Golden Fleece, all the while trying to stop an ancient evil from rising.	P	106.0	Adventure, Family, Fantasy	5.7		Thor Freudenthal	Logan Lerman, Alexandra Daddario, Brandon T. Jackson, Nathan Fillion	119338.0	68.56
Nebraska	2013	An aging, booze-addled father makes the trip from Montana to Nebraska with his estranged son in order to claim a million-dollar Mega Sweepstakes Marketing prize.	R	115.0	Adventure, Comedy, Drama	7.7	86.0	Alexander Payne	Bruce Dern, Will Forte, June Squibb, Bob Odenkirk	119002.0	17.65
Pacific Rim: Trỗi Dậy	2018	Jake Pentecost, son of Stacker Pentecost, reunites with Mako Mori to lead a new generation of Jaeger pilots, including rival Lambert and 15-year-old hacker Amara, against a new Kaiju threat.	C13	111.0	Action, Adventure, Fantasy	5.6		Steven S. DeKnight	John Boyega, Scott Eastwood, Cailee Spaeny, Burn Gorman	118532.0	59.87
Các Vị Thần Ai Cập	2016	Mortal hero Bek teams with the god Horus in an alliance against Set, the merciless god of darkness, who has usurped Egypt's throne, plunging the once peaceful and prosperous empire into chaos and conflict.	C16	127.0	Action, Adventure, Fantasy	5.4		Alex Proyas	Brenton Thwaites, Nikolaj Coster-Waldau, Gerard Butler, Chadwick Boseman	118389.0	31.15
Gấu Paddington	2014	A young Peruvian bear travels to London in search of a home. Finding himself lost and alone at Paddington Station, he meets the kindly Brown family, who offer him a temporary haven.	PG	95.0	Adventure, Comedy, Family	7.3	77.0	Paul King	Hugh Bonneville, Sally Hawkins, Julie Walters, Jim Broadbent	118253.0	76.27
Paris Rực Lửa	2010	In Paris, a young employee in the office of the US Ambassador hooks up with an American spy looking to stop a terrorist attack in the city.	R	92.0	Action, Crime, Thriller	6.4		Pierre Morel	John Travolta, Jonathan Rhys Meyers, Kasia Smutniak, Richard Durden	118084.0	23.98
Greenland: Thảm Họa Thiên Thạch	2020	A family struggles for survival in the face of a cataclysmic natural disaster.	C16	119.0	Action, Thriller	6.4	64.0	Ric Roman Waugh	Gerard Butler, Morena Baccarin, Roger Dale Floyd, Scott Glenn	118062.0	
Cô Bé Thần Đồng	2017	Frank, a single man raising his child prodigy niece Mary, is drawn into a custody battle with his mother.	PG-13	101.0	Drama	7.6		Marc Webb	Chris Evans, Mckenna Grace, Lindsay Duncan, Octavia Spencer	118043.0	24.8
Lưỡi Hái Tử Thần 5	2011	Death returns to claim the lucky survivors of a deadly bridge collapse in this fifth frightening installment in the series.	R	92.0	Horror, Thriller	5.9		Steven Quale	Nicholas D'Agosto, Emma Bell, Arlen Escarpeta, Miles Fisher	117846.0	42.59
Đơn Giản Tôi Là Mafia	2013	The Manzoni family, a notorious mafia clan, is relocated to Normandy, France under the Witness Protection Program, where fitting in soon becomes challenging, as their old habits die hard.	R	111.0	Comedy, Crime, Thriller	6.3		Luc Besson	Robert De Niro, Michelle Pfeiffer, Dianna Agron, John D'Leo	117753.0	36.92
Đường Về	2010	Siberian gulag escapees travel four thousand miles by foot to freedom in India.	PG-13	133.0	Adventure, Drama, History	7.3	66.0	Peter Weir	Jim Sturgess, Ed Harris, Colin Farrell, Dragos Bucur	117525.0	2.7
Đi Tìm Công Lý	2013	When Rodney Baze mysteriously disappears and law enforcement doesn't follow through fast enough, his older brother, Russell, takes matters into his own hands to find justice.	R	116.0	Action, Crime, Drama	6.7	63.0	Scott Cooper	Christian Bale, Casey Affleck, Zoe Saldana, Woody Harrelson	117360.0	11.33
Ngôi Sao Gánh Xiếc	2011	Set in the 1930s, a former veterinary student takes a job in a travelling circus and falls in love with the ringmaster's wife.	PG-13	122.0	Drama, Romance	6.9		Francis Lawrence	Robert Pattinson, Reese Witherspoon, Christoph Waltz, Paul Schneider	117204.0	58.71
Chú Khủng Long Tốt Bụng	2015	In a world where dinosaurs and humans live side-by-side, an Apatosaurus named Arlo makes an unlikely human friend.	P	93.0	Animation, Adventure, Comedy	6.7	66.0	Peter Sohn	Jeffrey Wright, Frances McDormand, Maleah Nipay-Padilla, Ryan Teeple	117047.0	123.09
Hành Khách Bí Ẩn	2018	An insurance salesman/ex-cop is caught up in a life-threatening conspiracy during his daily commute home.	C16	104.0	Action, Mystery, Thriller	6.3		Jaume Collet-Serra	Liam Neeson, Vera Farmiga, Patrick Wilson, Jonathan Banks	117002.0	36.34
Soorarai Pottru	2020	"Nedumaaran Rajangam ""Maara"" sets out to make the common man fly and in the process takes on the world's most capital intensive industry and several enemies who stand in his way."		153.0	Drama	8.7		Sudha Kongara	Suriya, Paresh Rawal, Aparna Balamurali, Achyuth Kumar	116969.0	
Ám Ảnh Kinh Hoàng: Ma Xui Quỷ Khiến	2021	The Warrens investigate a murder that may be linked to a demonic possession.	C16	112.0	Horror, Mystery, Thriller	6.3		Michael Chaves	Patrick Wilson, Vera Farmiga, Ruairi O'Connor, Sarah Catherine Hook	116265.0	65.63
Tin 'Nóng'	2019	A group of women take on Fox News head Roger Ailes and the toxic atmosphere he presided over at the network.	C18	109.0	Biography, Drama	6.8	64.0	Jay Roach	Charlize Theron, Nicole Kidman, Margot Robbie, John Lithgow	116106.0	
Thương Mến, Simon	2018	Simon Spier keeps a huge secret from his family, his friends and all of his classmates: he's gay. When that secret is threatened, Simon must face everyone and come to terms with his identity.	C18	110.0	Comedy, Drama, Romance	7.5	72.0	Greg Berlanti	Nick Robinson, Jennifer Garner, Josh Duhamel, Katherine Langford	116098.0	40.83
Quản Gia Nhà Trắng	2013	As Cecil Gaines serves eight presidents during his tenure as a butler at the White House, the civil rights movement, Vietnam, and other major events affect this man's life, family, and American society.	PG-13	132.0	Biography, Drama	7.2	65.0	Lee Daniels	Forest Whitaker, Oprah Winfrey, John Cusack, Jane Fonda	115891.0	116.63
Kẻ Ngoại Tộc	2017	A humble businessman with a buried past seeks justice when his daughter is killed in an act of terrorism. A cat-and-mouse conflict ensues with a government official, whose past may hold clues to the killers' identities.	C18	113.0	Action, Thriller	7.0		Martin Campbell	Katie Leung, Jackie Chan, Rufus Jones, Mark Tandy	115889.0	34.39
Vat Chu	2013	When an unseen enemy threatens mankind by taking over their bodies and erasing their memories, Melanie Stryder risks everything to protect the people she cares about.	C16	125.0	Action, Adventure, Drama	5.8		Andrew Niccol	Saoirse Ronan, Max Irons, Jake Abel, Diane Kruger	115789.0	26.63
Dự Án Florida	2017	Set over one summer, the film follows precocious six-year-old Moonee as she courts mischief and adventure with her ragtag playmates and bonds with her rebellious but caring mother, all while living in the shadows of Walt Disney World.	R	111.0	Drama	7.6	92.0	Sean Baker	Brooklynn Prince, Bria Vinaite, Willem Dafoe, Christopher Rivera	115735.0	5.9
Cuộc Săn Lùng	2020	Twelve strangers wake up in a clearing. They don't know where they are, or how they got there. They don't know they've been chosen - for a very specific purpose - The Hunt.	R	90.0	Action, Horror, Thriller	6.5		Craig Zobel	Betty Gilpin, Hilary Swank, Ike Barinholtz, Wayne Duvall	115622.0	
Bộ Đôi Cảnh Sát	2014	Security guard Ben must prove himself to his girlfriend's brother, top police officer James. He rides along James on a 24-hour patrol of Atlanta.	PG-13	99.0	Action, Comedy, Crime	6.1		Tim Story	Ice Cube, Kevin Hart, Tika Sumpter, John Leguizamo	115537.0	134.94
Tri Ky Ngày Tân Thê	2012	As an asteroid nears Earth, a man finds himself alone after his wife leaves in a panic. He decides to take a road trip to reunite with his high school sweetheart. Accompanying him is a neighbor who inadvertently puts a wrench in his plan.	R	101.0	Adventure, Comedy, Drama	6.7		Lorene Scafaria	Steve Carell, Keira Knightley, Melanie Lynskey, Patton Oswalt	115235.0	6.62
Bố Vợ Đối Đầu Chàng Rể	2016	A holiday gathering threatens to go off the rails when Ned Fleming realizes that his daughter's Silicon Valley millionaire boyfriend is about to pop the question.	R	111.0	Comedy	6.2		John Hamburg	Zoey Deutch, James Franco, Tangie Ambrose, Cedric the Entertainer	114901.0	60.32
Thần Lorax	2012	A 12-year-old boy searches for the one thing that will enable him to win the affection of the girl of his dreams. To find it he must discover the story of the Lorax, the grumpy yet charming creature who fights to protect his world.	P	86.0	Animation, Adventure, Comedy	6.4		Chris Renaud, Kyle Balda	Zac Efron, Taylor Swift, Danny DeVito, Ed Helms	114882.0	214.03
Tình Yêu Chân Thật	2021	The story of Alana Kane and Gary Valentine growing up, running around and going through the treacherous navigation of first love in the San Fernando Valley, 1973.	R	133.0	Comedy, Drama, Romance	7.2	90.0	Paul Thomas Anderson	Alana Haim, Cooper Hoffman, Sean Penn, Tom Waits	114855.0	
Tốc Độ Kinh Hoàng	2012	In Manhattan, a bike messenger picks up an envelope that attracts the interest of a dirty cop, who pursues the cyclist throughout the city.	PG-13	91.0	Action, Crime, Thriller	6.5	66.0	David Koepp	Joseph Gordon-Levitt, Michael Shannon, Dania Ramirez, Sean Kennedy	114797.0	20.28
Mê Cung Ký Uc	2013	An art auctioneer becomes mixed up with a group of criminals partners with a hypnotherapist in order to recover a lost painting.	R	101.0	Crime, Drama, Mystery	6.9	61.0	Danny Boyle	James McAvoy, Rosario Dawson, Vincent Cassel, Danny Sapani	114729.0	2.32
Đàn Ông Song Tử	2019	An over-the-hill hitman faces off against a younger clone of himself.	C16	117.0	Action, Adventure, Sci-Fi	5.7		Ang Lee	Will Smith, Mary Elizabeth Winstead, Clive Owen, Benedict Wong	114429.0	48.55
Silence	2016	In the 17th century, two Portuguese Jesuit priests travel to Japan in an attempt to locate their mentor, who is rumored to have committed apostasy, and to propagate Catholicism.	R	161.0	Drama, History	7.1	79.0	Martin Scorsese	Andrew Garfield, Adam Driver, Liam Neeson, Tadanobu Asano	114057.0	7.1
Gặp Gỡ Thông Gia: Nhóc Fockers	2010	Family-patriarch Jack Byrnes wants to appoint a successor. Does his son-in-law, the male nurse Greg Focker, have what it takes?	PG-13	98.0	Comedy, Romance	5.5		Paul Weitz	Ben Stiller, Teri Polo, Robert De Niro, Owen Wilson	113863.0	148.38
