name	year	overview	certificate	runtime	genre	imdb_rate	metascore	director	stars	nvote	gross
Siêu Nhí Karate	2010	Work causes a single mother to move to China with her young son; in his new home, the boy embraces kung fu, taught to him by a master.	PG	140.0	Action, Drama, Family	6.2	61.0	Harald Zwart	Jackie Chan, Jaden Smith, Taraji P. Henson, Wenwen Han	185915.0	176.59
Chúng Ta Làm Gì Trong Bóng Tối	2014	Viago, Deacon, and Vladislav are vampires who are struggling with the mundane aspects of modern life, like paying rent, keeping up with the chore wheel, trying to get into nightclubs, and overcoming flatmate conflicts.	R	86.0	Comedy, Horror	7.6	76.0	Jemaine Clement, Taika Waititi	Jemaine Clement, Taika Waititi, Cori Gonzalez-Macuer, Jonny Brugh	185581.0	3.33
Người Đàn Bà Áo Đen	2012	A young solicitor travels to a remote village where he discovers that the vengeful ghost of a scorned woman is terrorizing the locals.	PG-13	95.0	Drama, Fantasy, Horror	6.4	62.0	James Watkins	Daniel Radcliffe, Janet McTeer, Ciarán Hinds, Emma Shorey	185200.0	54.33
Song Sinh Sát Thủ	2015	Identical twin gangsters Ronald and Reginald Kray terrorize London during the 1960s.	R	132.0	Biography, Crime, Drama	6.9		Brian Helgeland	Tom Hardy, Emily Browning, Taron Egerton, Paul Anderson	184549.0	1.87
Đổi Vai	2011	Dave is a married man with three kids and a loving wife, and Mitch is a single man who is at the prime of his sexual life. One fateful night while Mitch and Dave are peeing in a fountain, lightning strikes and they switch bodies.	R	112.0	Comedy, Fantasy	6.3		David Dobkin	Jason Bateman, Ryan Reynolds, Olivia Wilde, Leslie Mann	184464.0	37.24
Melancholia: Ngày Tận Thế	2011	Two sisters find their already strained relationship challenged as a mysterious new planet threatens to collide with Earth.	R	135.0	Drama, Sci-Fi	7.1	80.0	Lars von Trier	Kirsten Dunst, Charlotte Gainsbourg, Kiefer Sutherland, Alexander Skarsgård	184368.0	3.03
Chúa Tể Godzilla: Đế Vương Bất Tử	2019	The crypto-zoological agency Monarch faces off against a battery of god-sized monsters, including the mighty Godzilla, who collides with Mothra, Rodan, and his ultimate nemesis, the three-headed King Ghidorah.	C13	132.0	Action, Adventure, Fantasy	6.0		Michael Dougherty	Kyle Chandler, Vera Farmiga, Millie Bobby Brown, Ken Watanabe	184133.0	110.5
Biệt Đội Đánh Thuê 3	2014	Barney augments his team with new blood for a personal battle: to take down Conrad Stonebanks, the Expendables co-founder and notorious arms trader who is hell bent on wiping out Barney and every single one of his associates.	C16	126.0	Action, Adventure, Thriller	6.1		Patrick Hughes	Sylvester Stallone, Jason Statham, Jet Li, Antonio Banderas	184011.0	39.32
Thế Giới Bí Ẩn	2015	Bound by a shared destiny, a teen bursting with scientific curiosity and a former boy-genius inventor embark on a mission to unearth the secrets of a place somewhere in time and space that exists in their collective memory.	C13	130.0	Action, Adventure, Family	6.4		Brad Bird	George Clooney, Britt Robertson, Hugh Laurie, Raffey Cassidy	183686.0	93.44
Sắc Đẹp Vĩnh Cửu	2015	A young woman, born at the turn of the 20th century, is rendered ageless after an accident. After many solitary years, she meets a man who complicates the eternal life she has settled into.	PG-13	112.0	Drama, Fantasy, Romance	7.2		Lee Toland Krieger	Blake Lively, Michiel Huisman, Harrison Ford, Kathy Baker	183514.0	42.48
Huyền Thoại Tiếp Diễn	2013	With the 1970s behind them, San Diego's top-rated newsman, Ron Burgundy, returns to take New York City's first twenty-four-hour news channel by storm.	PG-13	119.0	Comedy	6.3	61.0	Adam McKay	Will Ferrell, Christina Applegate, Paul Rudd, Steve Carell	183314.0	127.35
Madagascar 3: Thần Tượng Châu Âu	2012	The Madagascar animals join a struggling European circus to get back to New York, but find themselves being pursued by a psychotic animal-control officer.	P	95.0	Animation, Adventure, Comedy	6.8		Eric Darnell, Tom McGrath, Conrad Vernon	Ben Stiller, Jada Pinkett Smith, Chris Rock, David Schwimmer	183165.0	216.39
Valerian và Thành Phố Ngàn Hành Tinh	2017	A dark force threatens Alpha, a vast metropolis and home to species from a thousand planets. Special operatives Valerian and Laureline must race to identify the marauding menace and safeguard not just Alpha, but the future of the universe.	C13	136.0	Action, Adventure, Fantasy	6.4		Luc Besson	Dane DeHaan, Cara Delevingne, Clive Owen, Rihanna	183070.0	41.19
Mẹ Ma	2013	After a young couple take in their two nieces, they suspect that a supernatural spirit named Mama has latched onto their family.	C16	100.0	Fantasy, Horror, Thriller	6.2		Andy Muschietti	Jessica Chastain, Nikolaj Coster-Waldau, Megan Charpentier, Isabelle Nélisse	182733.0	71.63
Bố Già Huyền Thoại	2015	The true story of Whitey Bulger, the brother of a state senator and the most infamous violent criminal in the history of South Boston, who became an FBI informant to take down a Mafia family invading his turf.	R	123.0	Biography, Crime, Drama	6.9	68.0	Scott Cooper	Johnny Depp, Benedict Cumberbatch, Dakota Johnson, Joel Edgerton	182667.0	62.58
Biệt Đội G.I. Joe: Báo Thù	2013	The G.I. Joes are not only fighting their mortal enemy Cobra; they are forced to contend with threats from within the government that jeopardize their very existence.	PG-13	110.0	Action, Adventure, Sci-Fi	5.7		Jon M. Chu	Dwayne Johnson, Channing Tatum, Adrianne Palicki, Lee Byung-hun	182443.0	122.52
Biệt Đội Săn Ma: Chuyển Kiếp	2021	When a single mom and her two kids arrive in a small town, they begin to discover their connection to the original Ghostbusters and the secret legacy their grandfather left behind.	C13	124.0	Adventure, Comedy, Fantasy	7.1		Jason Reitman	Carrie Coon, Paul Rudd, Finn Wolfhard, Mckenna Grace	182335.0	129.36
Kỳ Nghỉ Kinh Hoàng	2010	Affable hillbillies Tucker and Dale are on vacation at their dilapidated mountain cabin when they are mistaken for murderers by a group of preppy college students.	R	89.0	Comedy, Horror	7.5	65.0	Eli Craig	Tyler Labine, Alan Tudyk, Katrina Bowden, Jesse Moss	182143.0	0.22
Vùng Đất Thây Ma: Cú Bắn Đúp	2019	Columbus, Tallahassee, Wichita, and Little Rock move to the American heartland as they face off against evolved zombies, fellow survivors, and the growing pains of the snarky makeshift family.	C18	99.0	Action, Comedy, Horror	6.7		Ruben Fleischer	Woody Harrelson, Jesse Eisenberg, Emma Stone, Abigail Breslin	181256.0	73.12
Thảm Họa Los Angeles	2011	A squad of U.S. Marines becomes the last line of defense against a global invasion.	PG-13	116.0	Action, Adventure, Sci-Fi	5.7		Jonathan Liebesman	Aaron Eckhart, Michelle Rodriguez, Bridget Moynahan, Ramón Rodríguez	181161.0	83.55
Ngày Độc Lập: Tái Chiến	2016	Two decades after the first Independence Day invasion, Earth is faced with a new extra-Solar threat. But will mankind's new space defenses be enough?	C13	120.0	Action, Adventure, Sci-Fi	5.2		Roland Emmerich	Liam Hemsworth, Jeff Goldblum, Bill Pullman, Maika Monroe	180822.0	103.14
Kẻ Chạy Trốn	2012	Two young boys encounter a fugitive and form a pact to help him evade the vigilantes that are on his trail and to reunite him with his true love.	PG-13	130.0	Drama	7.4	76.0	Jeff Nichols	Matthew McConaughey, Tye Sheridan, Jacob Lofland, Sam Shepard	180650.0	21.59
Get Him to the Greek	2010	A record company intern is hired to accompany out-of-control British rock star Aldous Snow to a concert at L.A.'s Greek Theater.	R	109.0	Comedy, Music	6.3	65.0	Nicholas Stoller	Jonah Hill, Russell Brand, Elisabeth Moss, Rose Byrne	179801.0	60.97
Kẻ Hủy Diệt: Vận Mệnh Đen Tối	2019	An augmented human and Sarah Connor must stop an advanced liquid Terminator from hunting down a young girl, whose fate is critical to the human race.	C18	128.0	Action, Adventure, Sci-Fi	6.2		Tim Miller	Linda Hamilton, Arnold Schwarzenegger, Mackenzie Davis, Natalia Reyes	178926.0	62.25
Lọ Lem	2015	When her father unexpectedly dies, young Ella finds herself at the mercy of her cruel stepmother and her scheming stepsisters. Never one to give up hope, Ella's fortunes begin to change after meeting a dashing stranger.	P	105.0	Adventure, Drama, Family	6.9	67.0	Kenneth Branagh	Lily James, Cate Blanchett, Richard Madden, Helena Bonham Carter	178706.0	201.15
Tìm Tung Tích Mẹ	2010	Twins journey to the Middle East to discover their family history and fulfill their mother's last wishes.	R	131.0	Drama, Mystery	8.3	80.0	Denis Villeneuve	Lubna Azabal, Mélissa Désormeaux-Poulin, Maxim Gaudette, Mustafa Kamel	178604.0	6.86
Huyền Thoại Tarzan	2016	Tarzan, having acclimated to life in London, is called back to his former home in the jungle to investigate the activities at a mining encampment.	C13	110.0	Action, Adventure, Drama	6.2		David Yates	Alexander Skarsgård, Rory J. Saper, Christian Stevens, Christoph Waltz	178252.0	126.64
6 Underground - Đại Chiến Thế Giới Ngầm	2019	Six individuals from all around the globe, each the very best at what they do, have been chosen not only for their skill, but for a unique desire to delete their pasts to change the future.	C18	128.0	Action, Thriller	6.1		Michael Bay	Ryan Reynolds, Mélanie Laurent, Manuel Garcia-Rulfo, Ben Hardy	178153.0	
Cây Đời	2011	The story of a family in Waco, Texas in 1956. The eldest son witnesses the loss of innocence and struggles with his parents' conflicting teachings.	PG-13	139.0	Drama, Fantasy	6.8	85.0	Terrence Malick	Brad Pitt, Sean Penn, Jessica Chastain, Hunter McCracken	178142.0	13.3
Gã Điên Báo Thù	2021	A cold and mysterious character working at a cash truck company responsible for moving a lot of money around Los Angeles each week.	R	119.0	Action, Crime, Thriller	7.1		Guy Ritchie	Jason Statham, Holt McCallany, Josh Hartnett, Rocci Williams	178124.0	
Phiên Tòa Chicago 7	2020	The story of 7 people on trial stemming from various charges surrounding the uprising at the 1968 Democratic National Convention in Chicago, Illinois.	C18	129.0	Drama, History, Thriller	7.7	76.0	Aaron Sorkin	Eddie Redmayne, Alex Sharp, Sacha Baron Cohen, Jeremy Strong	178099.0	
Radhe	2021	After taking the dreaded gangster Gani Bhai, ACP Rajveer Shikawat aka Radhe goes on a manhunt to find the wealthiest man of the town secretly running a crime syndicate.		135.0	Action, Crime, Thriller	1.9		Prabhu Deva	Salman Khan, Disha Patani, Randeep Hooda, Jackie Shroff	178019.0	
Hỏa Ngục	2016	When Robert Langdon wakes up in an Italian hospital with amnesia, he teams up with Dr. Sienna Brooks and they race across Europe together against the clock to foil a deadly global plot.	C16	121.0	Action, Adventure, Crime	6.2		Ron Howard	Tom Hanks, Felicity Jones, Irrfan Khan, Ben Foster	177500.0	34.34
Sự Trỗi Dậy Của Các Vệ Thần	2012	When the evil spirit Pitch launches an assault on Earth, the Immortal Guardians team up to protect the innocence of children all around the world.	PG	97.0	Animation, Action, Adventure	7.2		Peter Ramsey	Hugh Jackman, Alec Baldwin, Isla Fisher, Chris Pine	177199.0	103.41
Sát Thủ Vô Hình	2016	A successful entrepreneur accused of murder and a witness preparation expert have less than three hours to come up with an impregnable defense.	C16	106.0	Crime, Drama, Mystery	8.0		Oriol Paulo	Mario Casas, Ana Wagener, Jose Coronado, Bárbara Lennie	176849.0	
Bồn Tắm Thời Gian	2010	A malfunctioning time machine at a ski resort takes a man back to 1986 with his two friends and nephew, where they must relive a fateful night and not change anything to make sure the nephew is born.	R	101.0	Comedy, Sci-Fi	6.4	63.0	Steve Pink	John Cusack, Rob Corddry, Craig Robinson, Clark Duke	176848.0	50.29
Lời Hứa	2016	Set during the last days of the Ottoman Empire, The Promise follows a love triangle between Michael, a brilliant medical student, the beautiful and sophisticated Ana, and Chris - a renowned American journalist based in Paris.	PG-13	133.0	Action, Adventure, Drama	6.0		Terry George	Oscar Isaac, Charlotte Le Bon, Christian Bale, Daniel Giménez Cacho	176574.0	
Người Hoả Tiễn	2019	A musical fantasy about the fantastical human story of Elton John's breakthrough years.	C18	121.0	Biography, Drama, Musical	7.3	69.0	Dexter Fletcher	Taron Egerton, Jamie Bell, Richard Madden, Bryce Dallas Howard	176270.0	96.37
Người Áp Chế	2012	A Naval veteran arrives home from war unsettled and uncertain of his future - until he is tantalized by the Cause and its charismatic leader.	R	138.0	Drama	7.1	86.0	Paul Thomas Anderson	Joaquin Phoenix, Philip Seymour Hoffman, Amy Adams, Jesse Plemons	176002.0	16.38
Mái Ấm Lạ Kỳ Của Cô Peregrine	2016	When Jacob (Asa Butterfield) discovers clues to a mystery that stretches across time, he finds Miss Peregrine's Home for Peculiar Children. But the danger deepens after he gets to know the residents and learns about their special powers.	C16	127.0	Adventure, Drama, Family	6.7		Tim Burton	Eva Green, Asa Butterfield, Samuel L. Jackson, Judi Dench	175081.0	87.24
Sức Mạnh Của Loài Chó	2021	Charismatic rancher Phil Burbank inspires fear and awe in those around him. When his brother brings home a new wife and her son, Phil torments them until he finds himself exposed to the possibility of love.	C16	126.0	Drama, Romance, Western	6.8	89.0	Jane Campion	Benedict Cumberbatch, Kirsten Dunst, Jesse Plemons, Kodi Smit-McPhee	174782.0	
Bô Ba Lâp Di 2	2014	Dale, Kurt and Nick decide to start their own business but things don't go as planned because of a slick investor, prompting the trio to pull off a harebrained and misguided kidnapping scheme.	R	108.0	Comedy, Crime	6.3		Sean Anders	Jason Bateman, Jason Sudeikis, Charlie Day, Jennifer Aniston	174294.0	54.45
Evil Dead	2013	Five friends head to a remote cabin, where the discovery of a Book of the Dead leads them to unwittingly summon up demons living in the nearby woods.	C18	91.0	Horror	6.5		Fede Alvarez	Jane Levy, Shiloh Fernandez, Jessica Lucas, Lou Taylor Pucci	174115.0	54.24
Mortal Kombat: Đấu Trường Sinh Tử	2021	MMA fighter Cole Young seeks out Earth's greatest champions in order to stand against the enemies of Outworld in a high stakes battle for the universe.	R	110.0	Action, Adventure, Fantasy	6.1		Simon McQuoid	Lewis Tan, Jessica McNamee, Josh Lawson, Joe Taslim	174044.0	42.2
Cô Gái Trẻ Hứa Hẹn	2020	A young woman, traumatized by a tragic event in her past, seeks out vengeance against those who crossed her path.	C18	113.0	Crime, Drama, Mystery	7.5	73.0	Emerald Fennell	Carey Mulligan, Bo Burnham, Alison Brie, Clancy Brown	174017.0	
Nữ Hoàng Poker	2017	The true story of Molly Bloom, an Olympic-class skier who ran the world's most exclusive high-stakes poker game and became an FBI target.	R	140.0	Biography, Crime, Drama	7.4	71.0	Aaron Sorkin	Jessica Chastain, Idris Elba, Kevin Costner, Michael Cera	173755.0	28.78
Con Nhà Siêu Giàu Châu Á	2018	This contemporary romantic comedy, based on a global bestseller, follows native New Yorker Rachel Chu to Singapore to meet her boyfriend's family.	C16	120.0	Comedy, Drama, Romance	6.9	74.0	Jon M. Chu	Constance Wu, Henry Golding, Michelle Yeoh, Gemma Chan	173743.0	174.53
Cuôc Chiên Nay Lua	2013	An uptight FBI Special Agent is paired with a foul-mouthed Boston cop to take down a ruthless drug lord.	R	117.0	Action, Comedy, Crime	6.6		Paul Feig	Sandra Bullock, Michael McDonald, Melissa McCarthy, Demián Bichir	173700.0	159.58
Nữ Hoàng Băng Giá 2	2019	Anna, Elsa, Kristoff, Olaf and Sven leave Arendelle to travel to an ancient, autumn-bound forest of an enchanted land. They set out to find the origin of Elsa's powers in order to save their kingdom.	P	103.0	Animation, Adventure, Comedy	6.8	64.0	Chris Buck, Jennifer Lee	Kristen Bell, Idina Menzel, Josh Gad, Jonathan Groff	173622.0	477.37
Đội Quân Người Chết	2021	Following a zombie outbreak in Las Vegas, a group of mercenaries take the ultimate gamble, venturing into the quarantine zone to pull off the greatest heist ever attempted.	C18	148.0	Action, Crime, Horror	5.7		Zack Snyder	Dave Bautista, Ella Purnell, Ana de la Reguera, Omari Hardwick	173325.0	1.0
Vùng Đất Quỷ Dữ: Kiếp Sau	2010	While still out to destroy the evil Umbrella Corporation, Alice joins a group of survivors living in a prison surrounded by the infected who also want to relocate to the mysterious but supposedly unharmed safe haven known only as Arcadia.	R	96.0	Action, Horror, Sci-Fi	5.8		Paul W.S. Anderson	Milla Jovovich, Ali Larter, Wentworth Miller, Kim Coates	172917.0	60.13
Cá Mập Siêu Bạo Chúa	2018	A group of scientists exploring the Marianas Trench encounter the largest marine predator that has ever existed - the Megalodon.	C16	113.0	Action, Horror, Sci-Fi	5.6		Jon Turteltaub	Jason Statham, Bingbing Li, Rainn Wilson, Cliff Curtis	172772.0	143.01
Quỷ Quyệt 2	2013	The Lamberts believe that they have defeated the spirits that have haunted their family, but they soon discover that evil is not beaten so easily.	C16	106.0	Horror, Mystery, Thriller	6.5		James Wan	Patrick Wilson, Rose Byrne, Barbara Hershey, Lin Shaye	172662.0	83.59
CIA Tái Xuất 2	2013	Retired CIA agent Frank Moses reunites his unlikely team of elite operatives for a global quest to track down a missing portable nuclear device.	PG-13	116.0	Action, Comedy, Crime	6.6		Dean Parisot	Bruce Willis, Helen Mirren, John Malkovich, Anthony Hopkins	172557.0	53.26
Đam Mê Tốc Độ	2014	Fresh from prison, a street racer who was framed by a wealthy business associate joins a cross-country race with revenge in mind. His ex-partner, learning of the plan, places a massive bounty on his head as the race begins.	C16	132.0	Action, Thriller	6.4		Scott Waugh	Aaron Paul, Dominic Cooper, Imogen Poots, Kid Cudi	172122.0	43.58
Đấu Trường Âm Nhạc	2016	In a city of humanoid animals, a hustling theater impresario's attempt to save his theater with a singing competition becomes grander than he anticipates even as its finalists find that their lives will never be the same.	P	108.0	Animation, Comedy, Family	7.1		Garth Jennings, Christophe Lourdelet	Matthew McConaughey, Reese Witherspoon, Seth MacFarlane, Scarlett Johansson	171786.0	270.4
Cuộc Đời Steve Jobs	2015	Steve Jobs takes us behind the scenes of the digital revolution, to paint a portrait of the man at its epicenter. The story unfolds backstage at three iconic product launches, ending in 1998 with the unveiling of the iMac.	R	122.0	Biography, Drama	7.2	82.0	Danny Boyle	Michael Fassbender, Kate Winslet, Seth Rogen, Jeff Daniels	170476.0	17.77
Thảm Họa Giàn Khoan	2016	A dramatization of the disaster in April 2010, when the offshore drilling rig called the Deepwater Horizon exploded, resulting in the worst oil spill in American history.	PG-13	107.0	Action, Drama, History	7.1	68.0	Peter Berg	Mark Wahlberg, Kurt Russell, Douglas M. Griffin, James DuMont	170412.0	61.43
Đảo Của Những Chú Chó	2018	Set in Japan, Isle of Dogs follows a boy's odyssey in search of his lost dog.	C13	101.0	Animation, Adventure, Comedy	7.8	82.0	Wes Anderson	Bryan Cranston, Koyu Rankin, Edward Norton, Bob Balaban	170190.0	32.02
Exodus: Cuộc Chiến Chống Pharaoh	2014	The defiant leader Moses rises up against Egyptian Pharaoh Ramses II, setting six hundred thousand slaves on a monumental journey of escape from Egypt and its terrifying cycle of deadly plagues.	PG-13	150.0	Action, Adventure, Drama	6.0		Ridley Scott	Christian Bale, Joel Edgerton, Ben Kingsley, Sigourney Weaver	169962.0	65.01
Chiến Binh Bất Tử	2011	Theseus is a mortal man chosen by Zeus to lead the fight against the ruthless King Hyperion, who is on a rampage across Greece to obtain a weapon that can destroy humanity.	R	110.0	Action, Drama, Fantasy	6.0		Tarsem Singh	Henry Cavill, Mickey Rourke, John Hurt, Stephen Dorff	169801.0	83.5
Siêu Thú Cuồng Nộ	2018	When three different animals become infected with a dangerous pathogen, a primatologist and a geneticist team up to stop them from destroying Chicago.	C16	107.0	Action, Adventure, Sci-Fi	6.1		Brad Peyton	Dwayne Johnson, Naomie Harris, Malin Akerman, Jeffrey Dean Morgan	169710.0	101.03
Không Khuất Phục	2014	After a near-fatal plane crash in WWII, Olympian Louis Zamperini spends a harrowing 47 days in a raft with two fellow crewmen before he's caught by the Japanese navy and sent to a prisoner-of-war camp.	PG-13	137.0	Action, Biography, Drama	7.2		Angelina Jolie	Jack O'Connell, Miyavi, Domhnall Gleeson, Garrett Hedlund	169585.0	115.64
Bộ Tứ Siêu Đẳng	2015	Four young outsiders teleport to an alternate and dangerous universe which alters their physical form in shocking ways. The four must learn to harness their new abilities and work together to save Earth from a former friend turned enemy.	C13	100.0	Action, Adventure, Sci-Fi	4.3		Josh Trank	Miles Teller, Kate Mara, Michael B. Jordan, Jamie Bell	168408.0	56.12
Riddick	2013	Left for dead on a sun-scorched planet, Riddick finds himself up against an alien race of predators. Activating an emergency beacon alerts two ships: one carrying a new breed of mercenary, the other captained by a man from Riddick's past.	R	119.0	Action, Adventure, Sci-Fi	6.4		David Twohy	Vin Diesel, Karl Urban, Katee Sackhoff, Jordi Mollà	167958.0	42.03
Bumblebee	2018	On the run in the year 1987, Bumblebee finds refuge in a junkyard in a small California beach town. On the cusp of turning 18 and trying to find her place in the world, Charlie Watson discovers Bumblebee, battle-scarred and broken.	C13	114.0	Action, Adventure, Sci-Fi	6.7	66.0	Travis Knight	Hailee Steinfeld, Jorge Lendeborg Jr., John Cena, Jason Drucker	166876.0	127.2
The Old Guard: Những Chiến Binh Bất Tử	2020	A covert team of immortal mercenaries is suddenly exposed and must now fight to keep their identity a secret just as an unexpected new member is discovered.	C18	125.0	Action, Thriller	6.6	70.0	Gina Prince-Bythewood	Charlize Theron, KiKi Layne, Matthias Schoenaerts, Marwan Kenzari	166208.0	
Điều Kỳ Diệu	2017	Based on the New York Times bestseller, this movie tells the incredibly inspiring and heartwarming story of August Pullman, a boy with facial differences who enters the fifth grade, attending a mainstream elementary school for the first time.	P	113.0	Drama, Family	7.9	66.0	Stephen Chbosky	Jacob Tremblay, Owen Wilson, Izabela Vidovic, Julia Roberts	165619.0	132.42
Người Chấp Bút	2010	A ghost writer, hired to complete the memoirs of a former British Prime Minister, uncovers secrets that put his own life in jeopardy.	PG-13	128.0	Crime, Drama, Mystery	7.2	77.0	Roman Polanski	Ewan McGregor, Pierce Brosnan, Olivia Williams, Jon Bernthal	165201.0	15.54
Tiết Khí Sư Cuối Cùng	2010	Follows the adventures of Aang, a young successor to a long line of Avatars, who must master all four elements and stop the Fire Nation from enslaving the Water Tribes and the Earth Kingdom.	PG	103.0	Action, Adventure, Family	4.0		M. Night Shyamalan	Noah Ringer, Nicola Peltz Beckham, Jackson Rathbone, Dev Patel	164638.0	131.56
Pokémon: Thám Tử Pikachu	2019	In a world where people collect Pokémon to do battle, a boy comes across an intelligent talking Pikachu who seeks to be a detective.	C13	104.0	Action, Adventure, Comedy	6.5		Rob Letterman	Ryan Reynolds, Justice Smith, Kathryn Newton, Bill Nighy	164442.0	144.11
Đêm Hẹn Nhớ Đời	2010	In New York City, a case of mistaken identity turns a bored married couple's attempt at a glamorous and romantic evening into something more thrilling and dangerous.	PG-13	88.0	Comedy, Crime, Romance	6.3		Shawn Levy	Steve Carell, Tina Fey, Mark Wahlberg, Taraji P. Henson	164170.0	98.71
Truy Tìm Tung Tích Ảo	2018	After his teenage daughter goes missing, a desperate father tries to find clues on her laptop.	C13	102.0	Drama, Horror, Mystery	7.6	71.0	Aneesh Chaganty	John Cho, Debra Messing, Joseph Lee, Michelle La	163964.0	26.02
Mùa Hè Của Luca	2021	On the Italian Riviera, an unlikely but strong friendship grows between a human being and a sea monster disguised as a human.	PG	95.0	Animation, Adventure, Comedy	7.4	71.0	Enrico Casarosa	Jacob Tremblay, Jack Dylan Grazer, Emma Berman, Saverio Raimondo	163351.0	
Phù Thủy Tập Sự	2010	Balthazar Blake, an apprentice of the legendary magician Merlin, must train his old teacher's successor - an introverted but resourceful physics prodigy - in the art of sorcery to prevent the return of Morgana le Fay.	PG	109.0	Action, Adventure, Family	6.1		Jon Turteltaub	Nicolas Cage, Jay Baruchel, Alfred Molina, Teresa Palmer	163335.0	63.15
Thành Phố Tội Ác 2	2014	Some of Sin City's most hard-boiled citizens cross paths with a few of its more reviled inhabitants.	R	102.0	Action, Crime, Thriller	6.5		Frank Miller, Robert Rodriguez	Mickey Rourke, Jessica Alba, Josh Brolin, Joseph Gordon-Levitt	163218.0	13.76
Cuộc Giải Cứu Thần Kỳ	2013	Author P.L. Travers reflects on her childhood after reluctantly meeting with Walt Disney, who seeks to adapt her Mary Poppins books for the big screen.	PG-13	125.0	Biography, Comedy, Drama	7.5	65.0	John Lee Hancock	Emma Thompson, Tom Hanks, Annie Rose Buckley, Colin Farrell	163178.0	83.3
Ráp-phờ Đập Phá 2: Phá Đảo Thế Giới Ảo	2018	"Six years after the events of ""Wreck-It Ralph,"" Ralph and Vanellope, now friends, discover a wi-fi router in their arcade, leading them into a new adventure."	P	112.0	Animation, Adventure, Comedy	7.0	71.0	Phil Johnston, Rich Moore	John C. Reilly, Sarah Silverman, Gal Gadot, Taraji P. Henson	162562.0	201.09
Sát Thủ Thợ Máy	2011	An elite hitman teaches his trade to an apprentice who has a connection to one of his previous victims.	R	93.0	Action, Crime, Thriller	6.5		Simon West	Jason Statham, Ben Foster, Donald Sutherland, Tony Goldwyn	162247.0	29.12
