name	overview	tagline	certificate	runtime	genre	keywords	imdb_rate	metascore	director	stars	nvote	gross	release_date	countries	language	locations	company
Đổi Vai	Dave is a married man with three kids and a loving wife, and Mitch is a single man who is at the prime of his sexual life. One fateful night while Mitch and Dave are peeing in a fountain, lightning strikes and they switch bodies.	Who says men can't change?	R	112.0	Comedy, Fantasy	sex, body swap, woman sits on a toilet, female rear nudity, lust	6.3	39	David Dobkin	Jason Bateman, Ryan Reynolds, Olivia Wilde, Leslie Mann	184535	37.24	August 5, 2011 (United States)	United States	English, Ukrainian	Turner Field - 755 Hank Aaron Drive, Atlanta, Georgia, USA	Universal Pictures, Relativity Media, Original Film
Melancholia: Ngày Tận Thế	Two sisters find their already strained relationship challenged as a mysterious new planet threatens to collide with Earth.	Enjoy it while it lasts	R	135.0	Drama, Sci-Fi	depression, end of the world, sister sister relationship, golf course, destruction of planet	7.1	80	Lars von Trier	Kirsten Dunst, Charlotte Gainsbourg, Kiefer Sutherland, Alexander Skarsgård	184442	3.03	May 26, 2011 (Denmark)	Denmark, Sweden, France, Germany	English	Tjolöholm Castle, Fjärås, Sweden	Zentropa Entertainments, Memfis Film, Zentropa International Sweden
Chúa Tể Godzilla: Đế Vương Bất Tử	The crypto-zoological agency Monarch faces off against a battery of god-sized monsters, including the mighty Godzilla, who collides with Mothra, Rodan, and his ultimate nemesis, the three-headed King Ghidorah.	Let them fight!	C13	132.0	Action, Adventure, Fantasy	monster, terrorism, destruction, showdown, kidnapping	6.0	48	Michael Dougherty	Kyle Chandler, Vera Farmiga, Millie Bobby Brown, Ken Watanabe	184260	110.5	May 31, 2019 (United States)	United States, Japan, Mexico	English, Japanese, Chinese, Spanish	México City, Mexico	Warner Bros., Legendary Entertainment, Toho Company
Biệt Đội Đánh Thuê 3	Barney augments his team with new blood for a personal battle: to take down Conrad Stonebanks, the Expendables co-founder and notorious arms trader who is hell bent on wiping out Barney and every single one of his associates.	New team. New attitude. New mission.	C16	126.0	Action, Adventure, Thriller	mission, pg 13 sequel to r rated franchise, sequel, night cityscape, new york city	6.1	35	Patrick Hughes	Sylvester Stallone, Jason Statham, Jet Li, Antonio Banderas	184078	39.32	August 15, 2014 (United States)	France, Germany, Bulgaria, United States	English, Romanian, Spanish	Bucharest, Romania	Lionsgate, Millennium Films, Nu Image Entertainment GmbH
Thế Giới Bí Ẩn	Bound by a shared destiny, a teen bursting with scientific curiosity and a former boy-genius inventor embark on a mission to unearth the secrets of a place somewhere in time and space that exists in their collective memory.	Imagine a place where nothing is impossible.	C13	130.0	Action, Adventure, Family	time travel, futuristic city, future, inventor, pin	6.4	60	Brad Bird	George Clooney, Britt Robertson, Hugh Laurie, Raffey Cassidy	183720	93.44	May 22, 2015 (United States)	United States, Spain, France, Canada, United Kingdom	English, French, Japanese	City of Arts and Sciences, Valencia, Comunidad Valenciana, Spain	Walt Disney Pictures, A113, Babieka
Sắc Đẹp Vĩnh Cửu	A young woman, born at the turn of the 20th century, is rendered ageless after an accident. After many solitary years, she meets a man who complicates the eternal life she has settled into.	The world has changed in the last century. Adaline has not.	PG-13	112.0	Drama, Fantasy, Romance	aging, change of identity, car accident, agelessness, trivia game	7.2	51	Lee Toland Krieger	Blake Lively, Michiel Huisman, Harrison Ford, Kathy Baker	183641	42.48	April 24, 2015 (United States)	United States, Canada	English, Portuguese, Italian	Vancouver, British Columbia, Canada	Lakeshore Entertainment, Lionsgate, Sidney Kimmel Entertainment
Huyền Thoại Tiếp Diễn	With the 1970s behind them, San Diego's top-rated newsman, Ron Burgundy, returns to take New York City's first twenty-four-hour news channel by storm.	It's Kind of a Big Deal	PG-13	119.0	Comedy	father son relationship, sea world, beach, funeral, interracial relationship	6.3	61	Adam McKay	Will Ferrell, Christina Applegate, Paul Rudd, Steve Carell	183391	127.35	December 18, 2013 (United States)	United States	English	St. Simons Island, Georgia, USA	Paramount Pictures, Apatow Productions, Digital Image Associates
Madagascar 3: Thần Tượng Châu Âu	The Madagascar animals join a struggling European circus to get back to New York, but find themselves being pursued by a psychotic animal-control officer.	Six years ago, they disappeared without a trace. Next summer, they finally resurface	P	95.0	Animation, Adventure, Comedy	animal, circus, penguin, lemur, giraffe	6.8	60	Eric Darnell, Tom McGrath, Conrad Vernon	Ben Stiller, Jada Pinkett Smith, Chris Rock, David Schwimmer	183282	216.39	June 8, 2012 (United States)	United States	English, Spanish		DreamWorks Animation, Pacific Data Images (PDI)
Valerian và Thành Phố Ngàn Hành Tinh	A dark force threatens Alpha, a vast metropolis and home to species from a thousand planets. Special operatives Valerian and Laureline must race to identify the marauding menace and safeguard not just Alpha, but the future of the universe.	From the visionary director of The Fifth Element and Lucy	C13	136.0	Action, Adventure, Fantasy	government agent, alien creature as pet, futuristic, alien species, augmented reality	6.4	51	Luc Besson	Dane DeHaan, Cara Delevingne, Clive Owen, Rihanna	183168	41.19	July 21, 2017 (United States)	France, China, Belgium, Germany, United Arab Emirates, United States, Canada	English, French, Hindi	Studios de Paris, La Cité du Cinéma, Saint-Denis, Seine-Saint-Denis, France	EuropaCorp, TF1 Films Production, OCS
Mẹ Ma	After a young couple take in their two nieces, they suspect that a supernatural spirit named Mama has latched onto their family.	A mother's love is forever.	C16	100.0	Fantasy, Horror, Thriller	mother daughter relationship, supernatural horror, haunted house, cabin in the woods, ghost	6.2	57	Andy Muschietti	Jessica Chastain, Nikolaj Coster-Waldau, Megan Charpentier, Isabelle Nélisse	182780	71.63	January 18, 2013 (United States)	Canada, Spain, Mexico	English	Barcelona, Catalonia, Spain	De Milo, Toma 78
Bố Già Huyền Thoại	The true story of Whitey Bulger, the brother of a state senator and the most infamous violent criminal in the history of South Boston, who became an FBI informant to take down a Mafia family invading his turf.	Based on the true story of one of the most notorious gangsters in U.S. history	R	123.0	Biography, Crime, Drama	true crime, fbi agent, gangster, boston massachusetts, based on true story	6.9	68	Scott Cooper	Johnny Depp, Benedict Cumberbatch, Dakota Johnson, Joel Edgerton	182732	62.58	September 18, 2015 (United States)	United States, United Kingdom	English	Lynn, Massachusetts, USA	Cross Creek Pictures, RatPac-Dune Entertainment, Grisbi Productions, Le
Biệt Đội Săn Ma: Chuyển Kiếp	When a single mom and her two kids arrive in a small town, they begin to discover their connection to the original Ghostbusters and the secret legacy their grandfather left behind.	Discover the Past. Save the Future.	C13	124.0	Adventure, Comedy, Fantasy	ghost, ghostbuster, sequel, ghostbusters, single parent	7.1	45	Jason Reitman	Carrie Coon, Paul Rudd, Finn Wolfhard, Mckenna Grace	182554	129.36	November 19, 2021 (United States)	United States, Canada	English	Calgary, Alberta, Canada	Columbia Pictures, BRON Studios, Ghostcorps
Biệt Đội G.I. Joe: Báo Thù	The G.I. Joes are not only fighting their mortal enemy Cobra; they are forced to contend with threats from within the government that jeopardize their very existence.		PG-13	110.0	Action, Adventure, Sci-Fi	gi joe, snow adventure, ninja, martial arts, ensemble cast	5.7	41	Jon M. Chu	Dwayne Johnson, Channing Tatum, Adrianne Palicki, Lee Byung-hun	182489	122.52	March 28, 2013 (United States)	United States	English	Fort Pike, New Orleans, Louisiana, USA	Paramount Pictures, Metro-Goldwyn-Mayer (MGM), Skydance Media
Kỳ Nghỉ Kinh Hoàng	Affable hillbillies Tucker and Dale are on vacation at their dilapidated mountain cabin when they are mistaken for murderers by a group of preppy college students.	This Year Spring Break is Cut Short!	R	89.0	Comedy, Horror	cabin in the woods, cabin, pickled eggs, blonde, group of friends	7.5	65	Eli Craig	Tyler Labine, Alan Tudyk, Katrina Bowden, Jesse Moss	182214	0.22	December 9, 2010 (Kazakhstan)	Canada	English	Alberta, Canada	Reliance Big Pictures, Loubyloo Productions, Gynormous Pictures
Vùng Đất Thây Ma: Cú Bắn Đúp	Columbus, Tallahassee, Wichita, and Little Rock move to the American heartland as they face off against evolved zombies, fellow survivors, and the growing pains of the snarky makeshift family.		C18	99.0	Action, Comedy, Horror	sequel, zombie, survival, fireworks, altered version of studio logo	6.7	55	Ruben Fleischer	Woody Harrelson, Jesse Eisenberg, Emma Stone, Abigail Breslin	181391	73.12	October 18, 2019 (United States)	United States	English, Spanish, Italian, Inuktitut, Hindi	Macon, Georgia, USA	2.0 Entertainment, Columbia Pictures, Pariah
Thảm Họa Los Angeles	A squad of U.S. Marines becomes the last line of defense against a global invasion.	It's not war. It's survival.	PG-13	116.0	Action, Adventure, Sci-Fi	alien invasion, extraterrestrial, gunfire, alien attack, female veterinarian	5.7	37	Jonathan Liebesman	Aaron Eckhart, Michelle Rodriguez, Bridget Moynahan, Ramón Rodríguez	181207	83.55	March 11, 2011 (United States)	United States	English, Ukrainian	Shreveport, Louisiana, USA	Columbia Pictures, Relativity Media, Original Film
Ngày Độc Lập: Tái Chiến	Two decades after the first Independence Day invasion, Earth is faced with a new extra-Solar threat. But will mankind's new space defenses be enough?	We had twenty years to prepare. So did they.	C13	120.0	Action, Adventure, Sci-Fi	alien, alien invasion, mothership, independence day, human versus alien	5.2	32	Roland Emmerich	Liam Hemsworth, Jeff Goldblum, Bill Pullman, Maika Monroe	180892	103.14	June 24, 2016 (United States)	United States	English, Mandarin	Albuquerque, New Mexico, USA	Twentieth Century Fox, TSG Entertainment, Centropolis Entertainment
Kẻ Chạy Trốn	Two young boys encounter a fugitive and form a pact to help him evade the vigilantes that are on his trail and to reunite him with his true love.	Entangled in his past. Running from the law. All for love.	PG-13	130.0	Drama	southern gothic, river, friendship between boys, character name as title, lionsgate	7.4	76	Jeff Nichols	Matthew McConaughey, Tye Sheridan, Jacob Lofland, Sam Shepard	180691	21.59	May 10, 2013 (United States)	United States	English	Mississippi River, Eudora, Arkansas, USA	Lionsgate, Everest Entertainment, Brace Cove Productions
Get Him to the Greek	A record company intern is hired to accompany out-of-control British rock star Aldous Snow to a concert at L.A.'s Greek Theater.	Aaron Green has 72 hours to get a Rock Star from London to L.A. Pray for him.	R	109.0	Comedy, Music	london england, kali character, pixelated nudity, vomiting, diva	6.3	65	Nicholas Stoller	Jonah Hill, Russell Brand, Elisabeth Moss, Rose Byrne	179833	60.97	June 4, 2010 (United States)	United States	English	Abbey Road, St. John's Wood, London, England, UK	Universal Pictures, Relativity Media, Spyglass Entertainment
Kẻ Hủy Diệt: Vận Mệnh Đen Tối	An augmented human and Sarah Connor must stop an advanced liquid Terminator from hunting down a young girl, whose fate is critical to the human race.	Welcome to the Day after Judgment Day.	C18	128.0	Action, Adventure, Sci-Fi	time travel, sequel, robot, terminator, mexico	6.2	54	Tim Miller	Linda Hamilton, Arnold Schwarzenegger, Mackenzie Davis, Natalia Reyes	179061	62.25	November 1, 2019 (United States)	United States, Spain, Hungary	English, Spanish	Cartagena, Murcia, Spain	Paramount Pictures, Skydance Media, Twentieth Century Fox
Lọ Lem	When her father unexpectedly dies, young Ella finds herself at the mercy of her cruel stepmother and her scheming stepsisters. Never one to give up hope, Ella's fortunes begin to change after meeting a dashing stranger.	Midnight is just the beginning.	P	105.0	Adventure, Drama, Family	dance, remake, fairy tale, 17th century, prince	6.9	67	Kenneth Branagh	Lily James, Cate Blanchett, Richard Madden, Helena Bonham Carter	178783	201.15	March 13, 2015 (United States)	United Kingdom, United States	English	Old Royal Naval College, Greenwich, London, England, UK	Allison Shearmur Productions, Beagle Pug Films, Genre Films
Tìm Tung Tích Mẹ	Twins journey to the Middle East to discover their family history and fulfill their mother's last wishes.	The search began at the opening of their mother's will.	R	131.0	Drama, Mystery	middle east, twin brother and sister, family relationships, university, torture	8.3	80	Denis Villeneuve	Lubna Azabal, Mélissa Désormeaux-Poulin, Maxim Gaudette, Mustafa Kamel	178724	6.86	January 12, 2011 (France)	Canada, France	French, Arabic, English	Amman, Jordan	micro_scope, TS Productions, Phi Group
Gã Điên Báo Thù	A cold and mysterious character working at a cash truck company responsible for moving a lot of money around Los Angeles each week.		R	119.0	Action, Crime, Thriller	police, shootout, police officer, female police officer, female security guard	7.1	57	Guy Ritchie	Jason Statham, Holt McCallany, Josh Hartnett, Rocci Williams	178401		May 7, 2021 (United States)	United Kingdom, United States	English	635 Mateo Street, Los Angeles, California, USA	Metro-Goldwyn-Mayer (MGM), Miramax, CAA Media Finance
Huyền Thoại Tarzan	Tarzan, having acclimated to life in London, is called back to his former home in the jungle to investigate the activities at a mining encampment.	Human. Nature.	C13	110.0	Action, Adventure, Drama	africa, jungle, slavery, congo, belgian	6.2	44	David Yates	Alexander Skarsgård, Rory J. Saper, Christian Stevens, Christoph Waltz	178319	126.64	July 1, 2016 (United States)	United Kingdom, Canada, United States, Australia	English, Lingala, French	Gabon	Village Roadshow Pictures, RatPac-Dune Entertainment, Jerry Weintraub Productions
6 Underground - Đại Chiến Thế Giới Ngầm	Six individuals from all around the globe, each the very best at what they do, have been chosen not only for their skill, but for a unique desire to delete their pasts to change the future.	They Say No One Can Save The World. Meet No One.	C18	128.0	Action, Thriller	yacht, the future, psychotronic film, ensemble cast, italy	6.1	41	Michael Bay	Ryan Reynolds, Mélanie Laurent, Manuel Garcia-Rulfo, Ben Hardy	178301		December 13, 2019 (United States)	United States	English, Turkmen, Cantonese, Italian, Spanish, Ukrainian, French	Budapest, Hungary	Skydance Media, Bay Films
Phiên Tòa Chicago 7	The story of 7 people on trial stemming from various charges surrounding the uprising at the 1968 Democratic National Convention in Chicago, Illinois.	In 1968, democracy refused to back down.	C18	129.0	Drama, History, Thriller	riot, protesting vietnam war, protest march, political protest, 1960s	7.7	76	Aaron Sorkin	Eddie Redmayne, Alex Sharp, Sacha Baron Cohen, Jeremy Strong	178207		October 16, 2020 (United States)	United States, United Kingdom, India	English, Latin, French	Chicago, Illinois, USA	Dreamworks Pictures, Amblin Partners, Aperture Media Partners
Cây Đời	The story of a family in Waco, Texas in 1956. The eldest son witnesses the loss of innocence and struggles with his parents' conflicting teachings.		PG-13	139.0	Drama, Fantasy	childhood, strict father, waco texas, 1950s, death	6.8	85	Terrence Malick	Brad Pitt, Sean Penn, Jessica Chastain, Hunter McCracken	178181	13.3	May 17, 2011 (France)	United States	English	Houston, Texas, USA	Cottonwood Pictures, River Road Entertainment, Searchlight Pictures
Radhe	After taking the dreaded gangster Gani Bhai, ACP Rajveer Shikawat aka Radhe goes on a manhunt to find the wealthiest man of the town secretly running a crime syndicate.			135.0	Action, Crime, Thriller	hindi, remake, bollywood remake, remake of south korean film, gangster	1.9		Prabhu Deva	Salman Khan, Disha Patani, Randeep Hooda, Jackie Shroff	178037		May 13, 2021 (United Arab Emirates)	India	Hindi		Sohail Khan Production, Reel Life Production, Salman Khan Films
Hỏa Ngục	When Robert Langdon wakes up in an Italian hospital with amnesia, he teams up with Dr. Sienna Brooks and they race across Europe together against the clock to foil a deadly global plot.	Every clue will take him deeper	C16	121.0	Action, Adventure, Crime	amnesia, church, museum, police, virus	6.2	42	Ron Howard	Tom Hanks, Felicity Jones, Irrfan Khan, Ben Foster	177582	34.34	October 28, 2016 (United States)	United States, Hungary	English, French, Italian, Turkish	Hagia Sophia, Istanbul, Turkey	Columbia Pictures, Double Negative (DNEG), Imagine Entertainment
Sự Trỗi Dậy Của Các Vệ Thần	When the evil spirit Pitch launches an assault on Earth, the Immortal Guardians team up to protect the innocence of children all around the world.	Naughty, nice. You better believe.	PG	97.0	Animation, Action, Adventure	santa claus character, jack frost character, sandman character, tooth fairy character, easter bunny character	7.2	58	Peter Ramsey	Hugh Jackman, Alec Baldwin, Isla Fisher, Chris Pine	177373	103.41	November 21, 2012 (United States)	United States	English, French		DreamWorks Animation
Sát Thủ Vô Hình	A successful entrepreneur accused of murder and a witness preparation expert have less than three hours to come up with an impregnable defense.	Every story has two sides. The truth, only one.	C16	106.0	Crime, Drama, Mystery	repeated scene from a different perspective, giallo, spanish giallo, lawyer, businessman	8.0		Oriol Paulo	Mario Casas, Ana Wagener, Jose Coronado, Bárbara Lennie	177001		January 6, 2017 (Spain)	Spain	Spanish, English	Vizcaya, País Vasco, Spain	Atresmedia Cine, Think Studio, Nostromo Pictures
Bồn Tắm Thời Gian	A malfunctioning time machine at a ski resort takes a man back to 1986 with his two friends and nephew, where they must relive a fateful night and not change anything to make sure the nephew is born.	Kick Some Past	R	101.0	Comedy, Sci-Fi	ski resort, promiscuous woman, casual sex, time travel, nudity	6.4	63	Steve Pink	John Cusack, Rob Corddry, Craig Robinson, Clark Duke	176918	50.29	March 26, 2010 (United States)	United States	English, Russian	Fernie Alpine Resort - 5339 Fernie Ski Hill Road, Fernie, British Columbia, Canada	Metro-Goldwyn-Mayer (MGM), United Artists, New Crime Productions
Lời Hứa	Set during the last days of the Ottoman Empire, The Promise follows a love triangle between Michael, a brilliant medical student, the beautiful and sophisticated Ana, and Chris - a renowned American journalist based in Paris.	Empires fall. Love survives.	PG-13	133.0	Action, Adventure, Drama	love triangle, belly dancer, woman drowned, church, orphanage	6.0	49	Terry George	Oscar Isaac, Charlotte Le Bon, Christian Bale, Daniel Giménez Cacho	176587		April 21, 2017 (United States)	Spain, United States	English, Armenian, German, French, Turkish	Monserrate Palace, Sintra, Portugal	Babieka, Survival Pictures, Wonderful Films
Người Hoả Tiễn	A musical fantasy about the fantastical human story of Elton John's breakthrough years.	The Only Way to Tell His Story is to live His Fantasy.	C18	121.0	Biography, Drama, Musical	musician, pop music, addiction, rock star, gay man	7.3	69	Dexter Fletcher	Taron Egerton, Jamie Bell, Richard Madden, Bryce Dallas Howard	176361	96.37	May 31, 2019 (United States)	United Kingdom, United States, Canada	English	Royal Albert Hall, South Kensington, London, England, UK	Paramount Pictures, New Republic Pictures, Marv Films
Người Áp Chế	A Naval veteran arrives home from war unsettled and uncertain of his future - until he is tantalized by the Cause and its charismatic leader.		R	138.0	Drama	scientology, past life regression, psychological testing, charismatic leader, cult	7.1	86	Paul Thomas Anderson	Joaquin Phoenix, Philip Seymour Hoffman, Amy Adams, Jesse Plemons	176076	16.38	September 21, 2012 (United States)	United States	English, Filipino	Mare Island, Vallejo, California, USA	The Weinstein Company, Ghoulardi Film Company, Annapurna Pictures
Mái Ấm Lạ Kỳ Của Cô Peregrine	When Jacob (Asa Butterfield) discovers clues to a mystery that stretches across time, he finds Miss Peregrine's Home for Peculiar Children. But the danger deepens after he gets to know the residents and learns about their special powers.	Stay peculiar	C16	127.0	Adventure, Drama, Family	time loop, time travel, butterfly effect, death of grandfather, year 1943	6.7	57	Tim Burton	Eva Green, Asa Butterfield, Samuel L. Jackson, Judi Dench	175290	87.24	September 30, 2016 (United States)	United States, United Kingdom, Belgium, Canada	English	Brasschaat, Antwerp, Flanders, Belgium	Twentieth Century Fox, Chernin Entertainment, TSG Entertainment
Sức Mạnh Của Loài Chó	Charismatic rancher Phil Burbank inspires fear and awe in those around him. When his brother brings home a new wife and her son, Phil torments them until he finds himself exposed to the possibility of love.	What it means to be a man.	C16	126.0	Drama, Romance, Western	repressed homosexuality, animal cruelty, bull castration, cowboy, alcoholic	6.8	89	Jane Campion	Benedict Cumberbatch, Kirsten Dunst, Jesse Plemons, Kodi Smit-McPhee	174999		December 1, 2021 (United States)	New Zealand, United Kingdom, Canada, Australia	English	Dunedin, New Zealand	New Zealand Film Commission, Cross City Films, BBC Films
Bô Ba Lâp Di 2	Dale, Kurt and Nick decide to start their own business but things don't go as planned because of a slick investor, prompting the trio to pull off a harebrained and misguided kidnapping scheme.	New crime. Same tools.	R	108.0	Comedy, Crime	scene during end credits, sex addict, sex tape, singing in a car, reference to franz beckenbauer	6.3	40	Sean Anders	Jason Bateman, Jason Sudeikis, Charlie Day, Jennifer Aniston	174376	54.45	November 26, 2014 (United States)	United States	English, Spanish	Los Angeles, California, USA	BenderSpink, New Line Cinema, RatPac Entertainment
Cô Gái Trẻ Hứa Hẹn	A young woman, traumatized by a tragic event in her past, seeks out vengeance against those who crossed her path.	This Christmas. Plan to make them pay.	C18	113.0	Crime, Drama, Mystery	revenge, bachelor party, 30th birthday, rape, female protagonist	7.5	73	Emerald Fennell	Carey Mulligan, Bo Burnham, Alison Brie, Clancy Brown	174254		December 25, 2020 (United States)	United Kingdom, United States	English	Los Angeles, California, USA	FilmNation Entertainment, Focus Features, LuckyChap Entertainment
Mortal Kombat: Đấu Trường Sinh Tử	MMA fighter Cole Young seeks out Earth's greatest champions in order to stand against the enemies of Outworld in a high stakes battle for the universe.	Get over here.	R	110.0	Action, Adventure, Fantasy	based on video game, gore, graphic violence, reboot, two word title	6.1	44	Simon McQuoid	Lewis Tan, Jessica McNamee, Josh Lawson, Joe Taslim	174197	42.2	April 23, 2021 (United States)	United States	English, Japanese, Chinese	Port Adelaide, South Australia, Australia	New Line Cinema, Atomic Monster, Broken Road Productions
Evil Dead	Five friends head to a remote cabin, where the discovery of a Book of the Dead leads them to unwittingly summon up demons living in the nearby woods.	The most terrifying film you will ever experience.	C18	91.0	Horror	demon, forest, zombie, fear, nurse	6.5	57	Fede Alvarez	Jane Levy, Shiloh Fernandez, Jessica Lucas, Lou Taylor Pucci	174180	54.24	April 5, 2013 (United States)	United States	English, Welsh	Auckland, New Zealand	TriStar Pictures, FilmDistrict, Ghost House Pictures
Nữ Hoàng Poker	The true story of Molly Bloom, an Olympic-class skier who ran the world's most exclusive high-stakes poker game and became an FBI target.	Deal with her.	R	140.0	Biography, Crime, Drama	poker, lawyer, female protagonist, father daughter relationship, skiing	7.4	71	Aaron Sorkin	Jessica Chastain, Idris Elba, Kevin Costner, Michael Cera	173862	28.78	January 5, 2018 (United States)	United States, Canada, China	English	Collingwood, Ontario, Canada	STX Entertainment, Huayi Brothers Pictures, The Mark Gordon Company
Con Nhà Siêu Giàu Châu Á	This contemporary romantic comedy, based on a global bestseller, follows native New Yorker Rachel Chu to Singapore to meet her boyfriend's family.	The only thing crazier than love is family	C16	120.0	Comedy, Drama, Romance	materialism, rich man poor woman, asian american, singapore, nouveau riche	6.9	74	Jon M. Chu	Constance Wu, Henry Golding, Michelle Yeoh, Gemma Chan	173858	174.53	August 15, 2018 (United States)	United States	English, Mandarin, Cantonese, Hokkien, French, Malay	Newton Food Centre, Newton, Singapore	Warner Bros., SK Global, Starlight Culture Entertainment
Nữ Hoàng Băng Giá 2	Anna, Elsa, Kristoff, Olaf and Sven leave Arendelle to travel to an ancient, autumn-bound forest of an enchanted land. They set out to find the origin of Elsa's powers in order to save their kingdom.	Find your strength. Face your fears.	P	103.0	Animation, Adventure, Comedy	autumn, anthropomorphic snowman, magic, female protagonist, disney animated sequel	6.8	64	Chris Buck, Jennifer Lee	Kristen Bell, Idina Menzel, Josh Gad, Jonathan Groff	173803	477.37	November 22, 2019 (United States)	United States	English	Walt Disney Feature Animation - 500 S. Buena Vista Street, Burbank, California, USA	Walt Disney Animation Studios, Walt Disney Pictures
