name	year	overview	certificate	runtime	genre	imdb_rate	metascore	director	stars	nvote	gross
Lễ Hội Đẫm Máu	2019	A couple travels to Northern Europe to visit a rural hometown's fabled Swedish mid-summer festival. What begins as an idyllic retreat quickly devolves into an increasingly violent and bizarre competition at the hands of a pagan cult.	R	148.0	Drama, Horror, Mystery	7.1	72.0	Ari Aster	Florence Pugh, Jack Reynor, Vilhelm Blomgren, William Jackson Harper	323521.0	27.33
Năm Mươi Sắc Thái	2015	Literature student Anastasia Steele's life changes forever when she meets handsome, yet tormented, billionaire Christian Grey.	R	125.0	Drama, Romance, Thriller	4.1		Sam Taylor-Johnson	Dakota Johnson, Jamie Dornan, Jennifer Ehle, Eloise Mumford	321424.0	166.17
Kong: Đảo Đầu Lâu	2017	After the Vietnam war, a team of scientists explores an uncharted island in the Pacific, venturing into the domain of the mighty Kong, and must fight to escape a primal Eden.	C13	118.0	Action, Adventure, Fantasy	6.6	62.0	Jordan Vogt-Roberts	Tom Hiddleston, Samuel L. Jackson, Brie Larson, John C. Reilly	320940.0	168.05
Cuốn Sách Của Eli	2010	A post-apocalyptic tale, in which a lone man fights his way across America in order to protect a sacred book that holds the secrets to saving humankind.	R	118.0	Action, Adventure, Drama	6.8		Albert Hughes, Allen Hughes	Denzel Washington, Mila Kunis, Ray Stevenson, Gary Oldman	320144.0	94.84
Bí Mật Của Walter Mitty	2013	When both he and a colleague are about to lose their job, Walter takes action by embarking on an adventure more extraordinary than anything he ever imagined.	P	114.0	Adventure, Comedy, Drama	7.3		Ben Stiller	Ben Stiller, Kristen Wiig, Jon Daly, Kathryn Hahn	319201.0	58.24
Thế Giới Khủng Long: Vương Quốc Sụp Đổ	2018	When the island's dormant volcano begins roaring to life, Owen and Claire mount a campaign to rescue the remaining dinosaurs from this extinction-level event.	C13	128.0	Action, Adventure, Sci-Fi	6.1		J.A. Bayona	Chris Pratt, Bryce Dallas Howard, Rafe Spall, Justice Smith	317765.0	417.72
Di Truyền	2018	A grieving family is haunted by tragic and disturbing occurrences.	R	127.0	Drama, Horror, Mystery	7.3	87.0	Ari Aster	Toni Collette, Milly Shapiro, Gabriel Byrne, Alex Wolff	317475.0	44.07
Ba Chàng Ngự Lâm 3	2013	When one of their own is kidnapped by an angry gangster, the Wolf Pack must track down Mr. Chow, who has escaped from prison and is on the run.	R	100.0	Comedy, Crime	5.8		Todd Phillips	Bradley Cooper, Zach Galifianakis, Ed Helms, Justin Bartha	316630.0	112.2
Điệp viên Salt	2010	A CIA agent goes on the run after a defector accuses her of being a Russian spy.	PG-13	100.0	Action, Thriller	6.4	65.0	Phillip Noyce	Angelina Jolie, Liev Schreiber, Chiwetel Ejiofor, Daniel Olbrychski	316540.0	118.31
Transformers: Kỷ Nguyên Hủy Diệt	2014	When humanity allies with a bounty hunter in pursuit of Optimus Prime, the Autobots turn to a mechanic and his family for help.	C13	165.0	Action, Adventure, Sci-Fi	5.6		Michael Bay	Mark Wahlberg, Nicola Peltz Beckham, Jack Reynor, Stanley Tucci	315638.0	245.44
Cướp Biển Vùng Caribê: Salazar Báo Thù	2017	Captain Jack Sparrow is pursued by old rival Captain Salazar and a crew of deadly ghosts who have escaped from the Devil's Triangle. They're determined to kill every pirate at sea...notably Jack.	C13	129.0	Action, Adventure, Fantasy	6.5		Joachim Rønning, Espen Sandberg	Johnny Depp, Geoffrey Rush, Javier Bardem, Orlando Bloom	313297.0	172.56
Neighbors	2014	After they are forced to live next to a fraternity house, a couple with a newborn baby do whatever they can to take them down.	R	97.0	Comedy	6.3	68.0	Nicholas Stoller	Seth Rogen, Rose Byrne, Zac Efron, Lisa Kudrow	312745.0	150.16
Người Đàm Phán	2015	During the Cold War, an American lawyer is recruited to defend an arrested Soviet spy in court, and then help the CIA facilitate an exchange of the spy for the Soviet captured American U2 spy plane pilot, Francis Gary Powers.	PG-13	142.0	Drama, History, Thriller	7.6	81.0	Steven Spielberg	Tom Hanks, Mark Rylance, Alan Alda, Amy Ryan	312550.0	72.31
Quỷ Quyệt	2010	A family looks to prevent evil spirits from trapping their comatose child in a realm called The Further.	PG-13	103.0	Horror, Mystery, Thriller	6.8		James Wan	Patrick Wilson, Rose Byrne, Ty Simpkins, Lin Shaye	311115.0	54.01
CIA Tái Xuất	2010	When his peaceful life is threatened by a high-tech assassin, former black-ops agent Frank Moses reassembles his old team in a last-ditch effort to survive and uncover his assailants.	PG-13	111.0	Action, Comedy, Crime	7.0		Robert Schwentke	Bruce Willis, Helen Mirren, Morgan Freeman, Mary-Louise Parker	310552.0	90.38
Người Đẹp và Quái Vật	2017	A selfish Prince is cursed to become a monster for the rest of his life, unless he learns to fall in love with a beautiful young woman he keeps prisoner.	P	129.0	Adventure, Family, Fantasy	7.1	65.0	Bill Condon	Emma Watson, Dan Stevens, Luke Evans, Josh Gad	310528.0	504.01
Câu Chuyện Hôn Nhân	2019	Noah Baumbach's incisive and compassionate look at a marriage breaking up and a family staying together.	C16	137.0	Drama, Romance	7.9	94.0	Noah Baumbach	Adam Driver, Scarlett Johansson, Julia Greer, Azhy Robertson	310164.0	2.0
Tổ Chức Bóng Đêm U.N.C.L.E.	2015	In the early 1960s, CIA agent Napoleon Solo and KGB operative Illya Kuryakin participate in a joint mission against a mysterious criminal organization, which is working to proliferate nuclear weapons.	C16	116.0	Action, Adventure, Comedy	7.2		Guy Ritchie	Henry Cavill, Armie Hammer, Alicia Vikander, Elizabeth Debicki	309947.0	45.45
Kẻ Độc Tài	2012	The heroic story of a dictator who risked his life to ensure that democracy would never come to the country he so lovingly oppressed.	R	83.0	Comedy	6.4		Larry Charles	Sacha Baron Cohen, Anna Faris, John C. Reilly, Ben Kingsley	309415.0	59.65
Ánh Trăng	2016	A young African-American man grapples with his identity and sexuality while experiencing the everyday struggles of childhood, adolescence, and burgeoning adulthood.	R	111.0	Drama	7.4	99.0	Barry Jenkins	Mahershala Ali, Naomie Harris, Trevante Rhodes, Alex R. Hibbert	309314.0	27.85
Biệt Đội Đánh Thuê 2	2012	Mr. Church reunites the Expendables for what should be an easy paycheck, but when one of their men is murdered on the job, their quest for revenge puts them deep in enemy territory and up against an unexpected threat.	R	103.0	Action, Adventure, Thriller	6.6		Simon West	Sylvester Stallone, Liam Hemsworth, Randy Couture, Jean-Claude Van Damme	308871.0	85.02
Cưỡng Đoạt 2	2012	In Istanbul, retired CIA operative Bryan Mills and his wife are taken hostage by the father of a kidnapper Mills killed while rescuing his daughter.	C16	92.0	Action, Crime, Thriller	6.2		Olivier Megaton	Liam Neeson, Famke Janssen, Maggie Grace, Leland Orser	308780.0	139.85
Cao Độ Hoàn Hảo	2012	Beca, a freshman at Barden University, is cajoled into joining The Bellas, her school's all-girls singing group. Injecting some much needed energy into their repertoire, The Bellas take on their male rivals in a campus competition.	PG-13	112.0	Comedy, Music, Romance	7.1	66.0	Jason Moore	Anna Kendrick, Brittany Snow, Rebel Wilson, Anna Camp	308091.0	65.0
Bệnh Truyền Nhiễm	2011	Healthcare professionals, government officials and everyday people find themselves in the midst of a pandemic as the CDC works to find a cure.	PG-13	106.0	Drama, Thriller	6.8	70.0	Steven Soderbergh	Matt Damon, Kate Winslet, Jude Law, Gwyneth Paltrow	304825.0	75.66
Siêu Điệp Viên 4: Người Kế Thừa Bourne	2012	An expansion of the universe from Robert Ludlum's novels, centered on a new hero whose stakes have been triggered by the events of the previous three films.	PG-13	135.0	Action, Adventure, Thriller	6.6	61.0	Tony Gilroy	Jeremy Renner, Rachel Weisz, Edward Norton, Scott Glenn	303869.0	113.2
300 Chiến Binh: Đế Chế Trỗi Dậy	2014	Greek general Themistocles of Athens leads the naval charge against invading Persian forces led by mortal-turned-god Xerxes and Artemisia, vengeful commander of the Persian navy.	R	102.0	Action, Drama	6.2		Noam Murro	Sullivan Stapleton, Eva Green, Lena Headey, Hans Matheson	303007.0	106.58
30' Sau Nửa Đêm	2012	A chronicle of the decade-long hunt for al-Qaeda terrorist leader Osama bin Laden after the September 2001 attacks, and his death at the hands of the Navy S.E.A.L.s Team 6 in May 2011.	R	157.0	Drama, History, Thriller	7.4	95.0	Kathryn Bigelow	Jessica Chastain, Joel Edgerton, Chris Pratt, Mark Strong	302815.0	95.72
Chúng Ta	2019	A family's serene beach vacation turns to chaos when their doppelgängers appear and begin to terrorize them.	C18	116.0	Horror, Mystery, Thriller	6.8	81.0	Jordan Peele	Lupita Nyong'o, Winston Duke, Elisabeth Moss, Tim Heidecker	300575.0	175.08
Gia Đình Siêu Nhân 2	2018	The Incredibles family takes on a new mission which involves a change in family roles: Bob Parr (Mr. Incredible) must manage the house while his wife Helen (Elastigirl) goes out to save the world.	P	118.0	Animation, Action, Adventure	7.6	80.0	Brad Bird	Craig T. Nelson, Holly Hunter, Sarah Vowell, Huck Milner	298097.0	608.58
Mật Danh: Kế Toán	2016	As a math savant uncooks the books for a new client, the Treasury Department closes in on his activities, and the body count starts to rise.	R	128.0	Action, Thriller	7.3		Gavin O'Connor	Ben Affleck, Anna Kendrick, J.K. Simmons, Jon Bernthal	297808.0	86.26
Phù Dâu	2011	Competition between the maid of honor and a bridesmaid, over who is the bride's best friend, threatens to upend the life of an out-of-work pastry chef.	R	125.0	Comedy, Romance	6.8	75.0	Paul Feig	Kristen Wiig, Maya Rudolph, Rose Byrne, Terry Crews	293738.0	169.11
Lady Bird: Tuổi Nổi Loạn	2017	In 2002, an artistically inclined seventeen-year-old girl comes of age in Sacramento, California.	C18	94.0	Comedy, Drama	7.4	93.0	Greta Gerwig	Saoirse Ronan, Laurie Metcalf, Tracy Letts, Lucas Hedges	292146.0	48.96
Phi Vụ Thế Kỷ 2	2016	The Four Horsemen resurface, and are forcibly recruited by a tech genius to pull off their most impossible heist yet.	C13	129.0	Action, Adventure, Comedy	6.4		Jon M. Chu	Jesse Eisenberg, Mark Ruffalo, Woody Harrelson, Dave Franco	291965.0	65.08
Hoàng Tử Ba Tư: Dòng Cát Thời Gian	2010	A young fugitive prince and princess must stop a villain who unknowingly threatens to destroy the world with a special dagger that enables the magic sand inside to reverse time.	PG-13	116.0	Action, Adventure, Fantasy	6.6		Mike Newell	Jake Gyllenhaal, Gemma Arterton, Ben Kingsley, Alfred Molina	291408.0	90.76
Bạch Tuyết Và Gã Thợ Săn	2012	In a twist to the fairy tale, the Huntsman ordered to take Snow White into the woods to be killed winds up becoming her protector and mentor in a quest to vanquish the Evil Queen.	C16	127.0	Action, Adventure, Drama	6.1		Rupert Sanders	Kristen Stewart, Chris Hemsworth, Charlize Theron, Sam Claflin	291373.0	155.33
Sông Sót	2013	Marcus Luttrell and his team set out on a mission to capture or kill notorious Taliban leader Ahmad Shah, in late June 2005. Marcus and his team are left to fight for their lives in one of the most valiant efforts of modern warfare.	R	121.0	Action, Biography, Drama	7.5		Peter Berg	Mark Wahlberg, Taylor Kitsch, Emile Hirsch, Ben Foster	289423.0	125.1
Kung Fu Panda 2	2011	Po and his friends fight to stop a peacock villain from conquering China with a deadly new weapon, but first the Dragon Warrior must come to terms with his past.	PG	90.0	Animation, Action, Adventure	7.2	67.0	Jennifer Yuh Nelson	Jack Black, Angelina Jolie, Jackie Chan, Dustin Hoffman	287047.0	165.25
Chiến Binh Đèn Lồng Xanh	2011	Reckless test pilot Hal Jordan is granted an alien ring that bestows him with otherworldly powers that inducts him into an intergalactic police force, the Green Lantern Corps.	PG-13	114.0	Action, Adventure, Sci-Fi	5.5		Martin Campbell	Ryan Reynolds, Blake Lively, Peter Sarsgaard, Mark Strong	286505.0	116.6
Tiền Định	2014	For his final assignment, a top temporal agent must pursue the one criminal that has eluded him throughout time. The chase turns into a unique, surprising and mind-bending exploration of love, fate, identity and time travel taboos.	R	97.0	Action, Drama, Sci-Fi	7.4	69.0	Michael Spierig, Peter Spierig	Ethan Hawke, Sarah Snook, Noah Taylor, Madeleine West	284580.0	0.07
Sinh Vật Huyền Bí: Tội Ác Của Grindelwald	2018	"The second installment of the ""Fantastic Beasts"" series featuring the adventures of Magizoologist Newt Scamander."	C13	134.0	Adventure, Family, Fantasy	6.5		David Yates	Eddie Redmayne, Katherine Waterston, Dan Fogler, Johnny Depp	284231.0	159.56
Cuộc Chiến Giữa Các Vị Thần	2010	Perseus, a demigod and the son of Zeus, battles the minions of Hades and the Underworld in order to stop them from conquering Olympus and Earth.	PG-13	106.0	Action, Adventure, Fantasy	5.8		Louis Leterrier	Sam Worthington, Liam Neeson, Ralph Fiennes, Jason Flemyng	283955.0	163.21
Ngày Tàn Của Thế Giới	2013	Five friends who reunite in an attempt to top their epic pub crawl from twenty years earlier unwittingly become humanity's only hope for survival.	R	109.0	Action, Comedy, Sci-Fi	6.9	81.0	Edgar Wright	Simon Pegg, Nick Frost, Martin Freeman, Rosamund Pike	283859.0	26.0
Manchester by the Sea	2016	A depressed uncle is asked to take care of his teenage nephew after the boy's father dies.	R	137.0	Drama	7.8	96.0	Kenneth Lonergan	Casey Affleck, Michelle Williams, Kyle Chandler, Lucas Hedges	283855.0	47.7
Quái Vật Không Gian	2017	The crew of a colony ship, bound for a remote planet, discover an uncharted paradise with a threat beyond their imagination, and must attempt a harrowing escape.	R	122.0	Horror, Sci-Fi, Thriller	6.4	65.0	Ridley Scott	Michael Fassbender, Katherine Waterston, Billy Crudup, Danny McBride	283176.0	74.26
Kim Cương Trong Đá	2019	With his debts mounting and angry collectors closing in, a fast-talking New York City jeweler risks everything in hope of staying afloat and alive.	C18	135.0	Crime, Drama, Thriller	7.4	91.0	Benny Safdie, Josh Safdie	Adam Sandler, Julia Fox, Idina Menzel, Mesfin Lamengo	283060.0	
Bậc Thầy Của Những Ước Mơ	2017	Celebrates the birth of show business and tells of a visionary who rose from nothing to create a spectacle that became a worldwide sensation.	P	105.0	Biography, Drama, Musical	7.5		Michael Gracey	Hugh Jackman, Michelle Williams, Zac Efron, Zendaya	282962.0	174.34
Kẻ Săn Đêm	2016	A wealthy art gallery owner is haunted by her ex-husband's novel, a violent thriller she interprets as a symbolic revenge tale.	R	116.0	Drama, Thriller	7.5	67.0	Tom Ford	Amy Adams, Jake Gyllenhaal, Michael Shannon, Aaron Taylor-Johnson	281146.0	10.66
Kẻ Hủy Diệt: Thời Đại Genysis	2015	When John Connor, leader of the human resistance, sends Sgt. Kyle Reese back to 1984 to protect Sarah Connor and safeguard the future, an unexpected turn of events creates a fractured timeline.	C16	126.0	Action, Adventure, Sci-Fi	6.3		Alan Taylor	Arnold Schwarzenegger, Jason Clarke, Emilia Clarke, Jai Courtney	279523.0	89.76
Cậu Bé Rừng Xanh	2016	After a threat from the tiger Shere Khan forces him to flee the jungle, a man-cub named Mowgli embarks on a journey of self discovery with the help of panther Bagheera and free-spirited bear Baloo.	P	106.0	Adventure, Drama, Family	7.4	77.0	Jon Favreau	Neel Sethi, Bill Murray, Ben Kingsley, Idris Elba	278663.0	364.0
Nha Trang That Thu	2013	Secret Service agent Mike Banning finds himself trapped inside the White House in the wake of a terrorist attack and works with national security to rescue the President from his kidnappers.	R	119.0	Action, Thriller	6.5		Antoine Fuqua	Gerard Butler, Aaron Eckhart, Morgan Freeman, Angela Bassett	278097.0	98.93
Đi Tìm Dory	2016	Friendly but forgetful blue tang Dory begins a search for her long-lost parents and everyone learns a few things about the real meaning of family along the way.	P	97.0	Animation, Adventure, Comedy	7.3	77.0	Andrew Stanton, Angus MacLane	Ellen DeGeneres, Albert Brooks, Ed O'Neill, Kaitlin Olson	277722.0	486.3
Dredd	2012	In a violent, futuristic city where the police have the authority to act as judge, jury and executioner, a cop teams with a trainee to take down a gang that deals the reality-altering drug, SLO-MO.	R	95.0	Action, Crime, Sci-Fi	7.1		Pete Travis	Karl Urban, Olivia Thirlby, Lena Headey, Rachel Wood	277250.0	13.41
Sát Nhân Trong Bóng Tối	2016	Hoping to walk away with a massive fortune, a trio of thieves break into the house of a blind man who isn't as helpless as he seems.	C18	88.0	Crime, Horror, Thriller	7.1	71.0	Fede Alvarez	Stephen Lang, Jane Levy, Dylan Minnette, Daniel Zovatto	276703.0	89.22
Lệnh Truy Nã Đỏ	2021	An Interpol agent successfully tracks down the world's most wanted art thief, with help from a rival thief. But nothing is as it seems, as a series of double-crosses ensue.	C13	118.0	Action, Comedy, Thriller	6.3		Rawson Marshall Thurber	Dwayne Johnson, Ryan Reynolds, Gal Gadot, Ritu Arya	276141.0	
Tay Đấm Huyền Thoại	2015	The former World Heavyweight Champion Rocky Balboa serves as a trainer and mentor to Adonis Johnson, the son of his late friend and former rival Apollo Creed.	PG-13	133.0	Action, Drama, Sport	7.6	82.0	Ryan Coogler	Michael B. Jordan, Sylvester Stallone, Tessa Thompson, Phylicia Rashad	275680.0	109.77
Gọi Em Bằng Tên Anh	2017	In 1980s Italy, romance blossoms between a seventeen-year-old student and the older man hired as his father's research assistant.	R	132.0	Drama, Romance	7.8	94.0	Luca Guadagnino	Timothée Chalamet, Armie Hammer, Michael Stuhlbarg, Amira Casar	274529.0	18.1
Người Hùng Sao Hỏa	2012	Transported to Barsoom, a Civil War vet discovers a barren planet seemingly inhabited by 12-foot tall barbarians. Finding himself prisoner of these creatures, he escapes, only to encounter Woola and a princess in desperate need of a savior.	PG-13	132.0	Action, Adventure, Sci-Fi	6.6		Andrew Stanton	Taylor Kitsch, Lynn Collins, Willem Dafoe, Samantha Morton	274446.0	73.08
Người Hùng Củ Chuối 2	2013	Following Kick-Ass' heroics, other citizens are inspired to become masked crusaders. But Red Mist leads his own group of evil supervillains to get revenge, kill Kick-Ass and destroy everything he stands for.	R	103.0	Action, Comedy, Crime	6.5		Jeff Wadlow	Aaron Taylor-Johnson, Chloë Grace Moretz, Christopher Mintz-Plasse, Jim Carrey	274439.0	28.8
Cơ Trưởng Sully	2016	"When pilot Chesley ""Sully"" Sullenberger lands his damaged plane on the Hudson River in order to save the flight's passengers and crew, some consider him a hero while others think he was reckless."	C13	96.0	Biography, Drama	7.4	74.0	Clint Eastwood	Tom Hanks, Aaron Eckhart, Laura Linney, Valerie Mahaffey	274341.0	125.07
Ám Ảnh Kinh Hoàng 2	2016	Ed and Lorraine Warren travel to North London to help a single mother raising four children alone in a house plagued by a supernatural spirit.	C18	134.0	Horror, Mystery, Thriller	7.3	65.0	James Wan	Vera Farmiga, Patrick Wilson, Madison Wolfe, Frances O'Connor	272730.0	102.47
Huyền Thoại Robin Hood	2010	In twelfth-century England, Robin Longstride and his band of marauders confront corruption in a local village and lead an uprising against the crown that will forever alter the balance of world power.	PG-13	140.0	Action, Adventure, Drama	6.6		Ridley Scott	Russell Crowe, Cate Blanchett, Matthew Macfadyen, Max von Sydow	271238.0	105.27
Siêu Cớm Tranh Tài	2010	Two mismatched New York City detectives seize an opportunity to step up like the city's top cops, whom they idolize, only things don't quite go as planned.	PG-13	107.0	Action, Comedy, Crime	6.6	64.0	Adam McKay	Will Ferrell, Mark Wahlberg, Derek Jeter, Eva Mendes	270843.0	119.22
The Place Beyond the Pines	2012	A motorcycle stunt-rider turns to robbing banks as a way to provide for his lover and their newborn--a decision that sets him on a collision course with an ambitious rookie cop navigating a department ruled by a corrupt detective.	R	140.0	Crime, Drama, Thriller	7.3	68.0	Derek Cianfrance	Ryan Gosling, Bradley Cooper, Eva Mendes, Craig Van Hook	270724.0	21.38
Alita: Thiên Thần Chiến Binh	2019	A deactivated cyborg's revived, but can't remember anything of her past and goes on a quest to find out who she is.	C16	122.0	Action, Adventure, Sci-Fi	7.3		Robert Rodriguez	Rosa Salazar, Christoph Waltz, Jennifer Connelly, Mahershala Ali	269369.0	85.71
Lời Nguyền Bóng Đêm	2012	An imprisoned vampire, Barnabas Collins, is set free and returns to his ancestral home, where his dysfunctional descendants are in need of his protection.	C16	113.0	Comedy, Fantasy, Horror	6.2		Tim Burton	Johnny Depp, Michelle Pfeiffer, Eva Green, Helena Bonham Carter	269368.0	79.73
Tên Cậu Là Gì?	2016	Two strangers find themselves linked in a bizarre way. When a connection forms, will distance be the only thing to keep them apart?	C16	106.0	Animation, Drama, Fantasy	8.4	79.0	Makoto Shinkai	Ryûnosuke Kamiki, Mone Kamishiraishi, Ryô Narita, Aoi Yûki	268739.0	5.02
Nữ Thần Chiến Binh 1984	2020	Diana must contend with a work colleague, and with a businessman whose desire for extreme wealth sends the world down a path of destruction, after an ancient artifact that grants wishes goes missing.	C13	151.0	Action, Adventure, Fantasy	5.4		Patty Jenkins	Gal Gadot, Chris Pine, Kristen Wiig, Pedro Pascal	267896.0	46.37
Tắc Kè Nhát Gan	2011	Rango is an ordinary chameleon who accidentally winds up in the town of Dirt, a lawless outpost in the Wild West in desperate need of a new sheriff.	PG	107.0	Animation, Action, Adventure	7.2	75.0	Gore Verbinski	Johnny Depp, Isla Fisher, Timothy Olyphant, Abigail Breslin	267713.0	123.48
Gã Hề Ma Quái 2	2019	Twenty-seven years after their first encounter with the terrifying Pennywise, the Losers Club have grown up and moved away, until a devastating phone call brings them back.	C18	169.0	Drama, Fantasy, Horror	6.5		Andy Muschietti	Jessica Chastain, James McAvoy, Bill Hader, Isaiah Mustafa	267131.0	211.59
Aladdin	2019	A kind-hearted street urchin and a power-hungry Grand Vizier vie for a magic lamp that has the power to make their deepest wishes come true.	P	128.0	Adventure, Comedy, Family	6.9		Guy Ritchie	Will Smith, Mena Massoud, Naomi Scott, Marwan Kenzari	266767.0	355.56
Không Dừng Lại	2014	An air marshal springs into action during a transatlantic flight after receiving a series of text messages demanding $150 million into an off-shore account, or someone will die every 20 minutes.	PG-13	106.0	Action, Mystery, Thriller	6.9		Jaume Collet-Serra	Liam Neeson, Julianne Moore, Scoot McNairy, Michelle Dockery	266042.0	92.17
Warcraft: Đại Chiến Hai Thế Giới	2016	As an Orc horde invades the planet Azeroth using a magic portal, a few human heroes and dissenting Orcs must attempt to stop the true evil behind this war.	C16	123.0	Action, Adventure, Fantasy	6.7		Duncan Jones	Travis Fimmel, Paula Patton, Ben Foster, Dominic Cooper	265420.0	47.37
Đảng 3K	2018	Ron Stallworth, an African American police officer from Colorado Springs, CO, successfully manages to infiltrate the local Ku Klux Klan branch with the help of a Jewish surrogate who eventually becomes its leader. Based on actual events.	R	135.0	Biography, Comedy, Crime	7.5	83.0	Spike Lee	John David Washington, Adam Driver, Laura Harrier, Topher Grace	265194.0	49.28
Phù Thủy	2015	A family in 1630s New England is torn apart by the forces of witchcraft, black magic and possession.	R	92.0	Drama, Fantasy, Horror	6.9	83.0	Robert Eggers	Anya Taylor-Joy, Ralph Ineson, Kate Dickie, Julian Richings	264588.0	25.14
Kẻ Xấu Đẹp Trai	2010	Evil genius Megamind finally defeats his do-gooder nemesis, Metro Man, but is left without a purpose in a superhero-free world.	P	95.0	Animation, Action, Comedy	7.3	63.0	Tom McGrath	Will Ferrell, Jonah Hill, Brad Pitt, Tina Fey	264473.0	148.42
Kẻ Lạ Mặt	2011	When a man awakens from a coma only to discover that someone has taken on his identity, he teams up with a young woman to prove who he is.	PG-13	113.0	Action, Mystery, Thriller	6.8		Jaume Collet-Serra	Liam Neeson, Diane Kruger, January Jones, Aidan Quinn	262771.0	63.69
Lincoln	2012	As the American Civil War continues to rage, America's president struggles with continuing carnage on the battlefield as he fights with many inside his own cabinet on the decision to emancipate the slaves.	PG-13	150.0	Biography, Drama, History	7.3	86.0	Steven Spielberg	Daniel Day-Lewis, Sally Field, David Strathairn, Joseph Gordon-Levitt	261809.0	182.21
Biệt Đội Hành Động	2010	A group of Iraq War veterans look to clear their name with the U.S. Military, who suspect the four men of committing a crime for which they were framed.	PG-13	117.0	Action, Adventure, Thriller	6.7		Joe Carnahan	Liam Neeson, Bradley Cooper, Sharlto Copley, Jessica Biel	260266.0	77.22
Án Mạng Trên Chuyến Tàu Tốc Hành Phương Đông	2017	When a murder occurs on the train on which he's travelling, celebrated detective Hercule Poirot is recruited to solve the case.	C16	114.0	Crime, Drama, Mystery	6.5		Kenneth Branagh	Kenneth Branagh, Penélope Cruz, Willem Dafoe, Judi Dench	259540.0	102.83
Seven Psychopaths	2012	A struggling screenwriter inadvertently becomes entangled in the Los Angeles criminal underworld after his oddball friends kidnap a gangster's beloved Shih Tzu.	R	110.0	Comedy, Crime	7.1	66.0	Martin McDonagh	Colin Farrell, Woody Harrelson, Sam Rockwell, Christopher Walken	259440.0	15.02
Bản Đồ Định Mệnh	2011	The affair between a politician and a contemporary dancer is affected by mysterious forces keeping the lovers apart.	PG-13	106.0	Romance, Sci-Fi, Thriller	7.0		George Nolfi	Matt Damon, Emily Blunt, Lisa Thoreson, Florence Kastriner	259323.0	62.5
