name	overview	tagline	certificate	runtime	genre	keywords	imdb_rate	metascore	director	stars	nvote	gross	release_date	countries	language	locations	company
300 Chiến Binh: Đế Chế Trỗi Dậy	Greek general Themistocles of Athens leads the naval charge against invading Persian forces led by mortal-turned-god Xerxes and Artemisia, vengeful commander of the Persian navy.	Seize your glory	R	102.0	Action, Drama	good versus evil, seductress, female nudity, removing clothes from someone, woman moans from pleasure	6.2	48	Noam Murro	Sullivan Stapleton, Eva Green, Lena Headey, Hans Matheson	303129	106.58	March 7, 2014 (United States)	United States	English	New Boyana Film Studios, Sofia, Bulgaria	Warner Bros., Legendary Entertainment, Cruel & Unusual Films
30' Sau Nửa Đêm	A chronicle of the decade-long hunt for al-Qaeda terrorist leader Osama bin Laden after the September 2001 attacks, and his death at the hands of the Navy S.E.A.L.s Team 6 in May 2011.	The greatest manhunt in history.	R	157.0	Drama, History, Thriller	al qaeda, terrorist, special forces, death of osama bin laden, commando raid	7.4	95	Kathryn Bigelow	Jessica Chastain, Joel Edgerton, Chris Pratt, Mark Strong	302970	95.72	January 11, 2013 (United States)	United States	English, Arabic, Urdu, Pashtu, French	Manimajra Fort, Chandigarh, Punjab, India	Columbia Pictures, Annapurna Pictures, First Light Production
Chúng Ta	A family's serene beach vacation turns to chaos when their doppelgängers appear and begin to terrorize them.	We Are Our Own Worst Enemy.	C18	116.0	Horror, Mystery, Thriller	hall of mirrors, evil twin, doppelganger, scissors, mask	6.8	81	Jordan Peele	Lupita Nyong'o, Winston Duke, Elisabeth Moss, Tim Heidecker	300869	175.08	March 22, 2019 (United States)	United States, China, Japan	English	Santa Cruz, California, USA	Monkeypaw Productions, Blumhouse Productions, Dentsu
Gia Đình Siêu Nhân 2	The Incredibles family takes on a new mission which involves a change in family roles: Bob Parr (Mr. Incredible) must manage the house while his wife Helen (Elastigirl) goes out to save the world.	It's been too long, dahlings.	P	118.0	Animation, Action, Adventure	computer animation, superheroine, superhero, working mother, parenting	7.6	80	Brad Bird	Craig T. Nelson, Holly Hunter, Sarah Vowell, Huck Milner	298296	608.58	June 15, 2018 (United States)	United States	English	Pixar Animation Studios - 1200 Park Avenue, Emeryville, California, USA	Walt Disney Pictures, Pixar Animation Studios
Mật Danh: Kế Toán	As a math savant uncooks the books for a new client, the Treasury Department closes in on his activities, and the body count starts to rise.	Calculate your choices.	R	128.0	Action, Thriller	autism, accountant, autistic child, assassin, brother brother relationship	7.3	51	Gavin O'Connor	Ben Affleck, Anna Kendrick, J.K. Simmons, Jon Bernthal	297911	86.26	October 14, 2016 (United States)	United States	English, Indonesian, French	Atlanta, Georgia, USA	Warner Bros., RatPac-Dune Entertainment, Electric City Entertainment
Phù Dâu	Competition between the maid of honor and a bridesmaid, over who is the bride's best friend, threatens to upend the life of an out-of-work pastry chef.	Save the Date	R	125.0	Comedy, Romance	casual sex, loud sex, partial female nudity, sex scene, talking during sex	6.8	75	Paul Feig	Kristen Wiig, Maya Rudolph, Rose Byrne, Terry Crews	293844	169.11	May 13, 2011 (United States)	United States	English, Thai, Spanish, French	2501 South Kinnickinnic Avenue, Milwaukee, Wisconsin, USA	Universal Pictures, Relativity Media, Apatow Productions
Lady Bird: Tuổi Nổi Loạn	In 2002, an artistically inclined 17-year-old girl comes of age in Sacramento, California.	Time to Fly.	C18	94.0	Comedy, Drama	mother daughter relationship, sacramento california, female protagonist, prom, teenage girl	7.4	93	Greta Gerwig	Saoirse Ronan, Laurie Metcalf, Tracy Letts, Lucas Hedges	292384	48.96	December 1, 2017 (United States)	United States	English, Spanish	Sacramento, California, USA	IAC Films, Scott Rudin Productions, Entertainment 360
Phi Vụ Thế Kỷ 2	The Four Horsemen resurface, and are forcibly recruited by a tech genius to pull off their most impossible heist yet.	Reappearing June 10	C13	129.0	Action, Adventure, Comedy	hands tied behind back, handcuffed together, magic, escape, magician	6.4	46	Jon M. Chu	Jesse Eisenberg, Mark Ruffalo, Woody Harrelson, Dave Franco	292167	65.08	June 10, 2016 (United States)	United States, France, Hong Kong	English, Mandarin, Cantonese	Macau, China	Summit Entertainment, TIK Films, K/O Paper Products
Hoàng Tử Ba Tư: Dòng Cát Thời Gian	A young fugitive prince and princess must stop a villain who unknowingly threatens to destroy the world with a special dagger that enables the magic sand inside to reverse time.	Defy the Future	PG-13	116.0	Action, Adventure, Fantasy	persia, snow adventure, alamut, dagger, prince	6.6	50	Mike Newell	Jake Gyllenhaal, Gemma Arterton, Ben Kingsley, Alfred Molina	291506	90.76	May 28, 2010 (United States)	United States	English	Marrakech, Morocco	Walt Disney Pictures, Jerry Bruckheimer Films
Bạch Tuyết Và Gã Thợ Săn	In a twist to the fairy tale, the Huntsman ordered to take Snow White into the woods to be killed winds up becoming her protector and mentor in a quest to vanquish the Evil Queen.	The Fairytale is Over.	C16	127.0	Action, Adventure, Drama	snow white, queen, magic, fairy tale, evil queen	6.1	57	Rupert Sanders	Kristen Stewart, Chris Hemsworth, Charlize Theron, Sam Claflin	291453	155.33	June 1, 2012 (United States)	United States, United Kingdom	English	Quiraing, Skye, Highland, Scotland, UK	Roth Films, Universal Pictures
Sông Sót	Marcus Luttrell and his team set out on a mission to capture or kill notorious Taliban leader Ahmad Shah, in late June 2005. Marcus and his team are left to fight for their lives in one of the most valiant efforts of modern warfare.	Live to Tell the Story	R	121.0	Action, Biography, Drama	navy seal, outnumbered, shot multiple times, courage, survival	7.5	60	Peter Berg	Mark Wahlberg, Taylor Kitsch, Emile Hirsch, Ben Foster	289533	125.1	January 10, 2014 (United States)	United States, United Kingdom	English, Pashtu, Arabic	Albuquerque, New Mexico, USA	Film 44, Emmett/Furla/Oasis Films (EFO Films), Spikings Entertainment
Kung Fu Panda 2	Po and his friends fight to stop a peacock villain from conquering China with a deadly new weapon, but first the Dragon Warrior must come to terms with his past.	Ska2oosh!	PG	90.0	Animation, Action, Adventure	anthropomorphic animal, chinese food, china, courage, father son relationship	7.2	67	Jennifer Yuh Nelson	Jack Black, Angelina Jolie, Jackie Chan, Dustin Hoffman	287229	165.25	May 26, 2011 (United States)	United States	English	Glendale, California, USA	DreamWorks Animation
Chiến Binh Đèn Lồng Xanh	Reckless test pilot Hal Jordan is granted an alien ring that bestows him with otherworldly powers that inducts him into an intergalactic police force, the Green Lantern Corps.	One of us... becomes one of them.	PG-13	114.0	Action, Adventure, Sci-Fi	comicbook movie, superhero action, ring, spacecraft, alien	5.5	39	Martin Campbell	Ryan Reynolds, Blake Lively, Peter Sarsgaard, Mark Strong	286588	116.6	June 17, 2011 (United States)	United States	English	San Diego, California, USA	Warner Bros., De Line Pictures, DC Entertainment
Tiền Định	For his final assignment, a top temporal agent must pursue the one criminal that has eluded him throughout time. The chase turns into a unique, surprising and mind-bending exploration of love, fate, identity and time travel taboos.	To save the future, he must reshape the past.	R	97.0	Action, Drama, Sci-Fi	time travel, temporal agent, time machine, time paradox, in love with oneself	7.4	69	Michael Spierig, Peter Spierig	Ethan Hawke, Sarah Snook, Noah Taylor, Madeleine West	284701	0.07	January 9, 2015 (United States)	Australia, United States	English	Docklands Studios, Melbourne, Victoria, Australia	Screen Australia, Screen Queensland, Blacklab Entertainment
Sinh Vật Huyền Bí: Tội Ác Của Grindelwald	"The second installment of the ""Fantastic Beasts"" series featuring the adventures of Magizoologist Newt Scamander."	The fate of one will change the future of all.	C13	134.0	Adventure, Family, Fantasy	witch, wizard, magical creature, paris france, sequel	6.5	52	David Yates	Eddie Redmayne, Katherine Waterston, Dan Fogler, Johnny Depp	284404	159.56	November 16, 2018 (United States)	United Kingdom, United States	English, French	Lacock Abbey, Lacock, Chippenham, Wiltshire, England, UK	Heyday Films, Warner Bros.
Manchester by the Sea	A depressed uncle is asked to take care of his teenage nephew after the boy's father dies.	Breathtaking... A truly incredible piece of cinema!	R	137.0	Drama	death, death of brother, uncle nephew relationship, loss of brother, manchester massachusetts	7.8	96	Kenneth Lonergan	Casey Affleck, Michelle Williams, Kyle Chandler, Lucas Hedges	284071	47.7	December 16, 2016 (United States)	United States	English	Manchester-by-the-Sea, Massachusetts, USA	Amazon Studios, K Period Media, Pearl Street Films
Cuộc Chiến Giữa Các Vị Thần	Perseus, a demigod and the son of Zeus, battles the minions of Hades and the Underworld in order to stop them from conquering Olympus and Earth.	The Clash Begins 2.4.2010	PG-13	106.0	Action, Adventure, Fantasy	kraken, greek mythology, hand to hand combat, famous line, myth	5.8	39	Louis Leterrier	Sam Worthington, Liam Neeson, Ralph Fiennes, Jason Flemyng	284050	163.21	April 2, 2010 (United States)	United States, United Kingdom, Australia	English	Teide National Park, Tenerife, Canary Islands, Spain	Warner Bros., Legendary Entertainment, Thunder Road Pictures
Ngày Tàn Của Thế Giới	Five friends who reunite in an attempt to top their epic pub crawl from twenty years earlier unwittingly become humanity's only hope for survival.	Good food. Fine ales. Total Annihilation.	R	109.0	Action, Comedy, Sci-Fi	paranoia, twin actresses for twin sisters, doppelganger, group therapy, alcoholic	6.9	81	Edgar Wright	Simon Pegg, Nick Frost, Martin Freeman, Rosamund Pike	283959	26.0	August 23, 2013 (United States)	United Kingdom, United States, Japan	English	The Cork Public House, Welwyn Garden City, England, UK	Universal Pictures, Focus Features, Relativity Media
Kim Cương Trong Đá	With his debts mounting and angry collectors closing in, a fast-talking New York City jeweler risks everything in hope of staying afloat and alive.		C18	135.0	Crime, Drama, Thriller	neo noir, jewelry, money, murder, gambling	7.4	91	Benny Safdie, Josh Safdie	Adam Sandler, Julia Fox, Idina Menzel, Mesfin Lamengo	283326		December 25, 2019 (United States)	United States	English, Hebrew	Okiep, Northern Cape, South Africa	A24, Elara Pictures, IAC Films
Quái Vật Không Gian	The crew of a colony ship, bound for a remote planet, discover an uncharted paradise with a threat beyond their imagination, and must attempt a harrowing escape.	Run	R	122.0	Horror, Sci-Fi, Thriller	xenomorph, android, alien, future, stasis	6.4	65	Ridley Scott	Michael Fassbender, Katherine Waterston, Billy Crudup, Danny McBride	283298	74.26	May 19, 2017 (United States)	United Kingdom, United States	English, German	Milford Sound, Fiordland National Park, Southland, New Zealand	Twentieth Century Fox, TSG Entertainment, Scott Free Productions
Bậc Thầy Của Những Ước Mơ	Celebrates the birth of show business and tells of a visionary who rose from nothing to create a spectacle that became a worldwide sensation.	The Impossible Comes True	P	105.0	Biography, Drama, Musical	singing, circus, bearded lady, social outcast, social prejudice	7.5	48	Michael Gracey	Hugh Jackman, Michelle Williams, Zac Efron, Zendaya	283178	174.34	December 20, 2017 (United States)	United States	English	1 E 78th St, New York City, New York, USA	Bona Film Group, Chernin Entertainment, TSG Entertainment
Kẻ Săn Đêm	A wealthy art gallery owner is haunted by her ex-husband's novel, a violent thriller she interprets as a symbolic revenge tale.	When you love someone you can't just throw it away	R	116.0	Drama, Thriller	revenge, loss of wife, art gallery, rape, female frontal nudity	7.5	67	Tom Ford	Amy Adams, Jake Gyllenhaal, Michael Shannon, Aaron Taylor-Johnson	281340	10.66	December 9, 2016 (United States)	United States, China	English	The Trap Bar - 2822 E Avenue I, Lancaster, California, USA	Focus Features, Fade to Black Productions, Artina Films
Kẻ Hủy Diệt: Thời Đại Genysis	When John Connor, leader of the human resistance, sends Sgt. Kyle Reese back to 1984 to protect Sarah Connor and safeguard the future, an unexpected turn of events creates a fractured timeline.	The rules have been reset.	C16	126.0	Action, Adventure, Sci-Fi	cyborg, future, time machine, human versus cyborg, human versus robot	6.3	38	Alan Taylor	Arnold Schwarzenegger, Jason Clarke, Emilia Clarke, Jai Courtney	279619	89.76	July 1, 2015 (United States)	United States, Canada	English, Ukrainian	New Orleans, Louisiana, USA	Paramount Pictures, Skydance Media, Annapurna Pictures
Cậu Bé Rừng Xanh	After a threat from the tiger Shere Khan forces him to flee the jungle, a man-cub named Mowgli embarks on a journey of self discovery with the help of panther Bagheera and free-spirited bear Baloo.	The legend will never be the same.	P	106.0	Adventure, Drama, Family	jungle, human animal relationship, tiger, wolf, black panther	7.4	77	Jon Favreau	Neel Sethi, Bill Murray, Ben Kingsley, Idris Elba	278755	364.0	April 15, 2016 (United States)	United Kingdom, United States	English, Hindi, Bengali, Kannada, Telugu, Tamil, Assamese, Urdu, Oriya, Punjabi, Malayalam, Marathi, Rajasthani, Haryanvi, Nepali	Los Angeles, California, USA	Fairview Entertainment, Moving Picture Company (MPC), Prime Focus
Nha Trang That Thu	Secret Service agent Mike Banning finds himself trapped inside the White House in the wake of a terrorist attack and works with national security to rescue the President from his kidnappers.	We are never stronger than when we are tested.	R	119.0	Action, Thriller	politics, political thriller, political assassination, president, speaker of the house	6.5	41	Antoine Fuqua	Gerard Butler, Aaron Eckhart, Morgan Freeman, Angela Bassett	278210	98.93	March 22, 2013 (United States)	United States	English, Korean	Bossier City, Louisiana, USA	Millennium Films, Millennium Films, G-BASE
Đi Tìm Dory	Friendly but forgetful blue tang Dory begins a search for her long-lost parents and everyone learns a few things about the real meaning of family along the way.	She just kept swimming...	P	97.0	Animation, Adventure, Comedy	fish, ocean, whale, octopus driving a truck, talking animal	7.3	77	Andrew Stanton, Angus MacLane	Ellen DeGeneres, Albert Brooks, Ed O'Neill, Kaitlin Olson	277892	486.3	June 17, 2016 (United States)	United States	English, Indonesian	Pixar Animation Studios - 1200 Park Avenue, Emeryville, California, USA	Pixar Animation Studios, Walt Disney Pictures
Dredd	In a violent, futuristic city where the police have the authority to act as judge, jury and executioner, a cop teams with a trainee to take down a gang that deals the reality-altering drug, SLO-MO.	Judgment is coming	R	95.0	Action, Crime, Sci-Fi	post apocalypse, cyberpunk, dystopia, based on comic, drugs	7.1	60	Pete Travis	Karl Urban, Olivia Thirlby, Lena Headey, Rachel Wood	277369	13.41	September 21, 2012 (United States)	United Kingdom, South Africa, India	English	Johannesburg, South Africa	DNA Films, Peach Trees, Rena Films
Sát Nhân Trong Bóng Tối	Hoping to walk away with a massive fortune, a trio of thieves break into the house of a blind man who isn't as helpless as he seems.	This house looked like an easy target. Until they found what was inside.	C18	88.0	Crime, Horror, Thriller	blind man, robbery gone awry, breaking and entering, trapped in a house, death of daughter	7.1	71	Fede Alvarez	Stephen Lang, Jane Levy, Dylan Minnette, Daniel Zovatto	276864	89.22	August 26, 2016 (United States)	United States, Hungary	English	Stern Film Studio, Pomáz, Hungary	Screen Gems, Stage 6 Films, Ghost House Pictures
Lệnh Truy Nã Đỏ	An Interpol agent successfully tracks down the world's most wanted art thief, with help from a rival thief. But nothing is as it seems, as a series of double-crosses ensue.	Pro and cons.	C13	118.0	Action, Comedy, Thriller	thief, heist, chase, rivalry, art	6.3	37	Rawson Marshall Thurber	Dwayne Johnson, Ryan Reynolds, Gal Gadot, Ritu Arya	276424		November 12, 2021 (United States)	United States	English, Russian, Italian, Spanish, Indonesian	Rome, Italy	Netflix, Seven Bucks Productions, Flynn Picture Company
Tay Đấm Huyền Thoại	The former World Heavyweight Champion Rocky Balboa serves as a trainer and mentor to Adonis Johnson, the son of his late friend and former rival Apollo Creed.	Your legacy is more than a name	PG-13	133.0	Action, Drama, Sport	gym, training, fight, boxing, boxing match	7.6	82	Ryan Coogler	Michael B. Jordan, Sylvester Stallone, Tessa Thompson, Phylicia Rashad	275803	109.77	November 25, 2015 (United States)	United States	English, Spanish	Goodison Park, Goodison Road, Walton, Liverpool, Merseyside, England, UK	Metro-Goldwyn-Mayer (MGM), Warner Bros., New Line Cinema
Gọi Em Bằng Tên Anh	In 1980s Italy, romance blossoms between a seventeen-year-old student and the older man hired as his father's research assistant.	Is it better to speak or die?	R	132.0	Drama, Romance	gay romance, male male kiss, father son relationship, american abroad, sex with fruit	7.8	94	Luca Guadagnino	Timothée Chalamet, Armie Hammer, Michael Stuhlbarg, Amira Casar	274849	18.1	January 19, 2018 (United States)	Italy, France, United States, Brazil	English, Italian, French, German, Hebrew	Crema, Cremona, Lombardy, Italy	Frenesy Film Company, La Cinéfacture, RT Features
Người Hùng Sao Hỏa	Transported to Barsoom, a Civil War vet discovers a barren planet seemingly inhabited by 12-foot tall barbarians. Finding himself prisoner of these creatures, he escapes, only to encounter Woola and a princess in desperate need of a savior.	Lost in Our World. Found in Another.	PG-13	132.0	Action, Adventure, Sci-Fi	arizona desert, princess, alien, arizona territory, american civil war	6.6	51	Andrew Stanton	Taylor Kitsch, Lynn Collins, Willem Dafoe, Samantha Morton	274528	73.08	March 9, 2012 (United States)	United States	English	Moab, Utah, USA	Walt Disney Pictures
Người Hùng Củ Chuối 2	Following Kick-Ass' heroics, other citizens are inspired to become masked crusaders. But Red Mist leads his own group of evil supervillains to get revenge, kill Kick-Ass and destroy everything he stands for.	You Can't Fight Your Destiny.	R	103.0	Action, Comedy, Crime	superhero, high school, vigilante, sex in a bathroom, jail	6.5	41	Jeff Wadlow	Aaron Taylor-Johnson, Chloë Grace Moretz, Christopher Mintz-Plasse, Jim Carrey	274523	28.8	August 16, 2013 (United States)	United Kingdom, United States, Japan	English	Toronto, Ontario, Canada	Universal Pictures, Marv Films, Dentsu
Cơ Trưởng Sully	"When pilot Chesley ""Sully"" Sullenberger lands his damaged plane on the Hudson River in order to save the flight's passengers and crew, some consider him a hero while others think he was reckless."	The untold story behind the miracle on the Hudson	C13	96.0	Biography, Drama	aviation, pilot, investigation, bird sucked into jet engine, airplane accident	7.4	74	Clint Eastwood	Tom Hanks, Aaron Eckhart, Laura Linney, Valerie Mahaffey	274493	125.07	September 9, 2016 (United States)	United States	English	Atlanta, Georgia, USA	Flashlight Films, Hurwitz Creative, Malpaso Productions
Ám Ảnh Kinh Hoàng 2	Ed and Lorraine Warren travel to North London to help a single mother raising four children alone in a house plagued by a supernatural spirit.	Enfield, London 1977. The next true story from the case files of Ed and Lorraine Warren	C18	134.0	Horror, Mystery, Thriller	haunted house, second part, house, single mother, demonic possession	7.3	65	James Wan	Vera Farmiga, Patrick Wilson, Madison Wolfe, Frances O'Connor	272902	102.47	June 10, 2016 (United States)	Canada, United States, United Kingdom	English	Graeme Road, Enfield, Middlesex, England, UK	New Line Cinema, RatPac-Dune Entertainment, The Safran Company
Huyền Thoại Robin Hood	In twelfth-century England, Robin Longstride and his band of marauders confront corruption in a local village and lead an uprising against the crown that will forever alter the balance of world power.	The untold story behind the legend.	PG-13	140.0	Action, Adventure, Drama	robin hood character, archer, medieval times, reference to robin hood, 1190s	6.6	53	Ridley Scott	Russell Crowe, Cate Blanchett, Matthew Macfadyen, Max von Sydow	271325	105.27	May 14, 2010 (United States)	United States, United Kingdom	English, French, Ukrainian	Freshwater West, Pembrokeshire, Wales, UK	Universal Pictures, Imagine Entertainment, Relativity Media
Siêu Cớm Tranh Tài	Two mismatched New York City detectives seize an opportunity to step up like the city's top cops, whom they idolize, only things don't quite go as planned.	When the cops are busy... Our only hope is...	PG-13	107.0	Action, Comedy, Crime	police, detective, buddy, buddy movie, new york police	6.6	64	Adam McKay	Will Ferrell, Mark Wahlberg, Derek Jeter, Eva Mendes	271017	119.22	August 6, 2010 (United States)	United States	English, Ukrainian	Nathan's Hot Dogs, Coney Island, Brooklyn, New York City, New York, USA	Columbia Pictures, Gary Sanchez Productions, Mosaic
The Place Beyond the Pines	A motorcycle stunt-rider turns to robbing banks as a way to provide for his lover and their newborn--a decision that sets him on a collision course with an ambitious rookie cop navigating a department ruled by a corrupt detective.	One moment can change your life.	R	140.0	Crime, Drama, Thriller	bank robbery, bank robber, interracial relationship, illegitimate son, neo noir	7.3	68	Derek Cianfrance	Ryan Gosling, Bradley Cooper, Eva Mendes, Craig Van Hook	270873	21.38	April 19, 2013 (United States)	United States	English, Spanish	Schenectady, New York, USA	Sidney Kimmel Entertainment, Electric City Entertainment, Verisimilitude
Alita: Thiên Thần Chiến Binh	A deactivated cyborg's revived, but can't remember anything of her past and goes on a quest to find out who she is.	Her Legend Begins.	C16	122.0	Action, Adventure, Sci-Fi	cyborg, based on manga, strong female lead, female cyborg, cyberpunk	7.3	53	Robert Rodriguez	Rosa Salazar, Christoph Waltz, Jennifer Connelly, Mahershala Ali	269658	85.71	February 14, 2019 (United States)	Japan, Canada, United States	English, Spanish	Austin, Texas, USA	Twentieth Century Fox, Lightstorm Entertainment, Troublemaker Studios
Lời Nguyền Bóng Đêm	An imprisoned vampire, Barnabas Collins, is set free and returns to his ancestral home, where his dysfunctional descendants are in need of his protection.	Every Family Has Its Demons	C16	113.0	Comedy, Fantasy, Horror	vampire, blood, surrealism, cartoon on tv, year 1972	6.2	55	Tim Burton	Johnny Depp, Michelle Pfeiffer, Eva Green, Helena Bonham Carter	269456	79.73	May 11, 2012 (United States)	United States, Australia, United Kingdom	English	Trafalgar Castle School, Whitby, Ontario, Canada	Warner Bros., Village Roadshow Pictures, Infinitum Nihil
Tên Cậu Là Gì?	Two strangers find themselves linked in a bizarre way. When a connection forms, will distance be the only thing to keep them apart?	Experience Japan's #1 film of 2016, from visionary director Makoto Shinkai	C16	106.0	Animation, Drama, Fantasy	race against time, comet, anime, japan, tokyo japan	8.4	79	Makoto Shinkai	Ryûnosuke Kamiki, Mone Kamishiraishi, Ryô Narita, Aoi Yûki	268997	5.02	April 7, 2017 (United States)	Japan	Japanese		Amuse, CoMix Wave Films, East Japan Marketing & Communications Inc.
Nữ Thần Chiến Binh 1984	Diana must contend with a work colleague, and with a businessman whose desire for extreme wealth sends the world down a path of destruction, after an ancient artifact that grants wishes goes missing.	A new era of wonder begins.	C13	151.0	Action, Adventure, Fantasy	sequel, dc extended universe, based on comic book, superhero, second part	5.4	60	Patty Jenkins	Gal Gadot, Chris Pine, Kristen Wiig, Pedro Pascal	268221	46.37	December 25, 2020 (United States)	United States	English, Arabic, Russian, Mandarin	Landmark Mall - 5801 Duke Street, Alexandria, Virginia, USA	Atlas Entertainment, DC Entertainment, The Stone Quarry
Tắc Kè Nhát Gan	Rango is an ordinary chameleon who accidentally winds up in the town of Dirt, a lawless outpost in the Wild West in desperate need of a new sheriff.	From the director of 'Pirates of the Caribbean'	PG	107.0	Animation, Action, Adventure	anthropomorphism, sheriff, chameleon, lizard, duel	7.2	75	Gore Verbinski	Johnny Depp, Isla Fisher, Timothy Olyphant, Abigail Breslin	267882	123.48	March 4, 2011 (United States)	United States	English		Paramount Pictures, Nickelodeon Movies, Blind Wink Productions
Gã Hề Ma Quái 2	Twenty-seven years after their first encounter with the terrifying Pennywise, the Losers Club have grown up and moved away, until a devastating phone call brings them back.	You'll Float Again	C18	169.0	Drama, Fantasy, Horror	killer clown, based on the works of stephen king, clown, evil clown, evil	6.5	58	Andy Muschietti	Jessica Chastain, James McAvoy, Bill Hader, Isaiah Mustafa	267329	211.59	September 6, 2019 (United States)	United States, Canada	English, North American Indian, Spanish	Toronto, Ontario, Canada	New Line Cinema, Double Dream, Vertigo Entertainment
