name	overview	tagline	certificate	runtime	genre	keywords	imdb_rate	metascore	director	stars	nvote	gross	release_date	countries	language	locations	company
Lũ Trẻ Đều Ổn	Two children conceived by artificial insemination bring their biological father into their non-traditional family life.	Nic and Jules had the perfect family, until they met the man who made it all possible.	R	106.0	Comedy, Drama, Romance	female rear nudity, f rated, sex scene, father son relationship, father daughter relationship	7.0	86	Lisa Cholodenko	Annette Bening, Julianne Moore, Mark Ruffalo, Mia Wasikowska	131295	20.81	July 30, 2010 (United States)	United States, France	English	Occidental College - 1600 Campus Road, Eagle Rock, Los Angeles, California, USA	Focus Features, Gilbert Films, Saint Aire Production
Quốc Vương	Hal, wayward prince and heir to the English throne, is crowned King Henry V after his tyrannical father dies. Now the young king must navigate palace politics, the war his father left behind, and the emotional strings of his past life.		C18	140.0	Biography, Drama, History	british royalty, 15th century, combat, battle of agincourt, father son relationship	7.3	62	David Michôd	Tom Glynn-Carney, Gábor Czap, Tom Fisher, Edward Ashley	131229		November 1, 2019 (United States)	United Kingdom, Hungary, United States, Australia	English, French, Latin	Szilvásvárad, Hungary	Netflix, Plan B Entertainment, Porchlight Films
Ma Gương	A woman tries to exonerate her brother, who was convicted of murder, by proving that the crime was committed by a supernatural phenomenon.	You see what it wants you to see.	R	104.0	Horror, Mystery, Thriller	mirror, brother sister relationship, trauma, released from a mental hospital, supernatural horror	6.5	61	Mike Flanagan	Karen Gillan, Brenton Thwaites, Katee Sackhoff, Rory Cochrane	131166	27.7	April 11, 2014 (United States)	United States	English	Mobile, Alabama, USA	Intrepid Pictures, MICA Entertainment, WWE Studios
Những Kẻ Man Rợ	Pot growers Ben and Chon face off against the Mexican drug cartel who kidnapped their shared girlfriend.	Young. Beautiful. Deadly.	R	131.0	Action, Crime, Drama	one female two males threesome, marijuana, male rear nudity, southern california, arms tied overhead	6.4	59	Oliver Stone	Aaron Taylor-Johnson, Taylor Kitsch, Blake Lively, Benicio Del Toro	131012	47.38	July 6, 2012 (United States)	United States	English, Spanish	Moyo Island, Nusa Tenggara Barat, Indonesia	Ixtlan, Onda Entertainment, Relativity Media
Carol	An aspiring photographer develops an intimate relationship with an older woman in 1950s New York.	Some people change your life forever	R	118.0	Drama, Romance	lesbian romance, lesbian, road trip, child custody, photographer	7.2	94	Todd Haynes	Cate Blanchett, Rooney Mara, Sarah Paulson, Kyle Chandler	130984	12.71	January 15, 2016 (United States)	United Kingdom, United States, Australia	English	Cincinnati, Ohio, USA	The Weinstein Company, Film4, Number 9 Films
Bí Kíp Luyện Rồng 3: Vùng Đất Bí Ẩn	"When Hiccup discovers Toothless isn't the only Night Fury, he must seek ""The Hidden World"", a secret Dragon Utopia before a hired tyrant named Grimmel finds it first."	The Final Chapter	P	104.0	Animation, Action, Adventure	dragon, sequel, finale, dragon hunter, flaming sword	7.4	71	Dean DeBlois	Jay Baruchel, America Ferrera, F. Murray Abraham, Cate Blanchett	130489	160.8	February 22, 2019 (United States)	United States, Japan	English		DreamWorks Animation, Mad Hatter Entertainment, Dentsu
Wild	A chronicle of one woman's 1,100-mile solo hike undertaken as a way to recover from a recent personal tragedy.	Based on the inspirational best seller.	R	115.0	Adventure, Biography, Drama	hiking, grief, long distance hiking, back to nature, female protagonist	7.1	74	Jean-Marc Vallée	Reese Witherspoon, Laura Dern, Gaby Hoffmann, Michiel Huisman	130335	37.88	December 19, 2014 (United States)	United States	English	Crater Lake, Crater Lake National Park, Oregon, USA	Bob Industries, Pacific Standard, Searchlight Pictures
Kubo và Sứ Mệnh Samurai	A young boy named Kubo must locate a magical suit of armour worn by his late father in order to defeat a vengeful spirit from the past.	The quest begins	P	101.0	Animation, Action, Adventure	stop motion, samurai, mother son relationship, magic, storytelling	7.7	84	Travis Knight	Charlize Theron, Art Parkinson, Matthew McConaughey, Ralph Fiennes	130306	48.02	August 19, 2016 (United States)	United States, Japan	English		Focus Features, Laika Entertainment
Coherence: Hiện Tượng Siêu Nhiên	Strange things begin to happen when a group of friends gather for a dinner party on an evening when a comet is passing overhead.	Rearrange your brain.		89.0	Drama, Mystery, Sci-Fi	parallel universe, comet, dinner party, quantum physics, paranoia	7.2	65	James Ward Byrkit	Emily Baldoni, Maury Sterling, Nicholas Brendon, Elizabeth Gracen	130003	0.07	August 6, 2014 (United States)	United States, United Kingdom	English		Bellanova Films, Ugly Duckling Films
Băng Cướp Bất Đắc Dĩ	Loyalties are tested when five friends and former special forces operatives reunite to take down a South American drug lord, unleashing a chain of unintended consequences.		R	125.0	Action, Thriller	greed, money, theft, boat, chase	6.4	61	J.C. Chandor	Ben Affleck, Oscar Isaac, Charlie Hunnam, Garrett Hedlund	129998		March 13, 2019 (United States)	United States	English, Spanish, Portuguese	Soacha, Bogotá, Colombia	Acquire Entertainment Group, Atlas Entertainment
Vụ Giết Người Bí Ẩn	A New York cop and his wife go on a European vacation to reinvigorate the spark in their marriage, but end up getting framed and on the run for the death of an elderly billionaire.	First class problems. Second class detectives.	C16	97.0	Action, Comedy, Crime	murder, boat, detective, pokies, lie	6.0	38	Kyle Newacheck	Adam Sandler, Jennifer Aniston, Luke Evans, Terence Stamp	129715		June 14, 2019 (United States)	United States, Italy, Canada	English, French, Latin, Spanish	Montreal, Québec, Canada	Netflix, Happy Madison Productions, Endgame Entertainment
Bước Đi Thể Kỷ	In 1974, high-wire artist Philippe Petit recruits a team of people to help him realize his dream: to walk the immense void between the World Trade Center towers.	Every dream begins with a single step	PG	123.0	Adventure, Biography, Drama	tightrope walker, 1970s, world trade center manhattan new york city, skyscraper, based on true story	7.3	70	Robert Zemeckis	Joseph Gordon-Levitt, Charlotte Le Bon, Guillaume Baillargeon, Émilie Leclerc	129552	10.14	October 9, 2015 (United States)	United States	English, French, Czech	Montréal, Québec, Canada	Sony Pictures Entertainment (SPE), TriStar Productions, ImageMovers
Quyền Lực Tuyệt Đối	J. Edgar Hoover, powerful head of the F.B.I. for nearly fifty years, looks back on his professional and personal life.	The Most Powerful Man in the World	R	137.0	Biography, Drama, Romance	abuse of power, closeted homosexual, gay relationship, j. edgar hoover character, united states of america	6.5	59	Clint Eastwood	Leonardo DiCaprio, Armie Hammer, Naomi Watts, Josh Hamilton	129502	37.31	November 11, 2011 (United States)	United States	English	Warrenton, Virginia, USA	Imagine Entertainment, Malpaso Productions, Wintergreen Productions
Khách Sạn Huyền Bí 2	Dracula and his friends try to bring out the monster in his half human, half vampire grandson in order to keep Mavis from leaving the hotel.	Drac's pack is back	PG	89.0	Animation, Adventure, Comedy	hotel, vampire, party, bird, dracula	6.6	44	Genndy Tartakovsky	Adam Sandler, Andy Samberg, Selena Gomez, Kevin James	129442	169.7	September 25, 2015 (United States)	United States	English		Columbia Pictures, LStar Capital, Sony Pictures Animation
Sound of Metal	A heavy-metal drummer's life is thrown into freefall when he begins to lose his hearing.	Music was his world. Then silence revealed a new one.	R	120.0	Drama, Music	drug addict, deaf community, musician, anger, hearing loss	7.7	82	Darius Marder	Riz Ahmed, Olivia Cooke, Paul Raci, Lauren Ridloff	128953		December 4, 2020 (United States)	United States	English, American Sign Language, French, Persian	Antwerp, Belgium	Caviar, Flat 7 Productions, Ward Four
Thợ Săn Tiền Thưởng	A bounty hunter learns that his next target is his ex-wife, a reporter working on a murder cover-up. Soon after their reunion, the always-at-odds duo find themselves on a run-for-their-lives adventure.	The pursuit begins Spring 2010	PG-13	110.0	Action, Comedy, Romance	bounty hunter, downward spiral, man wrapped in a towel, columbia tristar, u.s. car	5.5	22	Andy Tennant	Jennifer Aniston, Gerard Butler, Gio Perez, Joel Marsh Garland	128929	67.06	March 19, 2010 (United States)	United States	English, Ukrainian	Far Rockaway, Queens, New York City, New York, USA	Columbia Pictures, Relativity Media, Original Film
Đội Dân Phòng Tinh Nhuệ	Four men who form a neighborhood watch group as a way to get out of their day-to-day family routines find themselves defending the Earth from an alien invasion.	Got Protection?	R	102.0	Comedy, Sci-Fi	alien, neighbor, alien invasion, female full frontal nudity, disguise	5.7	36	Akiva Schaffer	Ben Stiller, Vince Vaughn, Jonah Hill, Billy Crudup	128858	35.35	July 27, 2012 (United States)	United States	English	Marietta, Georgia	Twentieth Century Fox, Dune Entertainment, 21 Laps Entertainment
Tình Yêu Và Quái Vật	Seven years after he survived the monster apocalypse, lovably hapless Joel leaves his cozy underground bunker behind on a quest to reunite with his ex.		PG-13	109.0	Action, Adventure, Comedy	monster, survival, dog, love, teenager	6.9	63	Michael Matthews	Dylan O'Brien, Jessica Henwick, Michael Rooker, Dan Ewing	128663	1.07	October 16, 2020 (United States)	Canada, United States, Australia	English	Mount Cotton, Queensland, Australia	Paramount Pictures, Entertainment One, 21 Laps Entertainment
Nhóc Trùm	A suit-wearing, briefcase-carrying baby pairs up with his 7-year old brother to stop the dastardly plot of the CEO of Puppy Co.	Born leader	PG	97.0	Animation, Adventure, Comedy	baby, brother brother relationship, talking baby, close up of eye, puppy	6.3	50	Tom McGrath	Alec Baldwin, Steve Buscemi, Jimmy Kimmel, Lisa Kudrow	128530	175.0	March 31, 2017 (United States)	United States	English, Spanish	Glendale, California, USA	DreamWorks Animation
Nổi Loạn Tuổi 17	High-school life gets even more unbearable for Nadine when her best friend, Krista, starts dating her older brother.	You're only young once... is it over yet?	R	104.0	Comedy, Drama	adolescence, coming of age film, high school, depressed teen, suicide talk	7.3	77	Kelly Fremon Craig	Hailee Steinfeld, Haley Lu Richardson, Blake Jenner, Kyra Sedgwick	128160	14.43	November 18, 2016 (United States)	United States, China	English	Guildford Park Secondary School, Surrey, British Columbia, Canada	Gracie Films, Huayi Brothers Media, Robert Simonds Productions
Khẩu Chiến	Two pairs of parents hold a cordial meeting after their sons are involved in a fight, though as their time together progresses, increasingly childish behavior throws the discussion into chaos.	A new comedy of no manners.	R	80.0	Comedy, Drama	marriage, single set production, husband wife relationship, based on play, telephone	7.1	61	Roman Polanski	Jodie Foster, Kate Winslet, Christoph Waltz, John C. Reilly	127904	2.55	November 18, 2011 (Spain)	France, Germany, Poland, Spain, United States	English	Brooklyn, New York City, New York, USA	SBS Productions, Constantin Film, SPI Film Studio
Cỗ Máy Tử Thần	In a post-apocalyptic world where cities ride on wheels and consume each other to survive, two people meet in London and try to stop a conspiracy.	Some scars never heal.	C16	128.0	Action, Adventure, Fantasy	post apocalypse, steampunk, dystopia, capitalism, social commentary	6.1	44	Christian Rivers	Hera Hilmar, Robert Sheehan, Hugo Weaving, Jihae	127753	15.95	December 14, 2018 (United States)	United States, New Zealand, Japan, China	English	New Zealand	Media Rights Capital (MRC), Scholastic Productions, Silvertongue Films
Gương Đen: Bandersnatch	A young programmer starts to question reality when he adapts a mad writer's fantasy novel into a video game.		C18	90.0	Drama, Fantasy, Mystery	interactive movie, computer, gamebook, interactive, multiple endings	7.1		David Slade	Fionn Whitehead, Craig Parkinson, Alice Lowe, Asim Chaudhry	127640		December 28, 2018 (United States)	United Kingdom, United States	English	St. George's Walk, Croydon, London, England, UK	House Of Tomorrow, Netflix
Tay Đấm Huyền Thoại 2	Under the tutelage of Rocky Balboa, newly crowned heavyweight champion Adonis Creed faces off against Viktor Drago, the son of Ivan Drago.	The Legend Becomes Stronger.	PG-13	130.0	Drama, Sport	baby, training montage, sequel, boxing match, boxer	7.1	66	Steven Caple Jr.	Michael B. Jordan, Sylvester Stallone, Tessa Thompson, Phylicia Rashad	127036	115.72	November 21, 2018 (United States)	United States	English, Russian, Sign Languages	Deming, New Mexico, USA	Metro-Goldwyn-Mayer (MGM), Warner Bros., New Line Cinema
Những Bà Mẹ 'Ngoan'	When three overworked and under-appreciated moms are pushed beyond their limits, they ditch their conventional responsibilities for a jolt of long overdue freedom, fun and comedic self-indulgence.	Party Like a Mother	R	100.0	Comedy	female full frontal nudity, pubic hair, female nudity, nudity, crying woman	6.2	60	Jon Lucas, Scott Moore	Mila Kunis, Kathryn Hahn, Kristen Bell, Christina Applegate	126952	113.26	July 29, 2016 (United States)	United States, China	English	Chicago, Illinois, USA	STX Entertainment, Huayi Brothers Media, BillBlock Media
Vé Độc Thân	Rick and Fred, two husbands who are having difficulty in their marriages, are given a Hall Pass by their wives: for one week, they can do whatever they want.	One week. No rules.	R	105.0	Comedy, Romance	nudity, marriage, cheating wife, adultery, breasts	5.9	45	Bobby Farrelly, Peter Farrelly	Owen Wilson, Jason Sudeikis, Christina Applegate, Jenna Fischer	126818	45.06	February 25, 2011 (United States)	United States	English	Falmouth, Massachusetts, USA	New Line Cinema, Conundrum Entertainment
I Origins	A molecular biologist and his laboratory partner uncover evidence that may fundamentally change society as we know it.		R	106.0	Drama, Mystery, Romance	eye, evolution, reincarnation, worm, elevator	7.3	57	Mike Cahill	Michael Pitt, Steven Yeun, Astrid Bergès-Frisbey, Brit Marling	126642	0.33	July 18, 2014 (Poland)	United States	English, Hindi	Delhi, India	Verisimilitude, WeWork Studios, Bersin Pictures
Safety Not Guaranteed	Three magazine employees head out on an assignment to interview a guy who placed a classified advertisement seeking a companion for time travel.	WANTED Someone to go back in time with me. This is not a joke. You'll get paid when we get back. Must bring your own weapons. Safety not guaranteed. I have only done this once before.	R	86.0	Adventure, Comedy, Drama	time machine, intern, classified ad, time travel, falling in love	6.9	72	Colin Trevorrow	Aubrey Plaza, Mark Duplass, Jake Johnson, Karan Soni	126561	4.01	June 15, 2012 (Canada)	United States	English	Ocean Shores, Washington, USA	FilmDistrict, Big Beach Films, Duplass Brothers Productions
Green Room	A punk rock band is forced to fight for survival after witnessing a murder at a neo-Nazi skinhead bar.	Now. Whatever you saw or did. Is no longer my concern. But let's be clear. It won't end well.	R	95.0	Crime, Drama, Horror	neo nazi, murder, punk band, band, white supremacist	7.0	79	Jeremy Saulnier	Anton Yelchin, Imogen Poots, Alia Shawkat, Patrick Stewart	126370	3.22	May 13, 2016 (United States)	United States	English	Portland, Oregon, USA	Broad Green Pictures, Film Science
Bãhubali: The Beginning	In ancient India, an adventurous and daring man becomes involved in a decades-old feud between two warring peoples.	India's Biggest Motion Picture		159.0	Action, Drama	india, medieval times, chariot, kingdom, warrior	8.0		S.S. Rajamouli	Prabhas, Rana Daggubati, Anushka Shetty, Tamannaah Bhatia	126122	6.74	July 9, 2015 (United States)	India	Telugu, Tamil	Bulgaria	Arka Mediaworks
Tổng Đài Truy Vết	A demoted police officer assigned to a call dispatch desk is conflicted when he receives an emergency phone call from a kidnapped woman.	Listen. Carefully.	C16	90.0	Crime, Drama, Thriller	remake, kidnapping, police officer, police, woman in jeopardy	6.3	63	Antoine Fuqua	Jake Gyllenhaal, Riley Keough, Peter Sarsgaard, Christina Vidal	125652		October 1, 2021 (United States)	United States	English, Spanish	MBS Media Campus - 1600 Rosecrans Avenue, Manhattan Beach, California, USA	Amet Entertainment, Bold Films, Endeavor Content
Good Time	After a botched bank robbery lands his younger brother in prison, Connie Nikas embarks on a twisted odyssey through New York City's underworld to get his brother Nick out of jail.	Are you ready for a Good Time?	R	102.0	Crime, Drama, Thriller	robbery gone awry, brother brother relationship, neo noir, on the run, wheelchair	7.3	80	Benny Safdie, Josh Safdie	Robert Pattinson, Benny Safdie, Jennifer Jason Leigh, Buddy Duress	125592	2.03	August 25, 2017 (United States)	United States	English	Adventureland Amusement Park, Farmingdale, Long Island, New York, USA	Elara Pictures, Rhea Films (II)
Lối Sống Đồi Trụy 2	After 20 years abroad, Mark Renton returns to Scotland and reunites with his old friends Sick Boy, Spud, and Begbie.	Face your past. Choose your future.	R	117.0	Comedy, Drama	old friends reunited, sequel, drugs, female nudity, escape from prison	7.2	67	Danny Boyle	Ewan McGregor, Ewen Bremner, Jonny Lee Miller, Robert Carlyle	125373	2.4	March 31, 2017 (United States)	United Kingdom	English, Bulgarian, Scots	Sofia, Bulgaria	Artbees, DNA Films, Decibel Films
Người Đàn Bà Cuồng Dâm: Phần 1	A self-diagnosed nymphomaniac recounts her erotic experiences to the man who saved her after a beating.	Forget About Love		117.0	Drama	anal sex, cunnilingus, casual sex, female nudity, female full frontal nudity	6.9	64	Lars von Trier	Charlotte Gainsbourg, Stellan Skarsgård, Stacy Martin, Shia LaBeouf	125339	0.79	March 6, 2014 (United States)	Denmark, Germany, Belgium, United Kingdom, France, Sweden, United States	English	Klinikum Leverkusen, Paracelsusstrasse, Leverkusen, North Rhine-Westphalia, Germany	Zentropa Entertainments, Zentropa International Köln, Heimatfilm
Tay Chơi Không Tuổi	Right before his wedding, an uptight guy is tricked into driving his grandfather, a lecherous former Army Lieutenant Colonel, to Florida for Spring Break.	This is Jason. He's a little worried about his grandpa.	R	102.0	Comedy	grandfather grandson relationship, gold digger, cowgirl sex position, nymphomaniac, nudity	5.9	21	Dan Mazer	Robert De Niro, Zac Efron, Zoey Deutch, Aubrey Plaza	125278	35.59	January 22, 2016 (United States)	United States, United Kingdom	English	Tybee Island, Georgia, USA	Lionsgate, BillBlock Media, QED International
Hai Vị Giáo Hoàng	Behind Vatican walls, the conservative Pope Benedict XVI and the liberal future Pope Francis must find common ground to forge a new path for the Catholic Church.	Inspired by true events.	C16	125.0	Biography, Comedy, Drama	pope, catholic priest, flashback, confessional, younger version of character	7.6	75	Fernando Meirelles	Jonathan Pryce, Anthony Hopkins, Juan Minujín, Luis Gnecco	124634		December 20, 2019 (United States)	United Kingdom, Italy, United States	English, Spanish, Italian, Latin, Portuguese, French, German	Rome, Lazio, Italy	Netflix, Rideback
Chuyện Gì Xảy Ra Với Thứ Hai	In a world where families are limited to one child due to overpopulation, a set of identical septuplets must avoid being put to a long sleep by the government and dangerous infighting while investigating the disappearance of one of their own.	Seven Sisters. One Identity.	C18	123.0	Action, Crime, Fantasy	one child policy, overpopulation, actress playing multiple roles, septuplets, totalitarianism	6.8	47	Tommy Wirkola	Noomi Rapace, Glenn Close, Willem Dafoe, Marwan Kenzari	124483		August 18, 2017 (United States)	United Kingdom, France, United States, Belgium	English	Constanta, Romania	Vendome Pictures, Nexus Factory, Raffaella Productions
Neighbors 2: Sorority Rising	When their new next-door neighbors turn out to be a sorority even more debaucherous than the fraternity that lived there before, Mac and Kelly team with their former enemy, Teddy, to bring the girls down.	New neighbors.	R	92.0	Comedy	gay marriage proposal, party, next door neighbor, sorority, drug dealer	5.7	58	Nicholas Stoller	Seth Rogen, Rose Byrne, Zac Efron, Chloë Grace Moretz	124248	55.46	May 20, 2016 (United States)	United States, China	English	Atlanta, Georgia, USA	Universal Pictures, Perfect World Pictures, Point Grey Pictures
Đột kích 2: Kẻ sát nhân	Only a short time after the first raid, Rama goes undercover with the thugs of Jakarta and plans to bring down the syndicate and uncover the corruption within his police force.	It's Not Over Yet	R	150.0	Action, Crime, Thriller	violence, prison, jakarta indonesia, kitchen fight, corrupt police officer	7.9	71	Gareth Evans	Iko Uwais, Yayan Ruhian, Arifin Putra, Oka Antara	124231	2.63	April 11, 2014 (United States)	Indonesia, United States	Indonesian, Japanese, English, Sign Languages	Gombong, Central Java, Indonesia	Sony Pictures Classics, Stage 6 Films, Pt. Merantau Films
Đêm Ở Viện Bảo Tàng 3: Bí Mật Hầm Mộ	Larry spans the globe, uniting favorite and new characters while embarking on an epic quest to save the magic before it is gone forever.	One final night to save the day	PG	98.0	Adventure, Comedy, Family	night watchman, museum of natural history manhattan new york city, star died before release, museum, tablet	6.2	47	Shawn Levy	Ben Stiller, Robin Williams, Owen Wilson, Dick Van Dyke	124159	113.75	December 19, 2014 (United States)	United Kingdom, United States	English	London, England, UK	Twentieth Century Fox, 21 Laps Entertainment, 1492 Pictures
Căn Phòng Tử Thần	Six strangers find themselves in a maze of deadly mystery rooms and must use their wits to survive.	Solve the Puzzle. Escape the Room. Find the clues or die.	C16	99.0	Action, Adventure, Horror	escape room, puzzle, teamwork, clue, code	6.4	48	Adam Robitel	Taylor Russell, Logan Miller, Jay Ellis, Tyler Labine	124124	57.01	January 4, 2019 (United States)	United States, South Africa	English	Chicago, Illinois, USA	Columbia Pictures, Original Film, Department of Trade and Industry of South Africa
Nếu Em Ở Lại	Life changes in an instant for young Mia Hall after a car accident puts her in a coma. During an out-of-body experience, she must decide whether to wake up and live a life far different than she had imagined. The choice is hers if she can go on.	Live for Love	PG-13	107.0	Drama, Fantasy, Music	out of body experience, coma, boyfriend girlfriend relationship, car accident, reference to the exploited	6.7	46	R.J. Cutler	Chloë Grace Moretz, Mireille Enos, Jamie Blackley, Joshua Leonard	124118	50.47	August 22, 2014 (United States)	United States	English	Vancouver, British Columbia, Canada	DiNovi Pictures, Metro-Goldwyn-Mayer (MGM), New Line Cinema
Parker	A thief with a unique code of professional ethics is double-crossed by his crew and left for dead. Assuming a new disguise and forming an unlikely alliance with a woman on the inside, he looks to hijack the score of the crew's latest heist.	To get away clean, you have to play dirty.	R	118.0	Action, Crime, Thriller	action hero, thief, heist, based on novel, female topless nudity	6.2	42	Taylor Hackford	Jason Statham, Jennifer Lopez, Michael Chiklis, Nick Nolte	123898	17.62	January 25, 2013 (United States)	United States	English	West Palm Beach, Florida, USA	Incentive Filmed Entertainment, Sierra / Affinity, Alexander/ Mitchell Productions
Dị Biệt: Những Kẻ Trung Kiên	After the earth-shattering revelations of Insurgent, Tris must escape with Four beyond the wall that encircles Chicago, to finally discover the shocking truth of the world around them.	Break the boundaries of your world	PG-13	120.0	Action, Adventure, Mystery	based on young adult novel, dystopia, female rear nudity, tough girl, surveillance	5.7	33	Robert Schwentke	Shailene Woodley, Theo James, Jeff Daniels, Naomi Watts	123822	66.18	March 18, 2016 (United States)	United States	English	Atlanta, Georgia, USA	Mandeville Films, Red Wagon Entertainment, Summit Entertainment
The Call	When a veteran 911 operator takes a life-altering call from a teenage girl who has just been abducted, she realizes that she must confront a killer from her past in order to save the girl's life.	There are 188 million 911 calls a year. This one made it personal.	R	96.0	Drama, Thriller	911 call, pixelated nudity, child abduction, trapdoor, woods	6.7	51	Brad Anderson	Halle Berry, Evie Thompson, Abigail Breslin, Morris Chestnut	123749	51.87	March 15, 2013 (United States)	United States	English	Burbank Town Center - 201 E Magnolia, Burbank, California, USA	TriStar Pictures, Stage 6 Films, Troika Pictures
Tòa Tháp Chọc Trời	A security expert must infiltrate a burning skyscraper, 225 stories above ground, when his family is trapped inside by criminals.	The sky is the limit.	C16	102.0	Action, Adventure, Thriller	skyscraper, fire, terrorism, prosthetic leg, evil man	5.8	51	Rawson Marshall Thurber	Dwayne Johnson, Neve Campbell, Chin Han, Roland Møller	123713	68.42	July 13, 2018 (United States)	United States	English, Cantonese, Mandarin	Coquitlam, British Columbia, Canada	Legendary Entertainment, Flynn Picture Company, Seven Bucks Productions
