id	name	overview	certificate	runtime	nvote	imdb_rate	director	cast	genre	keyword	release_date	country	language	location	company	budget	gross
tt1473832	Nhóc Tì Của Tiểu Thư Jones	Forty-something and single again, Bridget decides to focus on her job and surround herself with friends. Then she discovers that she is pregnant--but she is only 50% sure of the baby's father's identity.	R	123.0	77087	6.5	Sharon Maguire	Renée Zellweger, Gemma Jones, Jim Broadbent, Sally Phillips	Comedy, Drama, Romance	pregnant woman doesn&apos;t know who the father is,love triangle,fatherhood,motherhood,diary	September 16, 2016 (Vietnam)	United States, France, China, United Kingdom, Japan	English, Italian	Croke Park, Dublin, County Dublin, Ireland	Universal Pictures, StudioCanal, Miramax	$35,000,000	$211,952,420
tt3713166	Hủy Kết Bạn	A group of online chatroom friends find themselves haunted by a mysterious, supernatural force using the account of their dead friend.	(Banned)	83.0	77031	5.6	Levan Gabriadze	Heather Sossaman, Matthew Bohrer, Courtney Halverson, Shelley Hennig	Horror, Mystery, Thriller	skype,teen horror,facebook,suicide,cyberbullying	April 17, 2015 (United States)	United States, Russia	English	Santa Clarita, California, USA	Bazelevs Production, Blumhouse Productions	$1,000,000	$62,882,090
tt2990140	Biên Niên Sử Giáng Sinh	The story of sister and brother, Kate and Teddy Pierce, whose Christmas Eve plan to catch Santa Claus on camera turns into an unexpected journey that most kids could only dream about.	PG	104.0	76986	7.0	Clay Kaytis	Kurt Russell, Darby Camp, Judah Lewis, Oliver Hudson	Adventure, Comedy, Family, Fantasy	christmas,reindeer,christmas spirit,santa&apos;s sleigh,brother sister relationship	November 22, 2018 (United States)	United States	English, Spanish, French, Romanian	Toronto, Ontario, Canada	1492 Pictures, Madhouse Entertainment, Netflix		
tt7014006	Eighth Grade	An introverted teenage girl tries to survive the last week of her disastrous eighth grade year before leaving to start high school.	R	93.0	76972	7.4	Bo Burnham	Elsie Fisher, Josh Hamilton, Emily Robinson, Jake Ryan	Comedy, Drama	school,father daughter relationship,introverted teenage girl,insecurity,vlog	August 3, 2018 (United States)	United States	English	White Plains, New York, USA	A24, IAC Films	$2,000,000	$14,347,433
tt0884732	Dịch Vụ Trai Thuê	Two weeks shy of his wedding, a socially awkward guy enters into a charade by hiring the owner of a company that provides best men for grooms in need.	R	101.0	76959	6.6	Jeremy Garelick	Kevin Hart, Josh Gad, Kaley Cuoco, Affion Crockett	Comedy	bachelor party,bride and groom,marriage,nipples visible through clothing,cleavage	January 30, 2015 (Vietnam)	United States	English, Spanish, Ukrainian	1351 Sepulveda Blvd, Torrance, California, USA	LStar Capital, Miramax, Screen Gems	$23,000,000	$79,799,880
tt2387433	Bầu Trời Đen	As the Barrett family's peaceful suburban life is rocked by an escalating series of disturbing events, they come to learn that a terrifying and deadly force is after them, one which may have arrived from beyond the stars.	PG-13	97.0	76845	6.3	Scott Stewart	Keri Russell, Jake Brennan, Josh Hamilton, Dakota Goyo	Horror, Sci-Fi, Thriller	alien abduction,child&apos;s drawing,dead bird,job interview,shotgun	March 29, 2013 (Vietnam)	United States	English	Santa Clarita, California, USA	Alliance Films, Automatik Entertainment, Blumhouse Productions	$3,500,000	$27,858,103
tt0975645	Hitchcock	The relationship between Alfred Hitchcock and his wife Alma Reville during the filming of Tâm Thần Hoảng Loạn (1960) in 1959 is explored.	PG-13	98.0	76746	6.8	Sacha Gervasi	Anthony Hopkins, Helen Mirren, Scarlett Johansson, Danny Huston	Biography, Drama, Romance	year 1959,1950s,los angeles california,film actress,year 1944	December 14, 2012 (United States)	United States, United Kingdom	English	Paramount Studios - 5555 Melrose Avenue, Hollywood, Los Angeles, California, USA	Searchlight Pictures, Cold Spring Pictures, The Montecito Picture Company	$15,700,000	$27,039,669
tt11003218	Con Lợn	A truffle hunter who lives alone in the Oregon wilderness must return to his past in Portland in search of his beloved foraging pig after she is kidnapped.	R	92.0	76610	6.9	Michael Sarnoski	Nicolas Cage, Alex Wolff, Adam Arkin, Cassandra Violet	Drama, Mystery	chef,human animal relationship,cabin in the woods,cooking,fight club	July 16, 2021 (United States)	United States, United Kingdom	English, Persian	208 SW Broadway, Portland, Oregon, USA	AI-Film, Altitude Film, BlockBox Entertainment		$3,889,432
tt2226597	Ngọn Núi Giữa Hai Ta	Stranded after a tragic plane crash, two strangers must forge a connection to survive the extreme elements of a remote snow-covered mountain. When they realize help is not coming, they embark on a perilous journey across the wilderness.	C16	112.0	76590	6.4	Hany Abu-Assad	Kate Winslet, Idris Elba, Beau Bridges, Dermot Mulroney	Drama, Thriller	mountain,snow,wilderness,airport,photograph	November 17, 2017 (Vietnam)	United States	English	Vancouver, British Columbia, Canada	Chernin Entertainment, Twentieth Century Fox	$35,000,000	$62,832,209
tt10579952	Master	An alcoholic professor is sent to a juvenile school, where he clashes with a gangster who uses the school children for criminal activities.		179.0	76565	7.3	Lokesh Kanagaraj	Joseph Vijay, Vijay Sethupathi, Malavika Mohanan, Arjun Das	Action, Thriller	professor,drugs,alcohol,drinking,college	January 13, 2021 (India)	India	Tamil	Chennai, Tamil Nadu, India	X.B. Film Creators, Seven Screen Studio, B4U Motion Pictures	₹1,350,000,000	$28,692,230
tt4540710	Quý Cô Sloane	In the high-stakes world of political power-brokers, Elizabeth Sloane is the most sought after and formidable lobbyist in D.C. But when taking on the most powerful opponent of her career, she finds winning may come at too high a price.	R	132.0	76519	7.5	John Madden	Jessica Chastain, Mark Strong, Gugu Mbatha-Raw, Michael Stuhlbarg	Drama	consultant,lawyer,pills,lobbyist,congressional hearing	December 9, 2016 (Canada)	United Kingdom, France, Canada, United States	English	Toronto, Ontario, Canada	EuropaCorp, France 2 Cinéma, FilmNation Entertainment	$13,000,000	$9,101,546
tt1433811	Disconnect	A drama centered on a group of people searching for human connections in today's wired world.	R	115.0	76466	7.5	Henry Alex Rubin	Jason Bateman, Jonah Bobo, Haley Ramm, Hope Davis	Drama, Thriller	bare chested male,bare chested boy,bare chested teenage boy,fbi federal bureau of investigation,female nudity	July 5, 2013 (United States)	United States	English	Saw Mill River Motel, Elmsford, New York, USA	LD Entertainment, Liddell Entertainment, Exclusive Media Group	$10,000,000	$3,428,048
tt9389998	Pushpa: The Rise - Part 1	A manual labourer rises through the ranks of a smuggling syndicate, making some powerful enemies in the process.		179.0	76443	7.6	Sukumar	Allu Arjun, Fahadh Faasil, Rashmika Mandanna, Jagadeesh Prathap Bandari	Action, Crime, Drama, Thriller	smuggling	December 17, 2021 (India)	India	Telugu, Hindi, Tamil, Kannada, Malayalam	Rajahmundry, Andhra Pradesh, India	Mythri Movie Makers, Muttamsetty Media		$7,592,374
tt1740707	Trolljegeren	A group of students investigates a series of mysterious bear killings, but learns that there are much more dangerous things going on. They start to follow a mysterious hunter, learning that he is actually a troll hunter.	PG-13	103.0	76430	6.9	André Øvredal	Otto Jespersen, Robert Stoltenberg, Knut Nærum, Glenn Erland Tosterud	Drama, Fantasy, Horror, Sci-Fi, Thriller	troll,hunter,bear,secret government agency,found footage	October 29, 2010 (Norway)	Norway	Norwegian, English	Volda, Norway	Filmkameratene A/S, Film Fund FUZZ, SF Norge A/S	NOK 19,900,000	$5,341,098
tt6111574	Bí Mật Bên Kia Khung Cửa	An agoraphobic woman living alone in New York begins spying on her new neighbors, only to witness a disturbing act of violence.	C18	100.0	76423	5.7	Joe Wright	Amy Adams, Gary Oldman, Anthony Mackie, Fred Hechinger	Crime, Drama, Mystery, Thriller	knife violence,stabbing,knife,neighbor,agoraphobic	May 14, 2021 (United States)	United States	English	104 West 121st Street, New York City, New York, USA	20th Century Studios, Fox 2000 Pictures, Scott Rudin Productions	$40,000,000	
tt10618286	Mank	1930s Hollywood is re-evaluated through the eyes of scathing social critic and alcoholic screenwriter Herman J. Mankiewicz as he races to finish the screenplay of Công Dân Kane (1941).	C16	131.0	76419	6.8	David Fincher	Gary Oldman, Amanda Seyfried, Lily Collins, Tom Pelphrey	Biography, Comedy, Drama	1930s,1940s,screenwriter,alcoholic,los angeles california	December 4, 2020 (United States)	United States	English, German, Latin	Victorville, California, USA	Blue Light, Flying Studio, Netflix Studios		
tt8155288	Sinh Nhật Chết Chóc 2	Tree Gelbman discovers that dying over and over was surprisingly easier than the dangers that lie ahead.	C16	100.0	76415	6.2	Christopher Landon	Jessica Rothe, Israel Broussard, Phi Vu, Suraj Sharma	Comedy, Horror, Mystery, Sci-Fi, Thriller	time loop,sequel,time travel,university,suicide	February 15, 2019 (Vietnam)	United States, Japan	English, French	New Orleans, Louisiana, USA	Blumhouse Productions, Dentsu, Digital Riot Media	$9,000,000	$64,600,152
tt2709692	Kẻ Cắp Giáng Sinh	A grumpy Grinch plots to ruin Christmas for the village of Whoville.	P	85.0	76277	6.4	Yarrow Cheney, Scott Mosier	Benedict Cumberbatch, Cameron Seely, Rashida Jones, Pharrell Williams	Animation, Comedy, Family, Fantasy, Musical	dr. seuss&apos; how the grinch stole christmas,christmas,3d animation,computer animation,christmas movie	November 9, 2018 (Vietnam)	United States	English	Illumination Entertainment - 1805 Colorado Avenue, Santa Monica, California, USA	Universal Pictures, Universal Animation Studios, Illumination Entertainment	$75,000,000	$526,760,632
tt3661210	Cuộc Khai Quật	An archaeologist embarks on the historically important excavation of Sutton Hoo in 1938.	C16	112.0	76083	7.1	Simon Stone	Carey Mulligan, Ralph Fiennes, Lily James, Johnny Flynn	Biography, Drama, History	discovery,archeological dig,boat,airplane,homosexuals	January 29, 2021 (United Kingdom)	United Kingdom	English	Shackleford, Surrey, England, UK	Netflix, Magnolia Mae Films, Clerkenwell Films		$693
tt5657846	Bố Ngoan, Bố Hư 2	Having finally gotten used to each other's existence, Brad and Dusty must now deal with their intrusive fathers during the holidays.	PG-13	100.0	76064	6.0	Sean Anders	Will Ferrell, Mark Wahlberg, Mel Gibson, John Lithgow	Comedy	second part,stepfamily,father son relationship,father son talk,father son conflict	December 8, 2017 (Vietnam)	United States	English, Spanish	Great Barrington, Massachusetts, USA	Paramount Pictures, Gary Sanchez Productions	$69,000,000	$180,613,824
tt12789558	Belfast	A young boy and his working-class Belfast family experience the tumultuous late 1960s.	PG-13	98.0	76009	7.3	Kenneth Branagh	Jude Hill, Lewis McAskie, Caitríona Balfe, Jamie Dornan	Biography, Drama	the troubles,narrow mindedness,year 1969,belfast northern ireland,irish protestant	January 21, 2022 (United Kingdom)	United Kingdom	English	Belfast, County Antrim, Northern Ireland, UK	TKBC, Northern Ireland Screen	$25,000,000	$48,918,959
tt1491044	The Iceman	The story of Richard Kuklinski, the notorious contract killer and family man. When he was finally arrested in 1986, neither his wife nor his daughters had any clue about his real profession.	R	106.0	75960	6.8	Ariel Vromen	Michael Shannon, Chris Evans, James Franco, Winona Ryder	Biography, Crime, Drama, Thriller	based on true story,contract killer,murder of a girl,crime family,gambino crime family	May 2, 2013 (Lebanon)	United States	English	Shreveport, Louisiana, USA	Bleiberg Entertainment, Millennium Films, FortyFour Studios	$10,000,000	$4,552,970
tt3007512	The Water Diviner	An Australian man travels to Turkey after the Battle of Gallipoli to try to locate his three missing sons.	R	111.0	75942	7.0	Russell Crowe	Russell Crowe, Olga Kurylenko, Jai Courtney, Isabel Lucas	Drama, History, War	world war one,based on true story,anzac cavalry,1910s,gallipoli	December 26, 2014 (Australia)	Australia, United States	English, Turkish, Greek, Russian	Mugla, Turkey	Fear of God Films, Hopscotch Features, RatPac Entertainment	$22,500,000	$38,176,317
tt5220122	Khách Sạn Huyền Bí 3: Kỳ Nghỉ Ma Cà Rồng	Count Dracula and company participate in a cruise for sea-loving monsters, unaware that their boat is being commandeered by the monster-hating Van Helsing family.	P	97.0	75940	6.3	Genndy Tartakovsky	Adam Sandler, Andy Samberg, Selena Gomez, Kevin James	Animation, Adventure, Comedy, Family, Fantasy, Horror	witch,train,pet,dragon,dog	July 13, 2018 (Vietnam)	United States, South Korea	English, Spanish, German, Russian		Sony Pictures Animation, Media Rights Capital (MRC), Rough Draft Korea	$80,000,000	$528,583,774
tt6921996	Johnny English: Tái Xuất Giang Hồ	After a cyber-attack reveals the identity of all of the active undercover agents in Britain, Johnny English is forced to come out of retirement to find the mastermind hacker.	C13	89.0	75666	6.2	David Kerr	Rowan Atkinson, Ben Miller, Olga Kurylenko, Emma Thompson	Action, Adventure, Comedy	spy,sequel,parody,teacher,france	September 21, 2018 (Vietnam)	United Kingdom, France, United States, China	English, Russian, French, German	Saint Aygulf, Fréjus, South France, France	Universal Pictures, StudioCanal, Working Title Films	$25,000,000	$158,972,499
tt1711425	21 & Over	The night before his big medical school interview, a promising student celebrates his 21st birthday with his two best friends.	R	93.0	75471	5.8	Jon Lucas, Scott Moore	Miles Teller, Justin Chon, Jonathan Keltz, Sarah Wright	Comedy	cell phone,21st birthday,college student,standing up to father,college campus	March 1, 2013 (United States)	United States	English, Spanish	Seattle, Washington, USA	Relativity Media, SkyLand Entertainment, Virgin Produced	$13,000,000	$48,065,672
tt6977338	Những Cậu Trai Ngoan	Three 6th grade boys ditch school and embark on an epic journey while carrying accidentally stolen drugs, being hunted by teenage girls, and trying to make their way home in time for a long-awaited party.	C18	90.0	75432	6.7	Gene Stupnitsky	Jacob Tremblay, Keith L. Williams, Brady Noon, Molly Gordon	Adventure, Comedy	party,drone,divorce,bullying,chase	August 16, 2019 (United States)	United States	English	Vancouver, British Columbia, Canada	Universal Pictures, Good Universe, Point Grey Pictures	$20,000,000	$111,173,598
tt4532826	Siêu Trộm Lừng Danh Robin Hood	A war-hardened Crusader and his Moorish commander mount an audacious revolt against the corrupt English crown.	C16	116.0	75103	5.3	Otto Bathurst	Taron Egerton, Jamie Foxx, Ben Mendelsohn, Eve Hewson	Action, Adventure, Drama, Thriller	robin hood character,priest,church,forest,politics	November 30, 2018 (Vietnam)	United States	English, Arabic, Latin	Dubrovnik, Croatia	Summit Entertainment, TIK Films, Appian Way	$100,000,000	$86,493,046
tt1323045	Đóng Băng	Three skiers stranded on a chairlift are forced to make life-or-death choices, which prove more perilous than staying put and freezing to death.	R	93.0	74994	6.2	Adam Green	Shawn Ashmore, Emma Bell, Kevin Zegers, Ed Ackerman	Adventure, Drama, Mystery, Thriller	chairlift,ski resort,ski lift,winter,cold weather	March 25, 2010 (Kazakhstan)	United States	English	Snowbasin, Utah, USA	A Bigger Boat, ArieScope Pictures		$3,843,774
tt1355631	The Infiltrator	A U.S. Customs official uncovers a money laundering scheme involving Colombian drug lord Pablo Escobar.	R	127.0	74929	7.0	Brad Furman	Bryan Cranston, John Leguizamo, Diane Kruger, Amy Ryan	Biography, Crime, Drama, Thriller	undercover agent,money laundering,corruption,drug cartel,reference to pablo escobar	July 13, 2016 (United States)	United Kingdom, United States	English, Spanish	Tampa Bay, Florida, USA	George Films, Good Films Collective, Lipsync Productions	$28,000,000	$21,011,110
tt2359024	Blue Ruin	A mysterious outsider's quiet life is turned upside down when he returns to his childhood home to carry out an act of vengeance. Proving himself an amateur assassin, he winds up in a brutal fight to protect his estranged family.	R	90.0	74856	7.1	Jeremy Saulnier	Macon Blair, Devin Ratray, Amy Hargreaves, Kevin Kolack	Crime, Drama, Thriller	crowdfunded,vengeance,neo noir,car,written by director	July 9, 2014 (France)	United States, France	English	Virginia, USA	The Lab of Madness, Film Science, Neighborhood Watch	$420,000	$993,313
tt5033998	Những Thiên Thần Của Charlie	When a young systems engineer blows the whistle on a dangerous technology, Charlie's Angels are called into action, putting their lives on the line to protect us all.	C16	118.0	74776	4.9	Elizabeth Banks	Kristen Stewart, Naomi Scott, Ella Balinska, Elizabeth Banks	Action, Adventure, Comedy	girls with guns,handgun,shooting,gun,rifle	November 15, 2019 (Vietnam)	United States, China, Germany	English, French, Portuguese, German, Turkish	Istanbul, Turkey	Columbia Pictures, 2.0 Entertainment, Perfect World Pictures	$48,000,000	$73,279,888
tt0790628	Nghệ Sĩ Đích Thực	"A veteran Vegas magician tries to revive his career after his longtime partner quits, he gets fired from his casino act, and an edgy new ""street magician"" steals his thunder."	PG-13	100.0	74388	5.9	Don Scardino	Steve Carell, Luke Vanek, Steve Buscemi, Mason Cook	Comedy	elvis presley character,slapstick comedy,woman changes clothes,woman wears a gas mask,magician	March 15, 2013 (United States)	United States	English, Spanish	Bally's Casino Resort - 3645 Las Vegas Boulevard South, Las Vegas, Nevada, USA	New Line Cinema, BenderSpink, Carousel Productions (II)	$30,000,000	$27,437,881
tt2452386	Nguyên Tắc Vàng	A man suffering a family loss enrolls in a class about care-giving that changes his perspective on life.		97.0	74015	7.3	Rob Burnett	Craig Roberts, Paul Rudd, Selena Gomez, Alex Huff	Comedy, Drama	road trip,caregiver,handicapped person,abandoned by father,mother son relationship	June 24, 2016 (United States)	United States	English	Cartersville, Georgia, USA	Levantine Films, Worldwide Pants		
tt3045616	Quý Tộc Săn Tranh	Juggling angry Russians, the British Mi5, and an international terrorist, debonair art dealer and part-time rogue Charlie Mortdecai races to recover a stolen painting rumored to contain a code that leads to lost gold.	C16	107.0	73920	5.5	David Koepp	Johnny Depp, Gwyneth Paltrow, Ewan McGregor, Olivia Munn	Action, Adventure, Comedy, Crime, Mystery	art dealer,macguffin,burning a portrait,false portrait,fired from a job	January 23, 2015 (Vietnam)	United States, United Kingdom	English	Old Royal Naval College, Greenwich, London, England, UK	Madison Wells, Infinitum Nihil, Mad Chance	$60,000,000	$47,275,717
tt6679794	Vị Vua Trái Pháp	A true David vs. Goliath story of how the 14th century Scottish 'Outlaw King' Robert the Bruce used cunning and bravery to defeat the much larger and better equipped occupying English army.	R	121.0	73843	6.9	David Mackenzie	Chris Pine, Stephen Dillane, Rebecca Robin, Billy Howle	Action, Biography, Drama, History, War	scotland,scottish independence,medieval times,warfare,guerilla warfare	November 9, 2018 (United Kingdom)	United Kingdom, United States	English, French, Gaelic, Latin	Linlithgow Palace, Linlithgow, Falkirk, Scotland, UK	Sigma Films, Anonymous Content, Clockwork Sessions	$120,000,000	
tt1586265	Tâm Sự Bà Bầu	Follows the lives of five interconnected couples as they experience the thrills and surprises of having a baby and realize that no matter what you plan for, life does not always deliver what is expected.	PG-13	110.0	73741	5.7	Kirk Jones	Cameron Diaz, Matthew Morrison, J. Todd Smith, Dennis Quaid	Comedy, Drama, Romance	repetition in title,pregnancy,photographer,baby,expecting twins	June 29, 2012 (Vietnam)	United States	English	South Africa	Lionsgate, Alcon Entertainment, Phoenix Pictures	$40,000,000	$84,384,002
tt1753383	Mục Đích Sống Của Cún Con	A dog looks to discover his purpose in life over the course of several lifetimes and owners.	PG	100.0	73720	7.2	Lasse Hallström	Josh Gad, Dennis Quaid, Peggy Lipton, Bryce Gheisar	Adventure, Comedy, Drama, Family, Fantasy	deflated football,reincarnation,dog,grandparents,firecracker	January 27, 2017 (United States)	United States, India	English	Winnipeg, Manitoba, Canada	Dreamworks Pictures, Walden Media, Amblin Entertainment	$22,000,000	$205,035,819
tt10280276	Coolie No. 1	After being insulted by a rich businessman named Rosario, pandit Jai Kishen teaches him a lesson by getting his daughter married to Raju - a Coolie posing as a millionaire.		134.0	73688	4.2	David Dhawan	Varun Dhawan, Sara Ali Khan, Paresh Rawal, Jaaved Jaaferi	Action, Comedy, Romance	revenge,typographic abbreviation in title,numero symbol in title,period in title,remake	December 25, 2020 (India)	India	Hindi	Mumbai, Maharashtra, India	Pooja Entertainment & Films, Puja Films		
tt5988370	Reis	A drama about the early life of Recep Tayyip Erdogan, the president of Turkey, focusing on his childhood in Istanbul, his political career as the mayor of Istanbul from 1994 to 1998, and his short imprisonment in 1999.		108.0	73682	1.0	Hüdaverdi Yavuz	Orhan Aydin, Özlem Balci, Volkan Basaran, Reha Beyoglu	Biography, Drama	prime minister,president,turk	March 3, 2017 (Turkey)	Turkey	Turkish	Turkey	Kafkasör Film Akademisi	$8,000,000	$538,551
tt6265828	A Ghost Story	In this singular exploration of legacy, love, loss, and the enormity of existence, a recently deceased, white-sheeted ghost returns to his suburban home to try to reconnect with his bereft wife.	R	92.0	73676	6.8	David Lowery	Casey Affleck, Rooney Mara, McColm Cephas Jr., Kenneisha Thompson	Drama, Fantasy, Romance	death of husband,loss of husband,grief,loss,sitting on the floor and eating	July 28, 2017 (United States)	United States	English, Spanish	Irving, Texas, USA	Sailor Bear, Zero Trans Fat Productions, Ideaman Studios	$100,000	$1,951,683
tt2937898	Năm Bạo Lực Nhất	In New York City 1981, an ambitious immigrant fights to protect his business and family during the most dangerous year in the city's history.	R	125.0	73664	7.0	J.C. Chandor	Oscar Isaac, Jessica Chastain, David Oyelowo, Alessandro Nivola	Action, Crime, Drama, Thriller	new york city,american dream,oil,year 1981,immigrant	January 30, 2015 (United States)	United States, United Arab Emirates	English, Spanish	Packard Plant, Detroit, Michigan, USA	Before The Door Pictures, Washington Square Films, FilmNation Entertainment	$20,000,000	$12,007,070
tt1972779	Điều Tuyệt Vời Nhất Với Anh	A pair of former high school sweethearts reunite after many years when they return to visit their small hometown.	PG-13	118.0	73448	6.6	Michael Hoffman	James Marsden, Michelle Monaghan, Luke Bracey, Liana Liberato	Drama, Romance	heart transplant,based on novel,adolescent,bare chested male,beating	October 17, 2014 (United States)	United States	English	Pearl River, Louisiana, USA	DiNovi Pictures, Relativity Media	$26,000,000	$38,609,668
tt1893256	Chim Ruôi	A damaged ex-special forces soldier navigating London's criminal underworld seizes an opportunity to assume another man's identity.	R	100.0	73446	6.2	Steven Knight	Jason Statham, Agata Buzek, Vicky McClure, Benedict Wong	Action, Crime, Drama, Thriller	ex special forces,tough guy,anti hero,haunted by the past,assumed identity	July 12, 2013 (Vietnam)	United Kingdom, United States	English, Polish, Cantonese, Italian	London, England, UK	Lionsgate, IM Global, Shoebox Films	$20,000,000	$12,671,109
tt1712261	Phi Vu 999	A gang of criminals and corrupt cops plan the murder of a police officer in order to pull off their biggest heist yet across town.	R	115.0	73171	6.3	John Hillcoat	Casey Affleck, Chiwetel Ejiofor, Anthony Mackie, Aaron Paul	Action, Crime, Thriller	heist,corrupt cop,betrayal,police detective,two word title	March 18, 2016 (Vietnam)	United States	English, Spanish, Russian	Decatur, Georgia, USA	Worldview Entertainment, Anonymous Content, MadRiver Pictures	$20,000,000	$23,177,948
tt1137450	Thần Chết	Dr. Paul Kersey is an experienced trauma surgeon, a man who has spent his life saving lives. After an attack on his family, Paul embarks on his own mission for justice.	C18	107.0	73068	6.3	Eli Roth	Bruce Willis, Vincent D'Onofrio, Elisabeth Shue, Camila Morrone	Action, Crime, Drama, Thriller	remake,vigilante,vigilantism,paul kersey character,dark hero	May 4, 2018 (Vietnam)	United States, Canada	English, Spanish	Montréal, Québec, Canada	Cave 76, Metro-Goldwyn-Mayer (MGM)	$30,000,000	$49,562,710
tt0795461	Phim Kinh Dị 5	A couple begin to experience some unusual activity after bringing their lost nieces and nephew home. With the help of home-surveillance cameras, they learn they're being stalked by a nefarious demon.	PG-13	88.0	72925	3.5	Malcolm D. Lee, David Zucker	Simon Rex, Ashley Tisdale, Charlie Sheen, Lindsay Lohan	Comedy, Horror	ape,ballet,psychic,2010s,cameo appearance	April 12, 2013 (United States)	United States	English, Spanish, Latin	Atlanta, Georgia, USA	Dimension Films, DZE, Brad Grey Pictures	$20,000,000	$78,378,744
tt2262227	Cuốn Sách Của Sự Sống	Manolo, a young man who is torn between fulfilling the expectations of his family and following his heart, embarks on an adventure that spans three fantastic worlds where he must face his greatest fears.	PG	95.0	72871	7.2	Jorge R. Gutiérrez	Diego Luna, Zoe Saldana, Channing Tatum, Ron Perlman	Animation, Adventure, Comedy, Family, Fantasy, Musical, Romance	afterlife,mexico,death character,bullfight,serenade	October 17, 2014 (Vietnam)	Mexico, United States	English, Spanish		Reel FX Creative Studios, Twentieth Century Fox, Chatrone	$50,000,000	$99,783,556
