id	name	overview	certificate	runtime	nvote	imdb_rate	director	cast	genre	keyword	release_date	country	language	location	company	budget	gross
tt1731141	Cuộc Đấu Của Ender	Young Ender Wiggin is recruited by the International Military to lead the fight against the Formics, an insectoid alien race who had previously tried to invade Earth and had inflicted heavy losses on humankind.	PG-13	114.0	242810	6.6	Gavin Hood	Harrison Ford, Asa Butterfield, Hailee Steinfeld, Abigail Breslin	Action, Adventure, Sci-Fi	future,alien,training,manipulation,leadership	November 1, 2013 (Vietnam)	United States	English	Duffey Lake, British Columbia, Canada	Summit Entertainment, Madison Wells, Chartoff Productions	$110,000,000	$125,544,024
tt1655442	Nghệ Sĩ	An egomaniacal film star develops a relationship with a young dancer against the backdrop of Hollywood's silent era.	PG-13	100.0	242622	7.9	Michel Hazanavicius	Jean Dujardin, Bérénice Bejo, John Goodman, James Cromwell	Comedy, Drama, Romance	homage,showbiz comedy,1920s,silent film,movie studio	May 11, 2012 (Vietnam)	France, Belgium, United States	English, French	Bradbury Building - 304 S. Broadway, Downtown, Los Angeles, California, USA	Studio 37, La Petite Reine, La Classe Américaine	$15,000,000	$133,471,171
tt2293640	Minions	Minions Stuart, Kevin, and Bob are recruited by Scarlet Overkill, a supervillain who, alongside her inventor husband Herb, hatches a plot to take over the world.	P	91.0	241688	6.4	Kyle Balda, Pierre Coffin	Sandra Bullock, Jon Hamm, Michael Keaton, Pierre Coffin	Animation, Adventure, Comedy, Crime, Family, Sci-Fi	minion,villain,invented language,one word title,snow adventure	July 10, 2015 (Vietnam)	United States	English, Spanish	New York City, New York, USA	Illumination Entertainment, Universal Pictures	$74,000,000	$1,159,444,662
tt7713068	Birds of Prey: Cuộc Lột Xác Huy Hoàng Của Harley Quinn	After splitting with the Joker, Harley Quinn joins superheroines Black Canary, Huntress and Renee Montoya to save a young girl from an evil crime lord.	C18	109.0	241581	6.0	Cathy Yan	Margot Robbie, Rosie Perez, Mary Elizabeth Winstead, Jurnee Smollett	Action, Adventure, Comedy, Crime	harley quinn character,police,hyena,spin off,chase	February 7, 2020 (Vietnam)	United States	English, Chinese	Los Angeles, California, USA	Clubhouse Pictures (II), DC Entertainment, Kroll & Co. Entertainment	$84,500,000	$205,372,791
tt2229499	Don Jon	A New Jersey guy dedicated to his family, friends, and church, develops unrealistic expectations from watching porn and works to find happiness and intimacy with his potential true love.	R	90.0	241298	6.5	Joseph Gordon-Levitt	Joseph Gordon-Levitt, Scarlett Johansson, Julianne Moore, Tony Danza	Comedy, Drama, Romance	watching porn,sex,pornography,husband wife relationship,older woman younger man relationship	September 27, 2013 (United States)	United States	English	Hackensack, New Jersey, USA	Voltage Pictures, hitRECord, HitRecord Films	$3,000,000	$39,439,355
tt1189340	Nhân Danh Công Lý	A lawyer defending a wealthy man begins to believe his client is guilty of more than just one crime.	R	118.0	241017	7.3	Brad Furman	Matthew McConaughey, Marisa Tomei, Ryan Phillippe, William H. Macy	Crime, Drama, Mystery, Thriller	defense lawyer,plot twist,drug rehabilitation,envelope of money,illegal gun purchase	March 18, 2011 (United States)	United States	English	3104 Minnesota Street, Los Angeles, California, USA	Lionsgate, Lakeshore Entertainment, Sidney Kimmel Entertainment	$40,000,000	$86,752,352
tt1798684	Con Đường Võ Sĩ	After a fatal incident sends him on a rampant path of destruction, a champion boxer fights to get custody of his daughter and revive his professional career.	R	124.0	240823	7.3	Antoine Fuqua	Jake Gyllenhaal, Rachel McAdams, Oona Laurence, Forest Whitaker	Action, Crime, Drama, Sport	boxer,boxing ring,death of wife,male nudity,boxing training	July 24, 2015 (United States)	Hong Kong, United States	English	Indiana University of Pennsylvania - IUP Kovalchick Convention and Athletic Complex, Indiana, Pennsylvania, USA	Escape Artists, Hill District Media, Riche Productions	$30,000,000	$91,970,827
tt2908446	Dị Biệt: Những Kẻ Nổi Loạn	Beatrice Prior must confront her inner demons and continue her fight against a powerful alliance which threatens to tear her society apart with the help from others on her side.	PG-13	119.0	240651	6.2	Robert Schwentke	Shailene Woodley, Ansel Elgort, Theo James, Kate Winslet	Action, Adventure, Sci-Fi, Thriller	on the run,action heroine,truth serum,trainhopping,mind control	March 21, 2015 (Vietnam)	United States, Canada	English	Chicago, Illinois, USA	Summit Entertainment, Red Wagon Entertainment, Mandeville Films	$110,000,000	$297,002,527
tt2126355	Khe Nứt San Andreas	In the aftermath of a massive earthquake in California, a rescue-chopper pilot makes a dangerous journey with his ex-wife across the state in order to rescue his daughter.	C13	114.0	240574	6.1	Brad Peyton	Dwayne Johnson, Carla Gugino, Alexandra Daddario, Colton Haynes	Action, Adventure, Thriller	natural disaster,earthquake,san andreas fault,daughter,california	May 29, 2015 (Vietnam)	United States, Australia	English	San Francisco, California, USA	New Line Cinema, Village Roadshow Pictures, RatPac-Dune Entertainment	$110,000,000	$474,009,154
tt1464540	Tôi Là Số Bốn	Aliens and their Guardians are hiding on Earth from intergalactic bounty hunters. They can only be killed in numerical order, and Number Four is next on the list. This is his story.	C16	111.0	239578	6.1	D.J. Caruso	Alex Pettyfer, Timothy Olyphant, Dianna Agron, Teresa Palmer	Action, Adventure, Sci-Fi, Thriller	bully,based on young adult novel,death,high school student,good versus evil	February 18, 2011 (United States)	United States, India	English, French	Franklin Regional High School, Murrysville, Pennsylvania, USA	Dreamworks Pictures, Reliance Big Entertainment, Bay Films	$60,000,000	$149,878,437
tt2935510	Giải Mã Bí Ẩn Ngân Hà	Astronaut Roy McBride undertakes a mission across an unforgiving solar system to uncover the truth about his missing father and his doomed expedition that now, 30 years later, threatens the universe.	C13	123.0	238484	6.5	James Gray	Brad Pitt, Tommy Lee Jones, Ruth Negga, Donald Sutherland	Adventure, Drama, Mystery, Sci-Fi, Thriller	astronaut,outer space,father son relationship,moon,missing father	September 20, 2019 (Vietnam)	United States, China, Brazil	English, Norwegian	Dumont Dunes, California, USA	New Regency Productions, Bona Film Group, CAA Media Finance	$90,000,000	$127,461,872
tt3741834	Lion	A five-year-old Indian boy is adopted by an Australian couple after getting lost hundreds of kilometers from home. 25 years later, he sets out to find his lost family.	PG-13	118.0	238329	8.0	Garth Davis	Dev Patel, Nicole Kidman, Rooney Mara, Sunny Pawar	Biography, Drama	adoption,india,street child,adoptive mother adoptive son relationship,mother son reunion	January 6, 2017 (United States)	Australia, United Kingdom, United States, India	English, Hindi, Bengali	Ganesh Talai, Khandwa, Madhya Pradesh, India	The Weinstein Company, Screen Australia, See-Saw Films	$12,000,000	$140,853,810
tt2704998	Đêm Chơi Nhớ Đời	A group of friends who meet regularly for game nights find themselves entangled in a real-life mystery when the shady brother of one of them is seemingly kidnapped by dangerous gangsters.	C18	100.0	237892	6.9	John Francis Daley, Jonathan Goldstein	Jason Bateman, Rachel McAdams, Kyle Chandler, Sharon Horgan	Action, Adventure, Comedy, Crime, Thriller	board game,game,kidnapping,black comedy,husband wife relationship	March 2, 2018 (Vietnam)	United States	English	Marietta, Georgia, USA	Access Industries, Aggregate Films, Davis Entertainment	$37,000,000	$117,768,230
tt1210819	Kỵ Sĩ Cô Độc	Native American warrior Tonto recounts the untold tales that transformed John Reid, a man of the law, into a legend of justice.	C16	150.0	236576	6.4	Gore Verbinski	Johnny Depp, Armie Hammer, William Fichtner, Tom Wilkinson	Action, Adventure, Western	texas ranger,wild west,old west,american indian,horse	July 12, 2013 (Vietnam)	United States	English, North American Indian	Moab, Utah, USA	Walt Disney Pictures, Jerry Bruckheimer Films, Blind Wink Productions	$215,000,000	$260,502,115
tt3228774	Cruella	A live-action prequel feature film following a young Cruella de Vil.	PG-13	134.0	236390	7.3	Craig Gillespie	Emma Stone, Emma Thompson, Joel Fry, Paul Walter Hauser	Adventure, Comedy, Crime, Drama	female villain,murder,fashion,fashion designer,younger version of character	May 28, 2021 (United Kingdom)	United States, United Kingdom	English, French	Old Royal Naval College, King William Walk, Greenwich, London, Greater London, England, UK	Walt Disney Pictures, Marc Platt Productions, Gunn Films	$100,000,000	$233,503,234
tt4630562	Quá Nhanh Quá Nguy Hiểm 8	When a mysterious woman seduces Dominic Toretto into the world of terrorism and a betrayal of those closest to him, the crew face trials that will test them as never before.	C16	136.0	234500	6.6	F. Gary Gray	Vin Diesel, Jason Statham, Dwayne Johnson, Michelle Rodriguez	Action, Crime, Thriller	submarine,car,fast and furious franchise,betrayal,bulletproof vest	April 14, 2017 (Vietnam)	United States, China, Japan	English, Russian, Spanish	Cleveland, Ohio, USA	Universal Pictures, China Film Co., Ltd., Original Film	$250,000,000	$1,236,005,118
tt5442430	Mầm Sống Hiểm Họa	A team of scientists aboard the International Space Station discover a rapidly evolving life form that caused extinction on Mars and now threatens all life on Earth.	C18	104.0	234122	6.6	Daniel Espinosa	Jake Gyllenhaal, Rebecca Ferguson, Ryan Reynolds, Hiroyuki Sanada	Horror, Sci-Fi, Thriller	extraterrestrial life,space,international space station,astronaut,space station	March 24, 2017 (Vietnam)	United States	English, Japanese, Vietnamese	Halong Bay, Vietnam	Columbia Pictures, Skydance Media, Skydance Media	$58,000,000	$100,541,806
tt1289401	Biệt Đội Săn Ma	Following a ghost invasion of Manhattan, paranormal enthusiasts Erin Gilbert and Abby Yates, nuclear engineer Jillian Holtzmann, and subway worker Patty Tolan band together to stop the otherworldly threat.	C13	117.0	233949	6.8	Paul Feig	Melissa McCarthy, Kristen Wiig, Kate McKinnon, Leslie Jones	Action, Comedy, Fantasy, Sci-Fi	reboot,vomiting,ghost,feminism,woman slaps a woman	July 29, 2016 (Vietnam)	United States, Australia	English	Boston, Massachusetts, USA	Columbia Pictures, LStar Capital, Village Roadshow Pictures	$144,000,000	$229,147,509
tt2582782	Không Lùi Bước	A divorced father and his ex-con older brother resort to a desperate scheme in order to save their family's ranch in West Texas.	C18	102.0	233837	7.6	David Mackenzie	Chris Pine, Ben Foster, Jeff Bridges, Gil Birmingham	Crime, Drama, Thriller, Western	texas,texas ranger,bank robbery,neo western,bank robber	November 11, 2016 (Vietnam)	United States	English	Clovis, New Mexico, USA	CBS Films, Sidney Kimmel Entertainment, Madison Wells	$12,000,000	$37,999,675
tt1424381	Quái Thú Vô Hình 3	A group of elite warriors parachute into an unfamiliar jungle and are hunted by members of a merciless alien race.	R	107.0	233791	6.4	Nimród Antal	Adrien Brody, Laurence Fishburne, Topher Grace, Alice Braga	Action, Adventure, Sci-Fi, Thriller	jungle,jungle adventure,parachute,alien,planet	July 9, 2010 (United States)	United States	English, Spanish, Russian	Hamakua Coast, Hawaii, USA	Twentieth Century Fox, Troublemaker Studios, Davis Entertainment	$40,000,000	$127,233,108
tt1588173	Tình Yêu Zombie	After a highly unusual zombie saves a still-living girl from an attack, the two form a relationship that sets in motion events that might transform the entire lifeless world.	C16	98.0	233694	6.8	Jonathan Levine	Nicholas Hoult, Teresa Palmer, John Malkovich, Lio Tipton	Comedy, Horror, Romance	zombie,undead,memory,talking zombie,pretending to be a zombie	March 8, 2013 (Vietnam)	United States, Canada	English	Montréal, Québec, Canada	Summit Entertainment, Make Movies, Mandeville Films	$35,000,000	$116,980,662
tt1959563	Vệ Sĩ Sát Thủ	One of the world's top bodyguards gets a new client, a world class hitman who must testify at the International Criminal Court. They must put their differences aside and work together to make it to the trial alive and on time.	R	118.0	233580	6.9	Patrick Hughes	Ryan Reynolds, Samuel L. Jackson, Gary Oldman, Elodie Yung	Action, Comedy, Crime, Thriller	bodyguard,chase,hitman,singing in a car,boat	August 18, 2017 (Vietnam)	United States, Hong Kong, Bulgaria, Netherlands, Canada, United Kingdom, France	English, Russian, French, Japanese, Italian, Dutch, Spanish	Nieuwe Achtergracht, Amsterdam, The Netherlands	Summit Entertainment, Millennium Media, Cristal Pictures	$30,000,000	$183,428,689
tt0983193	Những Cuộc Phiêu Lưu Của Tintin	Intrepid reporter Tintin and Captain Haddock set off on a treasure hunt for a sunken ship commanded by Haddock's ancestor.	PG	107.0	233197	7.3	Steven Spielberg	Jamie Bell, Andy Serkis, Daniel Craig, Simon Pegg	Animation, Action, Adventure, Family, Mystery	treasure,dog,ship,captain,model ship	October 26, 2011 (France)	United States, New Zealand, United Kingdom, France, Australia	English	Wellington, New Zealand	Columbia Pictures, Paramount Pictures, Amblin Entertainment	$135,000,000	$373,993,951
tt4846340	Bộ Ba Ưu Việt	The story of a team of female African-American mathematicians who served a vital role in NASA during the early years of the U.S. space program.	PG	127.0	232754	7.8	Theodore Melfi	Taraji P. Henson, Octavia Spencer, Janelle Monáe, Kevin Costner	Biography, Drama, History	1960s,space program,segregation,racism,nasa	January 6, 2017 (United States)	United States	English	East Point, Georgia, USA	Fox 2000 Pictures, Chernin Entertainment, Levantine Films	$25,000,000	$235,956,898
tt1411238	Yêu Không Ràng Buộc	A guy and girl try to keep their relationship strictly physical, but it's not long before they learn that they want something more.	R	108.0	232747	6.2	Ivan Reitman	Natalie Portman, Ashton Kutcher, Kevin Kline, Cary Elwes	Comedy, Romance	older man younger woman relationship,female doctor,male rear nudity,sex comedy,doctor	February 11, 2011 (Vietnam)	United States, United Kingdom	English, Ukrainian	Four Seasons Resort The Biltmore Santa Barbara - 1260 Channel Drive, Santa Barbara, California, USA	Paramount Pictures, Cold Spring Pictures, Spyglass Entertainment	$25,000,000	$149,228,077
tt8332922	Vùng Đất Câm Lặng Phần II	Following the events at home, the Abbott family now face the terrors of the outside world. Forced to venture into the unknown, they realize the creatures that hunt by sound are not the only threats lurking beyond the sand path.	C16	97.0	232338	7.2	John Krasinski	Emily Blunt, Millicent Simmonds, Cillian Murphy, John Krasinski	Drama, Horror, Sci-Fi, Thriller	sequel,post apocalypse,oxygen tank,alien,survival	May 28, 2021 (United States)	United States	English, American Sign Language	Buffalo, New York, USA	Buffalo FilmWorks, Paramount Pictures, Platinum Dunes	$55,000,000	$297,372,261
tt2209764	Trí Tuệ Siêu Việt	A scientist's drive for artificial intelligence takes on dangerous implications when his own consciousness is uploaded into one such program.	PG-13	119.0	231065	6.2	Wally Pfister	Johnny Depp, Rebecca Hall, Morgan Freeman, Cillian Murphy	Action, Drama, Sci-Fi, Thriller	scientist,artificial intelligence,technology,power outage,mind upload	April 25, 2014 (Vietnam)	United Kingdom, China, United States	English	Belen, New Mexico, USA	Alcon Entertainment, DMG Entertainment, Straight Up Films	$100,000,000	$103,039,258
tt1436562	Chú Vẹt Rio	When Blu, a domesticated macaw from small-town Minnesota, meets the fiercely independent Jewel, he takes off on an adventure to Rio de Janeiro with the bird of his dreams.		96.0	230854	6.9	Carlos Saldanha	Jesse Eisenberg, Anne Hathaway, George Lopez, Karen Disher	Animation, Adventure, Comedy, Family, Music, Musical	brazil,snow adventure,bird,macaw,ornithologist	April 8, 2011 (Vietnam)	United States	English, Portuguese, Arabic, Spanish, Brazilian Sign Language	Rio de Janeiro, Rio de Janeiro, Brazil	Twentieth Century Fox Animation, Blue Sky Studios	$90,000,000	$483,866,772
tt1051906	Kẻ Vô Hình	When Cecilia's abusive ex takes his own life and leaves her his fortune, she suspects his death was a hoax. As a series of coincidences turn lethal, Cecilia works to prove that she is being hunted by someone nobody can see.	C18	124.0	230717	7.1	Leigh Whannell	Elisabeth Moss, Oliver Jackson-Cohen, Harriet Dyer, Aldis Hodge	Drama, Horror, Mystery, Sci-Fi, Thriller	domestic abuse,psychological abuse,invisibility,invisibility suit,murder	February 28, 2020 (Vietnam)	Australia, United States	English	Headland House, Gerringong, New South Wales, Australia	Universal Pictures, Blumhouse Productions, Goalpost Pictures	$7,000,000	$144,492,724
tt1234721	Cảnh Sát Người Máy	In 2028 Detroit, when Alex Murphy, a loving husband, father and good cop, is critically injured in the line of duty, the multinational conglomerate OmniCorp sees their chance for a part-man, part-robot police officer.	C16	117.0	230622	6.2	José Padilha	Joel Kinnaman, Gary Oldman, Michael Keaton, Abbie Cornish	Action, Crime, Sci-Fi, Thriller	robot sci fi,technology,robot,robocop,police	February 14, 2014 (Vietnam)	United States	English, Persian, Ukrainian	Scarborough, Ontario, Canada	Metro-Goldwyn-Mayer (MGM), Columbia Pictures, Strike Entertainment	$100,000,000	$242,688,965
tt4196776	Siêu Điệp Viên Jason Bourne	The CIA's most dangerous former operative is drawn out of hiding to uncover more explosive truths about his past.	C16	123.0	229726	6.6	Paul Greengrass	Matt Damon, Tommy Lee Jones, Alicia Vikander, Vincent Cassel	Action, Thriller	assassin,swat,computer cracker,riot,riot police	July 29, 2016 (Vietnam)	United States, China, Spain, Japan, Germany	English, Greek, German, Japanese	Santa Cruz, Tenerife, Canary Islands, Spain	Universal Pictures, Perfect World Pictures, The Kennedy/Marshall Company	$120,000,000	$415,484,914
tt8228288	Hố Sâu Đói Khát	A vertical prison with one cell per level. Two people per cell. Only one food platform and two minutes per day to feed. An endless nightmare trapped in The Hole.	C18	94.0	229506	7.0	Galder Gaztelu-Urrutia	Ivan Massagué, Zorion Eguileor, Antonia San Juan, Emilio Buale	Horror, Sci-Fi, Thriller	hunger,prison,cannibalism,platform,inmate	November 8, 2019 (Spain)	Spain	Spanish, Italian		Basque Films, Mr Miyagi Films, Plataforma La Película AIE		$1,090,116
tt5109784	Mother!	A couple's relationship is tested when uninvited guests arrive at their home, disrupting their tranquil existence.	R	121.0	229178	6.6	Darren Aronofsky	Jennifer Lawrence, Javier Bardem, Ed Harris, Michelle Pfeiffer	Drama, Horror, Mystery	surrealism,uninvited guest,riot,pregnant woman,cannibalism	September 15, 2017 (United States)	United States	English	Montréal, Québec, Canada	Paramount Pictures, Protozoa Pictures	$30,000,000	$44,516,999
tt2321549	Sách Ma	"A single mother and her child fall into a deep well of paranoia when an eerie children's book titled ""Mister Babadook"" manifests in their home."	C16	94.0	227931	6.8	Jennifer Kent	Essie Davis, Noah Wiseman, Daniel Henshall, Hayley McElhinney	Horror, Mystery	book,single mother,mother son relationship,monster,fear	June 6, 2014 (Vietnam)	Australia, Canada	English	Adelaide, South Australia, Australia	Screen Australia, Causeway Films, The South Australian Film Corporation	$2,000,000	$10,484,459
tt7097896	Venom: Đối Mặt Tử Thù	Eddie Brock attempts to reignite his career by interviewing serial killer Cletus Kasady, who becomes the host of the symbiote Carnage and escapes prison after a failed execution.	C13	97.0	226644	5.9	Andy Serkis	Tom Hardy, Woody Harrelson, Michelle Williams, Naomie Harris	Action, Adventure, Sci-Fi, Thriller	based on comic,superhero,marvel comics,sequel,second part	October 1, 2021 (United States)	United States, China	English	Leavesden Studios, Leavesden, Hertfordshire, England, UK	Marvel Entertainment, Pascal Pictures, Sony Pictures Entertainment (SPE)	$110,000,000	$506,863,592
tt2184339	Ngày Thanh Trừng	A wealthy family is held hostage for harboring the target of a murderous syndicate during the Purge, a 12-hour period in which any and all crime is legal.	R	85.0	226598	5.7	James DeMonaco	Ethan Hawke, Lena Headey, Max Burkholder, Adelaide Kane	Horror, Sci-Fi, Thriller	killing spree,class differences,survival,suburb,security system	June 7, 2013 (United States)	United States, France	English	Chatsworth, Los Angeles, California, USA	Universal Pictures, Platinum Dunes, Blumhouse Productions	$3,000,000	$89,328,627
tt1649419	Thảm Họa Sóng Thần	The story of a tourist family in Thailand caught in the destruction and chaotic aftermath of the 2004 Indian Ocean tsunami.	PG-13	114.0	226326	7.5	J.A. Bayona	Naomi Watts, Ewan McGregor, Tom Holland, Oaklee Pendergast	Adventure, Drama, History, Thriller	disaster film,disaster,tidal wave,2004 indian ocean earthquake and tsunami,year 2004	January 4, 2013 (Vietnam)	Spain, Thailand, United States	English, Thai, German, Swedish, Spanish	Khao Lak Orchid Beach Resort, Phang Nga, Thailand	Mediaset España, Summit Entertainment, Apaches Entertainment	$45,000,000	$198,087,212
tt1599348	Chốn an toàn	A young CIA agent is tasked with looking after a fugitive in a safe house. But when the safe house is attacked, he finds himself on the run with his charge.	R	115.0	225219	6.7	Daniel Espinosa	Denzel Washington, Ryan Reynolds, Robert Patrick, Vera Farmiga	Action, Thriller	on the run,cia agent,cape town south africa,south africa,two in a shower	February 10, 2012 (United States)	South Africa, United States, Japan	English, Afrikaans	Cape Town, Western Cape, South Africa	Universal Pictures, Relativity Media, Bluegrass Films	$85,000,000	$208,076,205
tt5700672	Chuyến Tàu Sinh Tử	While a zombie virus breaks out in South Korea, passengers struggle to survive on the train from Seoul to Busan.	C18	118.0	224460	7.6	Sang-ho Yeon	Gong Yoo, Jung Yu-mi, Ma Dong-seok, Su-an Kim	Action, Horror, Thriller	train,zombie,father daughter relationship,survival,zombie apocalypse	August 12, 2016 (Vietnam)	South Korea	Korean, Hawaiian, English	Daejeon Station, Daejeon, South Korea	Next Entertainment World (NEW), RedPeter Film, Movic Comics	₩10,000,000,000	$92,764,199
tt2334879	Giải Cứu Nhà Trắng	While on a tour of the White House with his young daughter, a Capitol policeman springs into action to save his child and protect the president from a heavily armed group of paramilitary invaders.	PG-13	131.0	224422	6.3	Roland Emmerich	Channing Tatum, Jamie Foxx, Maggie Gyllenhaal, Jason Clarke	Action, Drama, Thriller	automatic weapon,attempted coup d&apos;etat,stabbed with a pen,beaten to death,stabbed to death	July 10, 2013 (Vietnam)	United States	English	Cité du Cinéma, Montréal, Québec, Canada	Columbia Pictures, Mythology Entertainment, Centropolis Entertainment	$150,000,000	$205,366,737
tt1124035	Chiến Dịch Tranh Cử Tổng Thống	An idealistic staffer for a new presidential candidate gets a crash course on dirty politics during his stint on the campaign trail.	R	101.0	224258	7.1	George Clooney	Paul Giamatti, George Clooney, Philip Seymour Hoffman, Ryan Gosling	Drama, Thriller	politics,presidential campaign,intrigue,presidential election,campaigning	October 7, 2011 (United States)	United States	English	Cincinnati, Ohio, USA	Columbia Pictures, Cross Creek Pictures, Exclusive Media Group	$12,500,000	$76,338,111
tt2953050	Encanto: Vùng Đất Thần Kỳ	A Colombian teenage girl has to face the frustration of being the only member of her family without magical powers.	P	102.0	223893	7.2	Jared Bush, Byron Howard, Charise Castro Smith	Stephanie Beatriz, María Cecilia Botero, John Leguizamo, Mauro Castillo	Animation, Comedy, Family, Fantasy, Musical	colombia,magic,magical house,candle,disney	November 24, 2021 (United States)	United States	English, Spanish		Walt Disney Animation Studios, Walt Disney Pictures	$50,000,000	$256,786,742
tt2005151	Cộng Sự Hổ Báo	Loosely based on the true story of two young men, David Packouz and Efraim Diveroli, who won a three hundred million dollar contract from the Pentagon to arm America's allies in Afghanistan.	R	114.0	223405	7.1	Todd Phillips	Jonah Hill, Miles Teller, Steve Lantz, Gregg Weiner	Biography, Comedy, Crime, Drama, War	ugly american,lie,drug,2000s,deal	August 19, 2016 (Romania)	United States, Romania	English, Arabic, Albanian, Romanian	Romania	BZ Entertainment, Green Hat Films, Icon Films	$40,000,000	$86,234,523
tt0409847	Cao Bồi & Người Ngoài Hành Tinh	A spaceship arrives in Arizona, 1873, to take over the Earth, starting with the Wild West region. A posse of cowboys and natives are all that stand in their way.	PG-13	119.0	223251	6.0	Jon Favreau	Daniel Craig, Harrison Ford, Olivia Wilde, Abigail Spencer	Action, Sci-Fi, Thriller, Western	extraterrestrial alien,cowboy,human versus alien,one man army,weapons fire	August 12, 2011 (Vietnam)	United States, India	English, Apache languages	Santa Fe, New Mexico, USA	Universal Pictures, Dreamworks Pictures, Reliance Entertainment	$163,000,000	$174,822,325
tt5164214	Băng Cướp Thế Kỷ: Đẳng Cấp Quý Cô	Debbie Ocean gathers an all-female crew to attempt an impossible heist at New York City's yearly Met Gala.	C16	110.0	222102	6.3	Gary Ross	Sandra Bullock, Cate Blanchett, Anne Hathaway, Mindy Kaling	Action, Comedy, Crime	diamond necklace,diamond heist,museum,heist,female protagonist	June 22, 2018 (Vietnam)	United States	English, Hindi, French, German, Mandarin	Arthur Kill Correctional Facility - 2911 Arthur Kill Road, Staten Island, New York City, New York, USA	Warner Bros., Village Roadshow Pictures, Rahway Road Productions	$70,000,000	$297,795,726
