id	name	overview	certificate	runtime	nvote	imdb_rate	director	cast	genre	keyword	release_date	country	language	location	company	budget	gross
tt5363618	Sound of Metal	A heavy-metal drummer's life is thrown into freefall when he begins to lose his hearing.	R	120.0	130083	7.7	Darius Marder	Riz Ahmed, Olivia Cooke, Paul Raci, Lauren Ridloff	Drama, Music	drug addict,deaf community,musician,anger,hearing loss	December 4, 2020 (United States)	United States	English, American Sign Language, French, Persian	Antwerp, Belgium	Caviar, Flat 7 Productions, Ward Four	$5,400,000	$516,520
tt3488710	Bước Đi Thể Kỷ	In 1974, high-wire artist Philippe Petit recruits a team of people to help him realize his dream: to walk the immense void between the World Trade Center towers.	PG	123.0	129896	7.3	Robert Zemeckis	Joseph Gordon-Levitt, Charlotte Le Bon, Guillaume Baillargeon, Émilie Leclerc	Adventure, Biography, Drama, History	tightrope walker,1970s,world trade center manhattan new york city,skyscraper,based on true story	October 23, 2015 (Vietnam)	United States	English, French, Czech	Montréal, Québec, Canada	Sony Pictures Entertainment (SPE), TriStar Productions, ImageMovers	$35,000,000	$61,181,942
tt1616195	Quyền Lực Tuyệt Đối	J. Edgar Hoover, powerful head of the F.B.I. for nearly fifty years, looks back on his professional and personal life.	R	137.0	129716	6.5	Clint Eastwood	Leonardo DiCaprio, Armie Hammer, Naomi Watts, Josh Hamilton	Biography, Drama, Romance	abuse of power,closeted homosexual,gay relationship,j. edgar hoover character,united states of america	November 11, 2011 (United States)	United States	English	Warrenton, Virginia, USA	Imagine Entertainment, Malpaso Productions, Wintergreen Productions	$35,000,000	$84,920,539
tt2222042	Tình Yêu Và Quái Vật	Seven years after he survived the monster apocalypse, lovably hapless Joel leaves his cozy underground bunker behind on a quest to reunite with his ex.	PG-13	109.0	129625	6.9	Michael Matthews	Dylan O'Brien, Jessica Henwick, Michael Rooker, Dan Ewing	Action, Adventure, Comedy, Fantasy, Sci-Fi	monster,survival,dog,love,boyfriend girlfriend relationship	October 16, 2020 (Canada)	Canada, United States, Australia	English	Mount Cotton, Queensland, Australia	Paramount Pictures, Entertainment One, 21 Laps Entertainment		$1,122,066
tt3874544	Nhóc Trùm	A suit-wearing, briefcase-carrying baby pairs up with his 7-year old brother to stop the dastardly plot of the CEO of Puppy Co.	PG	97.0	129331	6.3	Tom McGrath	Alec Baldwin, Steve Buscemi, Jimmy Kimmel, Lisa Kudrow	Animation, Adventure, Comedy, Family, Fantasy	baby,brother brother relationship,talking baby,close up of eye,puppy	March 31, 2017 (Vietnam)	United States	English, Spanish	Glendale, California, USA	DreamWorks Animation	$125,000,000	$527,965,936
tt1038919	Thợ Săn Tiền Thưởng	A bounty hunter learns that his next target is his ex-wife, a reporter working on a murder cover-up. Soon after their reunion, the always-at-odds duo find themselves on a run-for-their-lives adventure.	PG-13	110.0	129243	5.5	Andy Tennant	Jennifer Aniston, Gerard Butler, Gio Perez, Joel Marsh Garland	Action, Comedy, Romance	bounty hunter,downward spiral,man wrapped in a towel,columbia tristar,u.s. car	March 26, 2010 (Vietnam)	United States	English, Ukrainian	Far Rockaway, Queens, New York City, New York, USA	Columbia Pictures, Relativity Media, Original Film	$40,000,000	$136,333,522
tt1298649	Đội Dân Phòng Tinh Nhuệ	Four men who form a neighborhood watch group as a way to get out of their day-to-day family routines find themselves defending the Earth from an alien invasion.	R	102.0	129090	5.7	Akiva Schaffer	Ben Stiller, Vince Vaughn, Jonah Hill, Billy Crudup	Comedy, Sci-Fi	female full frontal nudity,alien,neighbor,alien invasion,disguise	September 21, 2012 (Vietnam)	United States	English	Marietta, Georgia	Twentieth Century Fox, Dune Entertainment, 21 Laps Entertainment	$68,000,000	$68,267,862
tt1878870	Nổi Loạn Tuổi 17	High-school life gets even more unbearable for Nadine when her best friend, Krista, starts dating her older brother.	R	104.0	128845	7.3	Kelly Fremon Craig	Hailee Steinfeld, Haley Lu Richardson, Blake Jenner, Kyra Sedgwick	Comedy, Drama	adolescence,coming of age film,high school,depressed teen,suicide talk	November 18, 2016 (United States)	United States, China	English	Guildford Park Secondary School, Surrey, British Columbia, Canada	Gracie Films, Huayi Brothers Media, Robert Simonds Productions	$9,000,000	$19,370,020
tt1571234	Cỗ Máy Tử Thần	In a post-apocalyptic world where cities ride on wheels and consume each other to survive, two people meet in London and try to stop a conspiracy.	C16	128.0	128247	6.1	Christian Rivers	Hera Hilmar, Robert Sheehan, Hugo Weaving, Jihae	Action, Adventure, Fantasy, Sci-Fi, Thriller	post apocalypse,steampunk,dystopia,capitalism,social commentary	December 7, 2018 (Vietnam)	United States, New Zealand, Japan, China	English	New Zealand	Media Rights Capital (MRC), Scholastic Productions, Silvertongue Films	$100,000,000	$83,869,818
tt1692486	Khẩu Chiến	Two pairs of parents hold a cordial meeting after their sons are involved in a fight, though as their time together progresses, increasingly childish behavior throws the discussion into chaos.	R	80.0	128184	7.1	Roman Polanski	Jodie Foster, Kate Winslet, Christoph Waltz, John C. Reilly	Comedy, Drama	marriage,single set production,husband wife relationship,based on play,telephone	November 18, 2011 (Spain)	France, Germany, Poland, Spain, United States	English	Brooklyn, New York City, New York, USA	SBS Productions, Constantin Film, SPI Film Studio	$25,000,000	$30,722,632
tt9495224	Gương Đen: Bandersnatch	A young programmer starts to question reality when he adapts a mad writer's fantasy novel into a video game.	C18	90.0	128145	7.1	David Slade	Fionn Whitehead, Craig Parkinson, Alice Lowe, Asim Chaudhry	Drama, Fantasy, Mystery, Sci-Fi, Thriller	interactive movie,computer,gamebook,interactive,multiple endings	December 28, 2018 (United Kingdom)	United Kingdom, United States	English	St. George's Walk, Croydon, London, England, UK	House Of Tomorrow, Netflix		
tt6343314	Tay Đấm Huyền Thoại 2	Under the tutelage of Rocky Balboa, newly crowned heavyweight champion Adonis Creed faces off against Viktor Drago, the son of Ivan Drago.	PG-13	130.0	127808	7.1	Steven Caple Jr.	Michael B. Jordan, Sylvester Stallone, Tessa Thompson, Phylicia Rashad	Drama, Sport	baby,training montage,sequel,boxing match,boxer	November 21, 2018 (United States)	United States	English, Russian, Sign Languages	Deming, New Mexico, USA	Metro-Goldwyn-Mayer (MGM), Warner Bros., New Line Cinema	$50,000,000	$214,215,889
tt4651520	Những Bà Mẹ 'Ngoan'	When three overworked and under-appreciated moms are pushed beyond their limits, they ditch their conventional responsibilities for a jolt of long overdue freedom, fun and comedic self-indulgence.	R	100.0	127629	6.2	Jon Lucas, Scott Moore	Mila Kunis, Kathryn Hahn, Kristen Bell, Christina Applegate	Comedy	female full frontal nudity,pubic hair,female nudity,nudity,crying woman	August 12, 2016 (Vietnam)	United States, China	English	Chicago, Illinois, USA	STX Entertainment, Huayi Brothers Media, BillBlock Media	$20,000,000	$183,936,074
tt9421570	Tổng Đài Truy Vết	A demoted police officer assigned to a call dispatch desk is conflicted when he receives an emergency phone call from a kidnapped woman.	C16	90.0	127550	6.3	Antoine Fuqua	Jake Gyllenhaal, Riley Keough, Peter Sarsgaard, Christina Vidal	Crime, Drama, Thriller	remake,kidnapping,police officer,police,woman in jeopardy	October 1, 2021 (United States)	United States	English, Spanish	MBS Media Campus - 1600 Rosecrans Avenue, Manhattan Beach, California, USA	Amet Entertainment, Bold Films, Endeavor Content		
tt4062536	Green Room	A punk rock band is forced to fight for survival after witnessing a murder at a neo-Nazi skinhead bar.	R	95.0	127303	7.0	Jeremy Saulnier	Anton Yelchin, Imogen Poots, Alia Shawkat, Patrick Stewart	Crime, Drama, Horror, Music, Thriller	neo nazi,murder,punk band,band,white supremacist	May 13, 2016 (United States)	United States	English	Portland, Oregon, USA	Broad Green Pictures, Film Science	$5,000,000	$3,767,402
tt0480687	Vé Độc Thân	Rick and Fred, two husbands who are having difficulty in their marriages, are given a Hall Pass by their wives: for one week, they can do whatever they want.	R	105.0	127030	5.9	Bobby Farrelly, Peter Farrelly	Owen Wilson, Jason Sudeikis, Christina Applegate, Jenna Fischer	Comedy, Romance	nudity,marriage,cheating wife,adultery,breasts	February 25, 2011 (United States)	United States	English	Falmouth, Massachusetts, USA	New Line Cinema, Conundrum Entertainment	$36,000,000	$86,157,237
tt2884206	I Origins	A molecular biologist and his laboratory partner uncover evidence that may fundamentally change society as we know it.	R	106.0	126943	7.3	Mike Cahill	Michael Pitt, Steven Yeun, Astrid Bergès-Frisbey, Brit Marling	Drama, Mystery, Romance, Sci-Fi	eye,evolution,reincarnation,worm,elevator	July 18, 2014 (Poland)	United States	English, Hindi	Delhi, India	Verisimilitude, WeWork Studios, Bersin Pictures	$1,000,000	$481,234
tt4846232	Good Time	After a botched bank robbery lands his younger brother in prison, Connie Nikas embarks on a twisted odyssey through New York City's underworld to get his brother Nick out of jail.	R	102.0	126768	7.3	Benny Safdie, Josh Safdie	Robert Pattinson, Benny Safdie, Jennifer Jason Leigh, Buddy Duress	Crime, Drama, Thriller	robbery gone awry,brother brother relationship,neo noir,on the run,wheelchair	August 25, 2017 (United States)	United States	English	Adventureland Amusement Park, Farmingdale, Long Island, New York, USA	Elara Pictures, Rhea Films (II)	$4,500,000	$3,283,369
tt1862079	Safety Not Guaranteed	Three magazine employees head out on an assignment to interview a guy who placed a classified advertisement seeking a companion for time travel.	R	86.0	126764	6.9	Colin Trevorrow	Aubrey Plaza, Mark Duplass, Jake Johnson, Karan Soni	Adventure, Comedy, Drama, Fantasy, Romance	time machine,intern,classified ad,time travel,falling in love	June 15, 2012 (Canada)	United States	English	Ocean Shores, Washington, USA	FilmDistrict, Big Beach Films, Duplass Brothers Productions	$750,000	$4,424,699
tt2631186	Bãhubali: The Beginning	In ancient India, an adventurous and daring man becomes involved in a decades-old feud between two warring peoples.		159.0	126647	8.0	S.S. Rajamouli	Prabhas, Rana Daggubati, Anushka Shetty, Tamannaah Bhatia	Action, Drama	india,medieval times,chariot,kingdom,warrior	July 10, 2015 (India)	India	Telugu, Tamil	Bulgaria	Arka Mediaworks	$18,026,148	$24,548,038
tt2763304	Lối Sống Đồi Trụy 2	After 20 years abroad, Mark Renton returns to Scotland and reunites with his old friends Sick Boy, Spud, and Begbie.	R	117.0	125774	7.2	Danny Boyle	Ewan McGregor, Ewen Bremner, Jonny Lee Miller, Robert Carlyle	Comedy, Drama	old friends reunited,sequel,drugs,female nudity,escape from prison	January 27, 2017 (United Kingdom)	United Kingdom	English, Bulgarian, Scots	Sofia, Bulgaria	Artbees, DNA Films, Decibel Films	$18,000,000	$41,681,746
tt1860213	Tay Chơi Không Tuổi	Right before his wedding, an uptight guy is tricked into driving his grandfather, a lecherous former Army Lieutenant Colonel, to Florida for Spring Break.	R	102.0	125706	5.9	Dan Mazer	Robert De Niro, Zac Efron, Zoey Deutch, Aubrey Plaza	Comedy	grandfather grandson relationship,gold digger,cowgirl sex position,nymphomaniac,nudity	February 5, 2016 (Vietnam)	United States, United Kingdom	English	Tybee Island, Georgia, USA	Lionsgate, BillBlock Media, QED International	$25,000,000	$94,073,028
tt1937390	Người Đàn Bà Cuồng Dâm: Phần 1	A self-diagnosed nymphomaniac recounts her erotic experiences to the man who saved her after a beating.		117.0	125678	6.9	Lars von Trier	Charlotte Gainsbourg, Stellan Skarsgård, Stacy Martin, Shia LaBeouf	Drama	anal sex,casual sex,pubic hair,loss of virginity,fellatio	December 25, 2013 (Denmark)	Denmark, Germany, Belgium, United Kingdom, France, Sweden, United States	English	Klinikum Leverkusen, Paracelsusstrasse, Leverkusen, North Rhine-Westphalia, Germany	Zentropa Entertainments, Zentropa International Köln, Heimatfilm	$4,700,000	$13,551,156
tt8404614	Hai Vị Giáo Hoàng	Behind Vatican walls, the conservative Pope Benedict XVI and the liberal future Pope Francis must find common ground to forge a new path for the Catholic Church.	C16	125.0	125406	7.6	Fernando Meirelles	Jonathan Pryce, Anthony Hopkins, Juan Minujín, Luis Gnecco	Biography, Comedy, Drama	pope,catholic priest,flashback,confessional,younger version of character	December 20, 2019 (Vietnam)	United Kingdom, Italy, United States	English, Spanish, Italian, Latin, Portuguese, French, German	Rome, Lazio, Italy	Netflix, Rideback		$243,711
tt1536537	Chuyện Gì Xảy Ra Với Thứ Hai	In a world where families are limited to one child due to overpopulation, a set of identical septuplets must avoid being put to a long sleep by the government and dangerous infighting while investigating the disappearance of one of their own.	C18	123.0	125103	6.8	Tommy Wirkola	Noomi Rapace, Glenn Close, Willem Dafoe, Marwan Kenzari	Action, Crime, Fantasy, Mystery, Sci-Fi, Thriller	one child policy,overpopulation,actress playing multiple roles,septuplets,totalitarianism	August 31, 2017 (Vietnam)	United Kingdom, France, United States, Belgium	English	Constanta, Romania	Vendome Pictures, Nexus Factory, Raffaella Productions		$27,975,429
tt2692250	Đêm Ở Viện Bảo Tàng 3: Bí Mật Hầm Mộ	Larry spans the globe, uniting favorite and new characters while embarking on an epic quest to save the magic before it's gone forever.	PG	98.0	125042	6.2	Shawn Levy	Ben Stiller, Robin Williams, Owen Wilson, Dick Van Dyke	Adventure, Comedy, Family, Fantasy	night watchman,museum of natural history manhattan new york city,star died before release,museum,tablet	December 19, 2014 (Vietnam)	United Kingdom, United States	English	London, England, UK	Twentieth Century Fox, 21 Laps Entertainment, 1492 Pictures	$127,000,000	$363,204,635
tt5886046	Căn Phòng Tử Thần	Six strangers find themselves in a maze of deadly mystery rooms and must use their wits to survive.	C16	99.0	124938	6.4	Adam Robitel	Taylor Russell, Logan Miller, Jay Ellis, Tyler Labine	Action, Adventure, Horror, Mystery, Sci-Fi, Thriller	escape room,puzzle,teamwork,clue,code	January 4, 2019 (Vietnam)	United States, South Africa	English	Chicago, Illinois, USA	Columbia Pictures, Original Film, Department of Trade and Industry of South Africa	$9,000,000	$155,712,077
tt2265171	Đột kích 2: Kẻ sát nhân	Only a short time after the first raid, Rama goes undercover with the thugs of Jakarta and plans to bring down the syndicate and uncover the corruption within his police force.	R	150.0	124664	7.9	Gareth Evans	Iko Uwais, Yayan Ruhian, Arifin Putra, Oka Antara	Action, Crime, Thriller	violence,prison,jakarta indonesia,kitchen fight,corrupt police officer	June 7, 2014 (Vietnam)	Indonesia, United States	Indonesian, Japanese, English, Sign Languages	Gombong, Central Java, Indonesia	Sony Pictures Classics, Stage 6 Films, Pt. Merantau Films	$4,500,000	$6,566,916
tt4438848	Neighbors 2: Sorority Rising	When their new next-door neighbors turn out to be a sorority even more debaucherous than the fraternity that lived there before, Mac and Kelly team with their former enemy, Teddy, to bring the girls down.	R	92.0	124635	5.7	Nicholas Stoller	Seth Rogen, Rose Byrne, Zac Efron, Chloë Grace Moretz	Comedy	gay marriage proposal,party,next door neighbor,sorority,drug dealer	May 20, 2016 (United States)	United States, China	English	Atlanta, Georgia, USA	Universal Pictures, Perfect World Pictures, Point Grey Pictures	$35,000,000	$108,007,109
tt8847712	Tờ Báo Công Văn Pháp	"A love letter to journalists set in an outpost of an American newspaper in a fictional twentieth century French city that brings to life a collection of stories published in ""The French Dispatch Magazine""."	R	107.0	124439	7.1	Wes Anderson	Benicio Del Toro, Adrien Brody, Tilda Swinton, Léa Seydoux	Comedy, Drama, Romance	journalist,woman poses nude for a painting,painter,bicycle,magazine	October 21, 2021 (Germany)	Germany, United States	English, French	Angoulême, Charente, France	American Empirical Pictures, Indian Paintbrush, Studio Babelsberg	$25,000,000	$46,333,545
tt3410834	Dị Biệt: Những Kẻ Trung Kiên	After the earth-shattering revelations of Insurgent, Tris must escape with Four beyond the wall that encircles Chicago, to finally discover the shocking truth of the world around them.	PG-13	120.0	124400	5.7	Robert Schwentke	Shailene Woodley, Theo James, Jeff Daniels, Naomi Watts	Action, Adventure, Mystery, Sci-Fi, Thriller	based on young adult novel,dystopia,female rear nudity,tough girl,surveillance	March 18, 2016 (Vietnam)	United States	English	Atlanta, Georgia, USA	Mandeville Films, Red Wagon Entertainment, Summit Entertainment	$110,000,000	$179,246,868
tt1355630	Nếu Em Ở Lại	Life changes in an instant for young Mia Hall after a car accident puts her in a coma. During an out-of-body experience, she must decide whether to wake up and live a life far different than she had imagined. The choice is hers if she can go on.	PG-13	107.0	124376	6.7	R.J. Cutler	Chloë Grace Moretz, Mireille Enos, Jamie Blackley, Joshua Leonard	Drama, Fantasy, Music, Romance, Sci-Fi	out of body experience,coma,boyfriend girlfriend relationship,car accident,reference to the exploited	August 22, 2014 (United States)	United States	English	Vancouver, British Columbia, Canada	DiNovi Pictures, Metro-Goldwyn-Mayer (MGM), New Line Cinema	$11,000,000	$78,274,843
tt5758778	Tòa Tháp Chọc Trời	A security expert must infiltrate a burning skyscraper, 225 stories above ground, when his family is trapped inside by criminals.	C16	102.0	124292	5.8	Rawson Marshall Thurber	Dwayne Johnson, Neve Campbell, Chin Han, Roland Møller	Action, Adventure, Thriller	skyscraper,fire,terrorism,prosthetic leg,evil man	July 13, 2018 (Vietnam)	United States	English, Cantonese, Mandarin	Coquitlam, British Columbia, Canada	Legendary Entertainment, Flynn Picture Company, Seven Bucks Productions	$125,000,000	$304,868,961
tt1904996	Parker	A thief with a unique code of professional ethics is double-crossed by his crew and left for dead. Assuming a new disguise and forming an unlikely alliance with a woman on the inside, he looks to hijack the score of the crew's latest heist.	R	118.0	124160	6.2	Taylor Hackford	Jason Statham, Jennifer Lopez, Michael Chiklis, Nick Nolte	Action, Crime, Thriller	action hero,thief,heist,based on novel,female topless nudity	February 8, 2013 (Vietnam)	United States	English	West Palm Beach, Florida, USA	Incentive Filmed Entertainment, Sierra / Affinity, Alexander/ Mitchell Productions	$35,000,000	$46,922,566
tt1911644	The Call	When a veteran 911 operator takes a life-altering call from a teenage girl who has just been abducted, she realizes that she must confront a killer from her past in order to save the girl's life.	R	96.0	124132	6.7	Brad Anderson	Halle Berry, Evie Thompson, Abigail Breslin, Morris Chestnut	Drama, Thriller	911 call,pixelated nudity,child abduction,trapdoor,woods	May 10, 2013 (Vietnam)	United States	English	Burbank Town Center - 201 E Magnolia, Burbank, California, USA	TriStar Pictures, Stage 6 Films, Troika Pictures	$13,000,000	$68,572,631
tt1524137	Phi Vụ Ngầm	To protect his brother-in-law from a drug lord, a former smuggler heads to Panama to score millions of dollars in counterfeit bills.	R	109.0	123760	6.4	Baltasar Kormákur	Mark Wahlberg, Giovanni Ribisi, Kate Beckinsale, Robert Wahlberg	Action, Crime, Drama, Thriller	smuggling,prison,cocaine,action violence,violence	January 13, 2012 (United States)	United States, United Kingdom, France	English, Spanish	New Orleans, Louisiana, USA	Universal Pictures, Relativity Media, Working Title Films	$25,000,000	$96,262,212
tt4034354	Xác Chết Biết Nói	A hopeless man stranded on a deserted island befriends a dead body, and together they go on a surreal journey to get home.	R	97.0	123745	6.9	Dan Kwan, Daniel Scheinert	Paul Dano, Daniel Radcliffe, Mary Elizabeth Winstead, Antonia Ribero	Comedy, Drama, Fantasy, Romance	dead body,talking to a dead body,dead body washed ashore,island,corpse	July 1, 2016 (United States)	United States	English	Humboldt, California, USA	Astrakan Films, Blackbird, Cold Iron Pictures	$3,000,000	$4,935,501
tt3967856	Siêu Lợn Okja	A young girl risks everything to prevent a powerful, multinational company from kidnapping her best friend - a fascinating beast named Okja.		120.0	123314	7.3	Bong Joon Ho	Tilda Swinton, Paul Dano, Seo-hyun Ahn, Jake Gyllenhaal	Action, Adventure, Drama, Sci-Fi	animal rights activist,south korea,meat industry,animal liberation front,animal lover	June 28, 2017 (United States)	South Korea, United States	English, Korean, Spanish	South Korea	Kate Street Picture Company, Lewis Pictures, Plan B Entertainment	$50,000,000	$2,049,823
tt1228987	Cô Bạn Bí Ẩn	A bullied young boy befriends a young female vampire who lives in secrecy with her guardian.	R	116.0	123145	7.1	Matt Reeves	Kodi Smit-McPhee, Chloë Grace Moretz, Richard Jenkins, Cara Buono	Drama, Fantasy, Horror, Mystery, Thriller	vampire,bully,loneliness,remake,cigarette	October 1, 2010 (United States)	United Kingdom, United States	English	Moana Condominiums - 1100 Alvarado Drive SE, Albuquerque, New Mexico, USA	Overture Films, Exclusive Media Group, Hammer Films	$20,000,000	$27,093,592
tt0365907	Lối Đi Giữa Rừng Bia Mộ	Private investigator Matthew Scudder is hired by a drug kingpin to find out who kidnapped and murdered his wife.	R	114.0	122888	6.5	Scott Frank	Liam Neeson, Dan Stevens, David Harbour, Boyd Holbrook	Action, Crime, Drama, Mystery, Thriller	violence,drug dealer,revenge,murder of wife,ex cop	October 10, 2014 (Vietnam)	United States	English, Spanish, Urdu, Russian	Green-Wood Cemetery, Brooklyn, New York City, New York, USA	1984 Private Defense Contractors, Cross Creek Pictures, Da Vinci Media Ventures	$28,000,000	$58,834,384
tt0455407	Bệnh Điên	After a strange and insecure plane crash, an unusual toxic virus enters a quaint farming town. A young couple are quarantined, but they fight for survival along with help from a couple of people.	R	101.0	122736	6.5	Breck Eisner	Radha Mitchell, Timothy Olyphant, Danielle Panabaker, Joe Anderson	Adventure, Horror	sheriff,deputy,self sacrifice,house on fire,barn	February 26, 2010 (United States)	United States, United Arab Emirates	English	Winterset, Iowa, USA	Overture Films, Participant, Imagenation Abu Dhabi FZ	$20,000,000	$54,806,823
tt10954652	Già	A vacationing family discovers that the secluded beach where they're relaxing for a few hours is somehow causing them to age rapidly, reducing their entire lives into a single day.	PG-13	108.0	122530	5.8	M. Night Shyamalan	Gael García Bernal, Vicky Krieps, Rufus Sewell, Alex Wolff	Drama, Horror, Mystery, Thriller	aging,based on comic book,rapid aging,escape,death	July 23, 2021 (United States)	United States, Japan, China	English	Playa El Valle, Samana, Dominican Republic	Universal Pictures, Blinding Edge Pictures, Perfect World Pictures	$18,000,000	$90,146,510
tt10295212	Cuộc Chiến Kargil	Shershaah is the story of PVC awardee Indian soldier Capt. Vikram Batra, whose bravery and unflinching courage in chasing the Pakistani soldiers out of Indian territory contributed immensely in India finally winning the Kargil War in 1999.		135.0	122208	8.4	Vishnuvardhan	Sidharth Malhotra, Kiara Advani, Shiv Panditt, Pranay Pachauri	Action, Biography, Drama, War	soldier,kargil war,indian army,pakistan,indo pak	August 12, 2021 (India)	India	Hindi	Chandigarh, India	Dharma Productions		
tt1528854	Bố Ngoan, Bố Hư	Brad Whitaker is a radio host trying to get his stepchildren to love him and call him Dad. But his plans turn upside down when their biological father, Dusty Mayron, returns.	PG-13	96.0	122204	6.1	Sean Anders	Will Ferrell, Mark Wahlberg, Linda Cardellini, Thomas Haden Church	Comedy, Family	sweating,pull,pull ups,push,muscle	December 31, 2015 (Vietnam)	United States	English, Ukrainian	Metairie, Louisiana, USA	Paramount Pictures, Red Granite Pictures, Gary Sanchez Productions	$50,000,000	$242,786,137
tt2312718	Bước Đường Cùng	A former DEA agent moves his family to a quiet town, where he soon tangles with a local meth druglord.	R	100.0	122056	6.5	Gary Fleder	Jason Statham, James Franco, Winona Ryder, Kate Bosworth	Action, Crime, Thriller	gang leader,one against many,redneck,kidnapped child,father daughter relationship	December 6, 2013 (Vietnam)	United States	English	New Orleans, Louisiana, USA	Open Road Films (II), Endgame Entertainment, Millennium Films	$22,000,000	$48,449,416
tt2503944	Bùng Cháy	Adam Jones is a chef who destroyed his career with drugs and diva behavior. He cleans up and returns to London, determined to redeem himself by spearheading a top restaurant that can gain three Michelin stars.	R	101.0	121595	6.6	John Wells	Bradley Cooper, Sienna Miller, Daniel Brühl, Riccardo Scamarcio	Comedy, Drama	chef,restaurant,michelin star,abusive boss,waste of food	October 30, 2015 (United States)	United States, United Kingdom	English, French, Italian	The Langham Hotel, Regent Street, Marylebone London, England, UK	3 Arts Entertainment, Double Feature Films, PeaPie Films	$20,000,000	$36,606,743
