id	name	overview	certificate	runtime	nvote	imdb_rate	director	cast	genre	keyword	release_date	country	language	location	company	budget	gross
tt1375666	Kẻ Đánh Cắp Giấc Mơ	A thief who steals corporate secrets through the use of dream-sharing technology is given the inverse task of planting an idea into the mind of a C.E.O., but his tragic past may doom the project and his team to disaster.	PG-13	148.0	2356036	8.8	Christopher Nolan	Leonardo DiCaprio, Joseph Gordon-Levitt, Elliot Page, Ken Watanabe	Action, Adventure, Sci-Fi, Thriller	dream,ambiguous ending,subconscious,mindbender,surprise ending	August 6, 2010 (Vietnam)	United States, United Kingdom	English, Japanese, French	Fortress Mountain, Kananaskis Country, Alberta, Canada	Warner Bros., Legendary Entertainment, Syncopy	$160,000,000	$836,848,102
tt0816692	Hố Đen Tử Thần	A team of explorers travel through a wormhole in space in an attempt to ensure humanity's survival.	C13	169.0	1835446	8.6	Christopher Nolan	Matthew McConaughey, Anne Hathaway, Jessica Chastain, Mackenzie Foy	Adventure, Drama, Sci-Fi	astronaut,saving the world,space travel,wormhole,father daughter relationship	November 7, 2014 (Vietnam)	United States, United Kingdom, Canada	English	Iceland	Paramount Pictures, Warner Bros., Legendary Entertainment	$165,000,000	$773,867,216
tt1345836	Kỵ Sĩ Bóng Đêm Trỗi Dậy	Eight years after the Joker's reign of anarchy, Batman, with the help of the enigmatic Selina Kyle, is forced from his exile to save Gotham City from the brutal guerrilla terrorist Bane.	PG-13	164.0	1707832	8.4	Christopher Nolan	Christian Bale, Tom Hardy, Anne Hathaway, Gary Oldman	Action, Drama	dc comics,batman character,bruce wayne character,terrorist plot,sequel	July 27, 2012 (Vietnam)	United States, United Kingdom	English, Arabic	Mehrangarh Fort, Jodhpur, Rajasthan, India	Warner Bros., Legendary Entertainment, DC Entertainment	$250,000,000	$1,081,169,825
tt1853728	Hành Trình Django	With the help of a German bounty-hunter, a freed slave sets out to rescue his wife from a brutal plantation-owner in Mississippi.	R	165.0	1557694	8.4	Quentin Tarantino	Jamie Foxx, Christoph Waltz, Leonardo DiCaprio, Kerry Washington	Drama, Western	slavery,racial vengeance,racial violence,ku klux klan,one against many	March 15, 2013 (Vietnam)	United States	English, German, French, Italian	Evergreen Plantation, 4677 Highway 18, Edgard, Louisiana, USA	The Weinstein Company, Columbia Pictures	$100,000,000	$426,074,373
tt0993846	Sói Già Phố Wall	Based on the true story of Jordan Belfort, from his rise to a wealthy stock-broker living the high life to his fall involving crime, corruption and the federal government.	R	180.0	1414845	8.2	Martin Scorsese	Leonardo DiCaprio, Jonah Hill, Margot Robbie, Matthew McConaughey	Biography, Comedy, Crime, Drama	based on true story,stockbroker,debauchery,extramarital affair,oral sex	January 11, 2014 (Vietnam)	United States	English, French	Portofino, Genoa, Liguria, Italy	Red Granite Pictures, Appian Way, Sikelia Productions	$100,000,000	$406,878,233
tt0848228	Avengers: Biệt Đội Siêu Anh Hùng	Earth's mightiest heroes must come together and learn to fight as a team if they are going to stop the mischievous Loki and his alien army from enslaving humanity.	P	143.0	1393941	8.0	Joss Whedon	Robert Downey Jr., Chris Evans, Scarlett Johansson, Jeremy Renner	Action, Adventure, Sci-Fi	superhero,marvel cinematic universe,avengers,alien invasion,s.h.i.e.l.d.	April 27, 2012 (Vietnam)	United States	English, Russian, Hindi	East 9th St, Cleveland, Ohio, USA	Marvel Studios, Paramount Pictures	$220,000,000	$1,518,815,515
tt1130884	Đảo Kinh Hoàng	In 1954, a U.S. Marshal investigates the disappearance of a murderer who escaped from a hospital for the criminally insane.	R	138.0	1318938	8.2	Martin Scorsese	Leonardo DiCaprio, Emily Mortimer, Mark Ruffalo, Ben Kingsley	Mystery, Thriller	surprise ending,neo noir,medical experiment,cave,self delusion	April 2, 2010 (Vietnam)	United States	English, German	Peddocks Island, Boston Harbor, Boston, Massachusetts, USA	Paramount Pictures, Phoenix Pictures, Sikelia Productions	$80,000,000	$294,805,697
tt7286456	Joker	A mentally troubled stand-up comedian embarks on a downward spiral that leads to the creation of an iconic villain.	C18	122.0	1290152	8.4	Todd Phillips	Joaquin Phoenix, Robert De Niro, Zazie Beetz, Frances Conroy	Crime, Drama, Thriller	mental illness,evil clown,stand up comedian,nihilism,clown	October 4, 2019 (Vietnam)	United States, Canada	English	1150 Anderson Ave, The Bronx, New York City, New York, USA	Warner Bros., Village Roadshow Pictures, Village Roadshow Pictures	$55,000,000	$1,074,458,282
tt2015381	Vệ Binh Dải Ngân Hà	A group of intergalactic criminals must pull together to stop a fanatical warrior with plans to purge the universe.	C13	121.0	1183238	8.0	James Gunn	Chris Pratt, Vin Diesel, Bradley Cooper, Zoe Saldana	Action, Adventure, Comedy, Sci-Fi	outer space,bounty hunter,tree,based on comic book,talking animal	August 1, 2014 (Vietnam)	United States	English	Longcross Studios, Chobham Lane, Longcross, Surrey, England, UK	Marvel Studios, Walt Disney Pictures, Moving Pictures Company	$170,000,000	$773,350,147
tt4154796	Avengers: Hồi Kết	After the devastating events of Avengers: Cuộc Chiến Vô Cực (2018), the universe is in ruins. With the help of remaining allies, the Avengers assemble once more in order to reverse Thanos' actions and restore balance to the universe.	C13	181.0	1133945	8.4	Anthony Russo, Joe Russo	Robert Downey Jr., Chris Evans, Mark Ruffalo, Chris Hemsworth	Action, Adventure, Drama, Sci-Fi	time travel,superhero,super villain,cosmic,marvel cinematic universe	April 26, 2019 (Vietnam)	United States	English, Japanese, Xhosa, German	Durham Cathedral, The College, Durham, County Durham, England, UK	Marvel Studios, Walt Disney Pictures	$356,000,000	$2,797,501,328
tt4154756	Avengers: Cuộc Chiến Vô Cực	The Avengers and their allies must be willing to sacrifice all in an attempt to defeat the powerful Thanos before his blitz of devastation and ruin puts an end to the universe.	C16	149.0	1083740	8.4	Anthony Russo, Joe Russo	Robert Downey Jr., Chris Hemsworth, Mark Ruffalo, Chris Evans	Action, Adventure, Sci-Fi	superhero,death of recurring character,supervillain,ensemble cast,marvel cinematic universe	April 25, 2018 (Vietnam)	United States	English	Cockburn Street, Edinburgh, City of Edinburgh, Scotland, UK	Marvel Studios, Jason Roberts Productions, South Pictures	$321,000,000	$2,048,359,754
tt1431045	Deadpool	A wisecracking mercenary gets experimented on and becomes immortal but ugly, and sets out to track down the man who ruined his looks.	R	108.0	1041879	8.0	Tim Miller	Ryan Reynolds, Morena Baccarin, T.J. Miller, Ed Skrein	Action, Adventure, Comedy, Sci-Fi	breaking the fourth wall,anti hero,sex scene,mercenary,revenge	February 12, 2016 (Vietnam)	United States	English	Vancouver, British Columbia, Canada	Twentieth Century Fox, Marvel Entertainment, Kinberg Genre	$58,000,000	$782,836,791
tt1392190	Max Điên: Con Đường Tử Thần	In a post-apocalyptic wasteland, a woman rebels against a tyrannical ruler in search for her homeland with the aid of a group of female prisoners, a psychotic worshiper, and a drifter named Max.	C16	120.0	1006026	8.1	George Miller	Tom Hardy, Charlize Theron, Nicholas Hoult, Zoë Kravitz	Action, Adventure, Sci-Fi, Thriller	post apocalypse,desert,car chase,escape,chase	May 15, 2015 (Vietnam)	Australia	English, Russian	Namib Desert, Namibia	Village Roadshow Pictures, Kennedy Miller Productions	$150,000,000	$415,261,382
tt2267998	Cô Gái Mất Tích	With his wife's disappearance having become the focus of an intense media circus, a man sees the spotlight turned on him when it's suspected that he may not be innocent.	C18	149.0	986376	8.1	David Fincher	Ben Affleck, Rosamund Pike, Neil Patrick Harris, Tyler Perry	Drama, Mystery, Thriller	missing person,disappearance,murder suspect,husband wife relationship,based on novel	October 3, 2014 (Vietnam)	United States	English	Cape Girardeau, Missouri, USA	Twentieth Century Fox, New Regency Productions, TSG Entertainment	$61,000,000	$369,330,363
tt2488496	Chiến Tranh Giữa Các Vì Sao Tập 7: Thần Lực Thức Tỉnh	As a new threat to the galaxy rises, Rey, a desert scavenger, and Finn, an ex-stormtrooper, must join Han Solo and Chewbacca to search for the one hope of restoring peace.	P	138.0	933701	7.8	J.J. Abrams	Daisy Ridley, John Boyega, Oscar Isaac, Domhnall Gleeson	Action, Adventure, Sci-Fi	crash landing,reboot,actor reprises previous role,hatred,death	December 18, 2015 (Vietnam)	United States	English	Skellig Michael, County Kerry, Ireland	Lucasfilm, Bad Robot, Walt Disney Pictures	$245,000,000	$2,069,521,700
tt1392170	Đấu Trường Sinh Tử	Katniss Everdeen voluntarily takes her younger sister's place in the Hunger Games: a televised competition in which two teenagers from each of the twelve Districts of Panem are chosen at random to fight to the death.	(Banned)	142.0	922595	7.2	Gary Ross	Jennifer Lawrence, Josh Hutcherson, Liam Hemsworth, Stanley Tucci	Action, Adventure, Sci-Fi, Thriller	female protagonist,self survival,tough girl,teenage killer,child murderer	March 30, 2012 (Vietnam)	United States	English	Shelby, North Carolina, USA	Lionsgate, Color Force	$78,000,000	$694,394,724
tt1201607	Harry Potter và Bảo Bối Tử Thần: Phần 2	Harry, Ron, and Hermione search for Voldemort's remaining Horcruxes in their effort to destroy the Dark Lord as the final battle rages on at Hogwarts.	P	130.0	878804	8.1	David Yates	Daniel Radcliffe, Emma Watson, Rupert Grint, Michael Gambon	Adventure, Family, Fantasy, Mystery	friendship,snake,ginny weasley character,lucius malfoy character,hermione granger character	February 3, 2012 (Vietnam)	United Kingdom, United States	English, Latin	Freshwater West, Pembrokeshire, Wales, UK	Warner Bros., Heyday Films, Moving Picture Company (MPC)	$125,000,000	$1,342,359,942
tt2395427	Avengers: Đế Chế Ultron	When Tony Stark and Bruce Banner try to jump-start a dormant peacekeeping program called Ultron, things go horribly wrong and it's up to Earth's mightiest heroes to stop the villainous Ultron from enacting his terrible plan.	C13	141.0	867001	7.3	Joss Whedon	Robert Downey Jr., Chris Evans, Mark Ruffalo, Chris Hemsworth	Action, Adventure, Sci-Fi	superhero,marvel cinematic universe,artificial intelligence,hallucination,superhero team	April 24, 2015 (Vietnam)	United States	English, Korean	Chittagong, Bangladesh	Marvel Studios, Walt Disney Pictures	$250,000,000	$1,402,809,540
tt2582802	Tay Trống Cự Phách	A promising young drummer enrolls at a cut-throat music conservatory where his dreams of greatness are mentored by an instructor who will stop at nothing to realize a student's potential.	R	106.0	865526	8.5	Damien Chazelle	Miles Teller, J.K. Simmons, Melissa Benoist, Paul Reiser	Drama, Music	emotional abuse,drummer,music school,teacher student relationship,new york city	October 15, 2014 (Philippines)	United States	English	Santa Clarita, California, USA	Bold Films, Blumhouse Productions, Right of Way Films	$3,300,000	$49,396,747
tt1675434	Những Kẻ Bên Lề	After he becomes a quadriplegic from a paragliding accident, an aristocrat hires a young man from the projects to be his caregiver.	R	112.0	861363	8.5	Olivier Nakache, Éric Toledano	François Cluzet, Omar Sy, Anne Le Ny, Audrey Fleurot	Biography, Comedy, Drama	caregiver,class differences,disabled person,rich poor,paragliding	November 2, 2011 (France)	France	French, English	Cabourg, Calvados, France	Quad, Ten Films, Canal+	€9,500,000	$426,588,510
tt3659388	Người Về Từ Sao Hỏa	An astronaut becomes stranded on Mars after his team assume him dead, and must rely on his ingenuity to find a way to signal to Earth that he is alive and can survive until a potential rescue.	C13	144.0	858636	8.0	Ridley Scott	Matt Damon, Jessica Chastain, Kristen Wiig, Kate Mara	Adventure, Drama, Sci-Fi	astronaut,space habitat,left for dead,presumed dead,nasa	October 2, 2015 (Vietnam)	United States, United Kingdom, Hungary, Jordan	English, Mandarin	Wadi Rum, Jordan	Twentieth Century Fox, TSG Entertainment, Scott Free Productions	$108,000,000	$630,620,818
tt1300854	Người Sắt 3	When Tony Stark's world is torn apart by a formidable terrorist called the Mandarin, he starts an odyssey of rebuilding and retribution.	C13	130.0	853621	7.1	Shane Black	Robert Downey Jr., Guy Pearce, Gwyneth Paltrow, Don Cheadle	Action, Adventure, Sci-Fi	terrorist,billionaire,human bomb,armor,rescue	April 26, 2013 (Vietnam)	United States	English	Kenansville, North Carolina, USA	Marvel Studios, Paramount Pictures, DMG Entertainment	$200,000,000	$1,214,811,252
tt0800369	Thần Sấm Thor	The powerful but arrogant god Thor is cast out of Asgard to live amongst humans in Midgard (Earth), where he soon becomes one of their finest defenders.	PG-13	115.0	852915	7.0	Kenneth Branagh	Chris Hemsworth, Anthony Hopkins, Natalie Portman, Tom Hiddleston	Action, Adventure, Fantasy	loki character,scientist,marvel cinematic universe,nick fury character,clint barton character	April 29, 2011 (Vietnam)	United States	English	Cerro Pelon Movie Ranch - 5547 Highway 41, Galisteo, New Mexico, USA	Paramount Pictures, Marvel Entertainment, Marvel Studios	$150,000,000	$449,326,618
tt1843866	Captain America: Chiến Binh Mùa Đông	As Steve Rogers struggles to embrace his role in the modern world, he teams up with a fellow Avenger and S.H.I.E.L.D agent, Black Widow, to battle a new threat from history: an assassin known as the Winter Soldier.	C13	136.0	849239	7.8	Anthony Russo, Joe Russo	Chris Evans, Samuel L. Jackson, Scarlett Johansson, Robert Redford	Action, Adventure, Sci-Fi, Thriller	conspiracy,heroism,assassin,world domination,bionic arm	April 4, 2014 (Vietnam)	United States	English, French	West 3rd and Lakeside Avenue, Cleveland, Ohio, USA	Marvel Entertainment, Marvel Studios, Walt Disney Pictures	$170,000,000	$714,421,503
tt0458339	Captain America: Kẻ Báo Thù Đầu Tiên	"Steve Rogers, a rejected military soldier, transforms into Captain America after taking a dose of a ""Super-Soldier serum"". But being Captain America comes at a price as he attempts to take down a warmonger and a terrorist organization."	C13	124.0	848508	6.9	Joe Johnston	Chris Evans, Hugo Weaving, Samuel L. Jackson, Hayley Atwell	Action, Adventure, Sci-Fi	superhero,based on comic book,nazi,marvel comics,scientist	July 29, 2011 (Vietnam)	United States	English, Norwegian, French	Manchester, Greater Manchester, England, UK	Paramount Pictures, Marvel Entertainment, Marvel Studios	$140,000,000	$370,569,774
tt0435761	Câu Chuyện Đồ Chơi 3	The toys are mistakenly delivered to a day-care center instead of the attic right before Andy leaves for college, and it's up to Woody to convince the other toys that they weren't abandoned and to return home.	P	103.0	838765	8.3	Lee Unkrich	Tom Hanks, Tim Allen, Joan Cusack, Ned Beatty	Animation, Adventure, Comedy, Family, Fantasy	toy,evil teddy bear,recycling,sheriff,janitor	June 25, 2010 (Vietnam)	United States	English, Spanish	Pixar Animation Studios - 1200 Park Avenue, Emeryville, California, USA	Walt Disney Pictures, Pixar Animation Studios	$200,000,000	$1,066,970,811
tt0903624	Người Hobbit: Hành Trình Vô Định	A reluctant Hobbit, Bilbo Baggins, sets out to the Lonely Mountain with a spirited group of dwarves to reclaim their mountain home, and the gold within it from the dragon Smaug.	PG-13	169.0	832051	7.8	Peter Jackson	Martin Freeman, Ian McKellen, Richard Armitage, Andy Serkis	Adventure, Fantasy	wizard,hobbit,dragon,orc,sword and sorcery	December 28, 2012 (Vietnam)	New Zealand, United States	English	Mangaotaki, Waikato, New Zealand	Metro-Goldwyn-Mayer (MGM), New Line Cinema, WingNut Films	$180,000,000	$1,017,030,651
tt1454468	Cuộc Chiến Không Trọng Lực	Two astronauts work together to survive after an accident leaves them stranded in space.	PG-13	91.0	829141	7.7	Alfonso Cuarón	Sandra Bullock, George Clooney, Ed Harris, Orto Ignatiussen	Drama, Sci-Fi, Thriller	space station,female protagonist,sole survivor,long take,self sacrifice	October 11, 2013 (Vietnam)	United Kingdom, United States	English, Greenlandic	Space	Warner Bros., Esperanto Filmoj, Heyday Films	$100,000,000	$748,049,949
tt1228705	Người Sắt 2	With the world now aware of his identity as Iron Man, Tony Stark must contend with both his declining health and a vengeful mad man with ties to his father's legacy.	C13	124.0	820903	6.9	Jon Favreau	Robert Downey Jr., Mickey Rourke, Gwyneth Paltrow, Don Cheadle	Action, Adventure, Sci-Fi	superhero,billionaire,power suit,based on comic book,marvel comics	May 7, 2010 (Vietnam)	United States	English, French, Russian	Monaco	Paramount Pictures, Marvel Entertainment, Marvel Studios	$200,000,000	$623,933,331
tt2278388	Khách Sạn Đế Vương	A writer encounters the owner of an aging high-class hotel, who tells him of his early years serving as a lobby boy in the hotel's glorious years under an exceptional concierge.	R	99.0	814119	8.1	Wes Anderson	Ralph Fiennes, F. Murray Abraham, Mathieu Amalric, Adrien Brody	Adventure, Comedy, Crime	hotel,lobby boy,first person narration,painting,hotel lobby	March 6, 2014 (Germany)	United States, Germany	English, French, German	Görlitz, Saxony, Germany	Searchlight Pictures, Indian Paintbrush, Studio Babelsberg	$25,000,000	$173,082,189
tt1663202	Người Về Từ Cõi Chết	A frontiersman on a fur trading expedition in the 1820s fights for survival after being mauled by a bear and left for dead by members of his own hunting team.	R	156.0	808463	8.0	Alejandro G. Iñárritu	Leonardo DiCaprio, Tom Hardy, Will Poulter, Domhnall Gleeson	Action, Adventure, Drama, Western	survival,bear attack,left to die,fur,based on true story	February 5, 2016 (Vietnam)	Hong Kong, Taiwan, United States	English, Pawnee, French	Ushuaia, Tierra del Fuego, Argentina	New Regency Productions, RatPac Entertainment, New Regency Productions	$135,000,000	$532,950,503
tt6751668	Ký Sinh Trùng	Greed and class discrimination threaten the newly formed symbiotic relationship between the wealthy Park family and the destitute Kim clan.	C18	132.0	807122	8.5	Bong Joon Ho	Song Kang-ho, Lee Sun-kyun, Cho Yeo-jeong, Choi Woo-sik	Drama, Thriller	class differences,plot twist,social satire,fraud,house	June 21, 2019 (Vietnam)	South Korea	Korean, English	Jahamun-ro, Buam-dong, Jongno-gu, Seoul, South Korea	CJ Entertainment, Barunson E&A	$11,400,000	$262,676,096
tt3498820	Captain America: Nội Chiến Siêu Anh Hùng	Political involvement in the Avengers' affairs causes a rift between Captain America and Iron Man.	C16	147.0	791531	7.8	Anthony Russo, Joe Russo	Chris Evans, Robert Downey Jr., Scarlett Johansson, Sebastian Stan	Action, Adventure, Sci-Fi	marvel cinematic universe,based on comic book,superhero,siberia,friendship between men	April 27, 2016 (Vietnam)	United States	English, German, Xhosa, Russian, Romanian, Hindi	Puerto Rico	Marvel Studios, Vita-Ray Dutch Productions (III), Studio Babelsberg	$250,000,000	$1,153,337,496
tt1825683	Chiến Binh Báo Đen	T'Challa, heir to the hidden but advanced kingdom of Wakanda, must step forward to lead his people into a new future and must confront a challenger from his country's past.	C16	134.0	776649	7.3	Ryan Coogler	Chadwick Boseman, Michael B. Jordan, Lupita Nyong'o, Danai Gurira	Action, Adventure, Sci-Fi	marvel cinematic universe,marvel comics,based on comic book,king,african king	February 23, 2018 (Vietnam)	United States	English, Swahili, Nama, Xhosa, Korean	Iguazú Waterfalls, Misiones, Argentina	Marvel Studios, Walt Disney Pictures	$200,000,000	$1,382,248,826
tt0770828	Người Đàn Ông Thép	An alien child is evacuated from his dying world and sent to Earth to live among humans. His peace is threatened when other survivors of his home planet invade Earth.	PG-13	143.0	774837	7.1	Zack Snyder	Henry Cavill, Amy Adams, Michael Shannon, Diane Lane	Action, Adventure, Sci-Fi	superhero,reboot,clark kent character,origin of hero,superhero origin	June 14, 2013 (Vietnam)	United States, United Kingdom	English	Ucluelet, British Columbia, Canada	Warner Bros., Legendary Entertainment, Syncopy	$225,000,000	$668,045,518
tt2084970	Người Giải Mã	During World War II, the English mathematical genius Alan Turing tries to crack the German Enigma code with help from fellow mathematicians while attempting to come to terms with his troubled private life.	PG-13	114.0	773362	8.0	Morten Tyldum	Benedict Cumberbatch, Keira Knightley, Matthew Goode, Allen Leech	Biography, Drama, Thriller, War	cryptography,world war two,enigma code,closeted gay man,mathematician	November 14, 2014 (United Kingdom)	United Kingdom, United States	English, German	Sherborne School, Sherborne, Dorset, England, UK	Black Bear Pictures, FilmNation Entertainment, Bristol Automotive	$14,000,000	$233,555,708
tt0947798	Thiên Nga Đen	"A committed dancer struggles to maintain her sanity after winning the lead role in a production of Tchaikovsky's ""Swan Lake""."	R	108.0	771413	8.0	Darren Aronofsky	Natalie Portman, Mila Kunis, Vincent Cassel, Winona Ryder	Drama, Thriller	ballerina,ballet,female protagonist,mental illness,mother daughter relationship	March 25, 2011 (Vietnam)	United States	English, French, Italian	The Concert Hall, Performing Arts Center, Purchase College, State University Of New York at Purchase, Purchase, New York, USA	Searchlight Pictures, Cross Creek Pictures, Protozoa Pictures	$13,000,000	$329,398,046
tt3315342	Logan: Người Sói	In a future where mutants are nearly extinct, an elderly and weary Logan leads a quiet life. But when Laura, a mutant child pursued by scientists, comes to him for help, he must get her to safety.	C18	137.0	766504	8.1	James Mangold	Hugh Jackman, Patrick Stewart, Dafne Keen, Boyd Holbrook	Action, Drama, Sci-Fi, Thriller	marvel comics,x men,mutant,superhero,on the road	March 3, 2017 (Vietnam)	United States	English, Spanish	Just outside Northern Meadows community, Rio Rancho, New Mexico, USA	Twentieth Century Fox, Marvel Entertainment, TSG Entertainment	$97,000,000	$619,179,950
tt10872600	Người Nhện: Không Còn Nhà	With Spider-Man's identity now revealed, Peter asks Doctor Strange for help. When a spell goes wrong, dangerous foes from other worlds start to appear, forcing Peter to discover what it truly means to be Spider-Man.	C13	148.0	757984	8.2	Jon Watts	Tom Holland, Zendaya, Benedict Cumberbatch, Jacob Batalon	Action, Adventure, Fantasy, Sci-Fi	spider man character,marvel cinematic universe,multiverse,green goblin character,superhero	December 16, 2021 (Vietnam)	United States	English	Iceland	Columbia Pictures, Pascal Pictures, Marvel Studios	$200,000,000	$1,916,306,995
tt3501632	Thor: Tận Thế Ragnarok	Imprisoned on the planet Sakaar, Thor must race against time to return to Asgard and stop Ragnarök, the destruction of his world, at the hands of the powerful and ruthless villain Hela.	C13	130.0	755673	7.9	Taika Waititi	Chris Hemsworth, Tom Hiddleston, Cate Blanchett, Mark Ruffalo	Action, Adventure, Comedy, Fantasy, Sci-Fi	superhero,marvel comics,based on comic book,marvel cinematic universe,female villain	October 27, 2017 (Vietnam)	United States, Australia	English	Mount Tamborine, Queensland, Australia	Walt Disney Pictures, Marvel Studios, Government of Australia	$180,000,000	$853,983,879
tt1211837	Phù Thủy Tối Thượng	While on a journey of physical and spiritual healing, a brilliant neurosurgeon is drawn into the world of the mystic arts.	C13	115.0	746298	7.5	Scott Derrickson	Benedict Cumberbatch, Chiwetel Ejiofor, Rachel McAdams, Benedict Wong	Action, Adventure, Fantasy, Sci-Fi	magic,wizard,time loop,neurosurgeon,doctor	October 28, 2016 (Vietnam)	United States	English	Kathmandu, Nepal	Marvel Studios, Walt Disney Pictures	$165,000,000	$677,796,076
tt0892769	Bí Kíp Luyện Rồng	A hapless young Viking who aspires to hunt dragons becomes the unlikely friend of a young dragon himself, and learns there may be more to the creatures than he assumed.	P	98.0	743384	8.1	Dean DeBlois, Chris Sanders	Jay Baruchel, Gerard Butler, Christopher Mintz-Plasse, Craig Ferguson	Animation, Action, Adventure, Comedy, Family, Fantasy	dragon,viking,father son relationship,village,island	April 23, 2010 (Vietnam)	United States	English		DreamWorks Animation, Mad Hatter Entertainment, Vertigo Entertainment	$165,000,000	$494,879,471
tt7131622	Chuyện Ngày Xưa Ở... Hollywood	A faded television actor and his stunt double strive to achieve fame and success in the final years of Hollywood's Golden Age in 1969 Los Angeles.	C18	161.0	742315	7.6	Quentin Tarantino	Leonardo DiCaprio, Brad Pitt, Margot Robbie, Emile Hirsch	Comedy, Drama	manson murders,place in title,1960s,violence,film within a film	August 16, 2019 (Vietnam)	United States, United Kingdom, China	English, Italian, Spanish, German	Corriganville, Ray Corrigan Ranch, Simi Valley, California, USA	Columbia Pictures, Bona Film Group, Heyday Films	$90,000,000	$377,617,598
tt1392214	Lần Theo Dấu Vết	When Keller Dover's daughter and her friend go missing, he takes matters into his own hands as the police pursue multiple leads and the pressure mounts.	R	153.0	720644	8.1	Denis Villeneuve	Hugh Jackman, Jake Gyllenhaal, Viola Davis, Melissa Leo	Crime, Drama, Mystery, Thriller	child abduction,sex offender,police,vigilante justice,child kidnapping	October 4, 2013 (Vietnam)	United States	English	Conyers, Georgia, USA	Alcon Entertainment, 8:38 Productions, Madhouse Entertainment	$46,000,000	$122,126,687
